,place_id,name,main_category,phone,address,address_ward,address_street,address_city,address_postal_code,address_state,address_country_code,coordinates
0,ChIJyShuuTCIoDERJ0vRVxlMw3U,Siêu thị Thế Giới Di Động,Cửa hàng điện thoại di động,1900 232460,"Siêu thị Thế Giới Di Động, 217 Hẻm 132 Đ. 3 Tháng 2, P, Ninh Kiều, Cần Thơ 94000","P, Ninh Kiều",217 Hẻm 132 Đ. 3 Tháng 2,Cần Thơ,94000.0,"Ninh Kiều, Cần Thơ",VN,"10.0215374,105.7653174"
2,ChIJnw6pkmasNTERb00ZMgyVeW4,Cửa hàng AZ Mobile,Cửa hàng điện thoại di động,0846 955 555,"Cửa hàng AZ Mobile, 176 P. Xã Đàn, Phương Liên, Đống Đa, Hà Nội","Phương Liên, Đống Đa",176 P. Xã Đàn,Hà Nội,,"Đống Đa, Hà Nội",VN,"21.0108994,105.8375087"
3,ChIJAY_5_qdioDERjNlipdVq6r8,Hong Duc Head Honda,Cửa hàng xe máy,1800 545434,"Hong Duc Head Honda, 10-10E Nguyễn Trãi, An Hội, Ninh Kiều, Cần Thơ","An Hội, Ninh Kiều",10-10E Nguyễn Trãi,Cần Thơ,,"Ninh Kiều, Cần Thơ",VN,"10.043393499999999,105.7822803"
7,ChIJuZq9bfSJoDERUOR0Juaq8yI,CỬA HÀNG NGUYÊN LIỆU PHA CHẾ & BÁNH BẾP BAR CẦN THƠ,Cửa hàng,0397 959 143,"CỬA HÀNG NGUYÊN LIỆU PHA CHẾ & BÁNH BẾP BAR CẦN THƠ, 379 Đ. 30 Tháng 4, Hưng Lợi, Ninh Kiều, Cần Thơ","Hưng Lợi, Ninh Kiều",379 Đ. 30 Tháng 4,Cần Thơ,,"Ninh Kiều, Cần Thơ",VN,"10.0198231,105.7689475"
8,ChIJPSKWaDGIoDER06ZOxW7v-aE,Nhạc Cụ Trường Sa Cần Thơ,Cửa hàng nhạc cụ,0973 065 994,"Nhạc Cụ Trường Sa Cần Thơ, 512 Đ. 30 Tháng 4, Hưng Lợi, Ninh Kiều, Cần Thơ 900000","Hưng Lợi, Ninh Kiều",512 Đ. 30 Tháng 4,Cần Thơ,900000.0,"Ninh Kiều, Cần Thơ",VN,"10.017942999999999,105.7662113"
9,ChIJGTn7huKJoDER5OlkYTitiPM,Đồ Nghề Tự Chọn,Cửa hàng dụng cụ tự sửa chữa,0292 3666 888,"Đồ Nghề Tự Chọn, 239 Đ. Trần Hoàng Na, Hưng Lợi, Ninh Kiều, Cần Thơ 94116","Hưng Lợi, Ninh Kiều",239 Đ. Trần Hoàng Na,Cần Thơ,94116.0,"Ninh Kiều, Cần Thơ",VN,"10.0148707,105.76158489999999"
10,ChIJ8auZwjWIoDERCc9X7oc8bDk,Thiên Phúc Suzuki,Đại lý xe Suzuki,0292 3731 919,"Thiên Phúc Suzuki, 94-96-98 Đ. 3 Tháng 2, Hưng Lợi, Ninh Kiều, Cần Thơ 90000","Hưng Lợi, Ninh Kiều",94-96-98 Đ. 3 Tháng 2,Cần Thơ,90000.0,"Ninh Kiều, Cần Thơ",VN,"10.0165708,105.7602979"
11,ChIJV5IfL6lioDERqRBqd3ttzgI,Siêu Thị Điện Máy Nội Thất Chợ Lớn,Cửa hàng bán đồ điện tử,028 3856 3388,"Siêu Thị Điện Máy Nội Thất Chợ Lớn, 112 Trần Phú, Cái Khế, Ninh Kiều, Cần Thơ 90000","Cái Khế, Ninh Kiều",112 Trần Phú,Cần Thơ,90000.0,"Ninh Kiều, Cần Thơ",VN,"10.0474979,105.7830188"
12,ChIJF9R5Lo6rNTERP6IEIsGRWQU,Thực Dưỡng Homefood,Cửa hàng thực phẩm thiên nhiên,024 3972 9038,"Thực Dưỡng Homefood, 26 P. Trần Bình Trọng, Nguyễn Du, Hai Bà Trưng, Hà Nội 100000","Nguyễn Du, Hai Bà Trưng",26 P. Trần Bình Trọng,Hà Nội,100000.0,"Hai Bà Trưng, Hà Nội",VN,"21.0185319,105.84380069999999"
13,ChIJryMggh2IoDER8s2MYHn5x5c,Showroom iTamLoan,Cửa hàng điện thoại di động,1900 6459,"Showroom iTamLoan, 46-48 Trần Văn Khéo, An Hội, Ninh Kiều, Cần Thơ 900000","An Hội, Ninh Kiều",46-48 Trần Văn Khéo,Cần Thơ,900000.0,"Ninh Kiều, Cần Thơ",VN,"10.0448598,105.7846984"
15,ChIJZ5rnyduJoDERNrDpBsAX1kY,Tiệm Bạc Thanh Như - Bạc Cao Cấp Cần Thơ,Cửa hàng trang sức,0939 397 786,"Tiệm Bạc Thanh Như - Bạc Cao Cấp Cần Thơ, 51 Bế Văn Đàn, An Hoà, Ninh Kiều, Cần Thơ 90000","An Hoà, Ninh Kiều",51 Bế Văn Đàn,Cần Thơ,90000.0,"Ninh Kiều, Cần Thơ",VN,"10.0493201,105.7684603"
16,ChIJyTaV0qtioDERW0qqDYQIDCw,Moon Pet Shop,Cửa hàng vật nuôi,0902 530 200,"Moon Pet Shop, 10 Hùng Vương, Thới Bình, Ninh Kiều, Cần Thơ","Thới Bình, Ninh Kiều",10 Hùng Vương,Cần Thơ,,"Ninh Kiều, Cần Thơ",VN,"10.044869199999999,105.77934809999999"
17,ChIJMYULxWRjoDERmVir8gtFsVw,KLC - Cửa Hàng Ghế Massage Chính Hãng,Cửa hàng bán dụng cụ xoa bóp,0833 783 946,"KLC - Cửa Hàng Ghế Massage Chính Hãng, 100 Nguyễn Thái Học, Tân An, Ninh Kiều, Cần Thơ 94100","Tân An, Ninh Kiều",100 Nguyễn Thái Học,Cần Thơ,94100.0,"Ninh Kiều, Cần Thơ",VN,"10.0329949,105.7844234"
19,ChIJgV46dJ9ioDERnpzaZMG8U9A,Cửa hàng Honda Á Châu,Đại lý xe Honda,0292 3820 819,"Cửa hàng Honda Á Châu, 96-98 Đường Nguyễn An Ninh, Tân An, Ninh Kiều, Cần Thơ","Tân An, Ninh Kiều",96-98 Đường Nguyễn An Ninh,Cần Thơ,,"Ninh Kiều, Cần Thơ",VN,"10.0313953,105.7852094"
20,ChIJT8byj0WJoDERXX86J7NCn_k,YODY Nguyễn Trãi - Cần Thơ 2,Cửa hàng quần áo,0888 064 258,"YODY Nguyễn Trãi - Cần Thơ 2, 90-92 Nguyễn Trãi, An Hội, Ninh Kiều, Cần Thơ 94107","An Hội, Ninh Kiều",90-92 Nguyễn Trãi,Cần Thơ,94107.0,"Ninh Kiều, Cần Thơ",VN,"10.0429952,105.78261169999999"
22,ChIJYYvNCz2JoDERIkD_ETEpRb4,"Hoàng Anh Mobile - Cửa hàng bán lẻ điện thoại di động, smartphone, phụ kiện chính hãng Cần Thơ.",Cửa hàng điện thoại di động,0941 944 448,"Hoàng Anh Mobile - Cửa hàng bán lẻ điện thoại di động, smartphone, phụ kiện chính hãng Cần Thơ., 73 Đ. Cách Mạng Tháng 8, An Hoà, Ninh Kiều, Cần Thơ","An Hoà, Ninh Kiều",73 Đ. Cách Mạng Tháng 8,Cần Thơ,,"Ninh Kiều, Cần Thơ",VN,"10.0500803,105.7751681"
23,ChIJyfqRv1qJoDERghW7jkhSGU8,"Mũ Bảo Hiểm, Phụ Kiện Phượt Hebi.vn",Cửa hàng mũ,0399 999 344,"Mũ Bảo Hiểm, Phụ Kiện Phượt Hebi.vn, 455 Đ. 30 Tháng 4, Hưng Lợi, Ninh Kiều, Cần Thơ 94000","Hưng Lợi, Ninh Kiều",455 Đ. 30 Tháng 4,Cần Thơ,94000.0,"Ninh Kiều, Cần Thơ",VN,"10.014387,105.76272739999999"
25,ChIJCZBBJ1uJoDERfrbhsrSvgS8,Bella Shop,Cửa hàng quà tặng,0987 459 939,"Bella Shop, Liên Tổ 4-5/405D Đ. Nguyễn Văn Linh, Phường An Khánh, Ninh Kiều, Cần Thơ 900000","Phường An Khánh, Ninh Kiều",Liên Tổ 4-5/405D Đ. Nguyễn Văn Linh,Cần Thơ,900000.0,"Ninh Kiều, Cần Thơ",VN,"10.0239826,105.7587695"
27,ChIJ_5RN2xiIoDERSHyRhWbV1gY,Cửa Hàng Trang Sức PNJ Cần Thơ - 178 Trần Hưng Đạo,Cửa hàng trang sức,1800 545457,"Cửa Hàng Trang Sức PNJ Cần Thơ - 178 Trần Hưng Đạo, 178 Đ. Trần Hưng Đạo, P, Ninh Kiều, Cần Thơ 900000","P, Ninh Kiều",178 Đ. Trần Hưng Đạo,Cần Thơ,900000.0,"Ninh Kiều, Cần Thơ",VN,"10.0359822,105.77555869999999"
29,ChIJ9VamcM9joDEREXRv2g2n81I,Cửa hàng xe nhập khẩu Hồng Phúc,Đại lý xe gắn máy,0292 3822 919,"Cửa hàng xe nhập khẩu Hồng Phúc, 71 Nguyễn Trãi, An Hội, Ninh Kiều, Cần Thơ 90000","An Hội, Ninh Kiều",71 Nguyễn Trãi,Cần Thơ,90000.0,"Ninh Kiều, Cần Thơ",VN,"10.0405359,105.785043"
34,ChIJa1XpIZ9ioDERCTD1W1o1aB4,Cửa hàng Biti's - CH Phan Đình Phùng,Cửa hàng giày dép,0292 3827 014,"Cửa hàng Biti's - CH Phan Đình Phùng, 100 Phan Đình Phùng, Tân An, Ninh Kiều, Cần Thơ","Tân An, Ninh Kiều",100 Phan Đình Phùng,Cần Thơ,,"Ninh Kiều, Cần Thơ",VN,"10.029746399999999,105.7865514"
35,ChIJ2XpKGxSJoDERvRkzqeb4rHs,Siêu thị Bách hoá XANH 48 Nguyễn Đệ,Siêu thị,1900 1908,"Siêu thị Bách hoá XANH 48 Nguyễn Đệ, 48A Nguyễn Đệ, Khu Vực IV, P, Bình Thủy, Cần Thơ","P, Bình Thủy","48A Nguyễn Đệ, Khu Vực IV",Cần Thơ,,"Bình Thủy, Cần Thơ",VN,"10.049447599999999,105.7647545"
36,ChIJZyb86DqIoDERwALH1ZCSSVw,Cửa Hàng Satrafoods 101 (Cần Thơ),Siêu thị,0292 3822 743,"Cửa Hàng Satrafoods 101 (Cần Thơ), 162/6 Đ. Trần Ngọc Quế, Xuân Khánh, Ninh Kiều, Cần Thơ","Xuân Khánh, Ninh Kiều",162/6 Đ. Trần Ngọc Quế,Cần Thơ,,"Ninh Kiều, Cần Thơ",VN,"10.0244673,105.7686834"
37,ChIJjw9VUJ6JoDERbjlLZsobbe4,Nội Thất HomeOffice Cần Thơ,Cửa hàng nội thất,0906 897 138,"Nội Thất HomeOffice Cần Thơ, 311C/9, Đ. Hoàng Quốc Việt, Khu Vực 4, Ninh Kiều, Cần Thơ 900000","Khu Vực 4, Ninh Kiều","311C/9, Đ. Hoàng Quốc Việt",Cần Thơ,900000.0,"Ninh Kiều, Cần Thơ",VN,"10.0192031,105.7422804"
38,ChIJvxc2B1OJoDERB-ymIKta8UM,HƯỚNG DƯƠNG STORE - Chuyên Hàng Thanh Lý Giá Rẻ Cần Thơ,Cửa hàng quần áo nữ,0975 574 594,"HƯỚNG DƯƠNG STORE - Chuyên Hàng Thanh Lý Giá Rẻ Cần Thơ, 394/5 Hẻm Liên Tổ 4-5, Phường An Khánh, Ninh Kiều, Cần Thơ","Phường An Khánh, Ninh Kiều",394/5 Hẻm Liên Tổ 4-5,Cần Thơ,,"Ninh Kiều, Cần Thơ",VN,"10.021321,105.757722"
39,ChIJnUOpVISrNTERCa8ZdxBmKtE,Cửa hàng Mẹ Yêu Con,Cửa hàng,0916 827 455,"Cửa hàng Mẹ Yêu Con, số nhà 11, ngách 42, ngõ 29, P. Xã Đàn, Phương Liên, Đống Đa, Hà Nội","Phương Liên, Đống Đa","số nhà 11, ngách 42, ngõ 29, P. Xã Đàn",Hà Nội,,"Đống Đa, Hà Nội",VN,"21.011686899999997,105.83512309999999"
40,ChIJJ3IFYtSJoDERGBGDpkF7Ztk,Nam Anh PC,Cửa hàng máy tính,0947 201 751,"Nam Anh PC, 133 Đ.Xô Viết Nghệ Tĩnh, An Cư, Ninh Kiều, Cần Thơ 900000","An Cư, Ninh Kiều",133 Đ.Xô Viết Nghệ Tĩnh,Cần Thơ,900000.0,"Ninh Kiều, Cần Thơ",VN,"10.0409221,105.7813475"
41,ChIJA-AYGb2sNTER096Qs4MmsDY,NoLi Handmade Shop,Cửa hàng len,0988 979 251,"NoLi Handmade Shop, Ng. 63 P. Ô Đồng Lầm, Phương Liên, Đống Đa, Hà Nội 100000","Phương Liên, Đống Đa",Ng. 63 P. Ô Đồng Lầm,Hà Nội,100000.0,"Đống Đa, Hà Nội",VN,"21.0130573,105.8385059"
42,ChIJ5YkpCZyrNTERtorcAJ3VsAs,Cửa hàng quà tặng Pandagift,Cửa hàng quà tặng,0976 517 628,"Cửa hàng quà tặng Pandagift, 28 Ng. Thông Phong, Quốc Tử Giám, Đống Đa, Hà Nội 100000","Quốc Tử Giám, Đống Đa",28 Ng. Thông Phong,Hà Nội,100000.0,"Đống Đa, Hà Nội",VN,"21.0254618,105.8345543"
43,ChIJu6L6sQWIoDERHJBWXHwShGA,Cửa hàng đặc sản khô mắm An Giang tại Cần Thơ,Cửa hàng tạp phẩm,0966 111 156,"Cửa hàng đặc sản khô mắm An Giang tại Cần Thơ, Hẻm 77C Đ. Phạm Ngũ Lão, Thới Bình, Ninh Kiều, Cần Thơ","Thới Bình, Ninh Kiều",Hẻm 77C Đ. Phạm Ngũ Lão,Cần Thơ,,"Ninh Kiều, Cần Thơ",VN,"10.045294799999999,105.7757948"
44,ChIJ28skeBSJoDERZ_hxVN31Yow,Di Động Việt,Cửa hàng điện thoại di động,1800 6018,"Di Động Việt, 24B Nguyễn Trãi, Thới Bình, Ninh Kiều, Cần Thơ 900000","Thới Bình, Ninh Kiều",24B Nguyễn Trãi,Cần Thơ,900000.0,"Ninh Kiều, Cần Thơ",VN,"10.045194799999999,105.7804748"
45,ChIJddwY9YGJoDERthmbXWw-tYk,CƯỜNG MOBILE CẦN THƠ,Cửa hàng điện thoại di động,0911 774 444,"CƯỜNG MOBILE CẦN THƠ, 119 Xô Viết Nghĩa Tĩnh, P, Ninh Kiều, Cần Thơ 900000","P, Ninh Kiều",119 Xô Viết Nghĩa Tĩnh,Cần Thơ,900000.0,"Ninh Kiều, Cần Thơ",VN,"10.0407406,105.7815342"
47,ChIJSd48Cw-IoDERQ8iEZT9sAc4,"PNJ Cần Thơ - Cửa hàng Trang sức PNJ - 208 Nguyễn Văn Cừ, Cần Thơ",Cửa hàng trang sức,1800 545457,"PNJ Cần Thơ - Cửa hàng Trang sức PNJ - 208 Nguyễn Văn Cừ, Cần Thơ, Q, 208 Đ. Nguyễn Văn Cừ, P, Ninh Kiều, Cần Thơ 900000","P, Ninh Kiều","Q, 208 Đ. Nguyễn Văn Cừ",Cần Thơ,900000.0,"Ninh Kiều, Cần Thơ",VN,"10.0516016,105.77304939999999"
49,ChIJdwejQI2rNTERl7OejlESydQ,Cửa Hàng Thái Tuấn,Cửa hàng quần áo,024 3943 9097,"Cửa Hàng Thái Tuấn, Quận, 74 P. Huế, Bùi Thị Xuân, Hai Bà Trưng, Hà Nội 11650","Bùi Thị Xuân, Hai Bà Trưng","Quận, 74 P. Huế",Hà Nội,11650.0,"Hai Bà Trưng, Hà Nội",VN,"21.0175368,105.85124239999999"
50,ChIJqxOAC-qrNTERDHKTSN0Vwmw,SURI STORE,Cửa hàng đồ trẻ em,0981 228 666,"SURI STORE, 152 Đ. Lê Duẩn, Khâm Thiên, Đống Đa, Hà Nội","Khâm Thiên, Đống Đa",152 Đ. Lê Duẩn,Hà Nội,,"Đống Đa, Hà Nội",VN,"21.0177369,105.84129569999999"
51,ChIJKTm9rLyJoDERSnE3kpx03qk,COMI · Thanh Lý Ký Gửi,Cửa hàng quần áo nữ,0907 901 685,"COMI · Thanh Lý Ký Gửi, 52/2B Hùng Vương, An Cư, Ninh Kiều, Cần Thơ 900000","An Cư, Ninh Kiều",52/2B Hùng Vương,Cần Thơ,900000.0,"Ninh Kiều, Cần Thơ",VN,"10.0445563,105.7781648"
52,ChIJIXHU-qdioDERj6Nv8a3e2Z4,Cửa Hàng Biti's Nguyễn Trãi,Cửa hàng giày dép,0292 3769 027,"Cửa Hàng Biti's Nguyễn Trãi, 02A Nguyễn Trãi, An Hội, Ninh Kiều, Cần Thơ","An Hội, Ninh Kiều",02A Nguyễn Trãi,Cần Thơ,,"Ninh Kiều, Cần Thơ",VN,"10.0428141,105.78289799999999"
56,ChIJ04NRVIyrNTERj5GWLodXewU,Tingoan Store,Cửa hàng quần áo,0984 054 291,"Tingoan Store, 100 P. Bà Triệu, Nguyễn Du, Hai Bà Trưng, Hà Nội","Nguyễn Du, Hai Bà Trưng",100 P. Bà Triệu,Hà Nội,,"Hai Bà Trưng, Hà Nội",VN,"21.0184096,105.8490813"
57,ChIJzXQBsKFioDER5TNfnz2usPY,Cửa Hàng Trang Sức PNJ Sense City Cần Thơ,Cửa hàng trang sức,1800 545457,"Cửa Hàng Trang Sức PNJ Sense City Cần Thơ, 01 Đại lộ Hoà Bình, P, Ninh Kiều, Cần Thơ 94000","P, Ninh Kiều",01 Đại lộ Hoà Bình,Cần Thơ,94000.0,"Ninh Kiều, Cần Thơ",VN,"10.0354662,105.7865447"
58,ChIJXxOhcg-IoDERmB1nVuYmXQg,LEE&TEE,Cửa hàng túi xách,0919 002 236,"LEE&TEE, 243 Đ. Nguyễn Văn Cừ, An Hoà, Ninh Kiều, Cần Thơ 94000","An Hoà, Ninh Kiều",243 Đ. Nguyễn Văn Cừ,Cần Thơ,94000.0,"Ninh Kiều, Cần Thơ",VN,"10.0475216,105.76888609999999"
59,ChIJp-yVh5OJoDERqWH-2YxBhiM,Shop Cầu Lông Tyn Sport,Cửa hàng quần áo thể thao,0932 777 808,"Shop Cầu Lông Tyn Sport, 134A Nguyễn Văn Cừ Nối Dài, Phường An Khánh, Ninh Kiều, Cần Thơ 900000","Phường An Khánh, Ninh Kiều",134A Nguyễn Văn Cừ Nối Dài,Cần Thơ,900000.0,"Ninh Kiều, Cần Thơ",VN,"10.041699,105.7635645"
61,ChIJWVToY4yrNTERPNognO0eEn0,Cửa Hàng Ô Mai Chanh - OMAI BA THU,Cửa hàng,024 3992 3699,"Cửa Hàng Ô Mai Chanh - OMAI BA THU, 147 P. Bà Triệu, Bùi Thị Xuân, Hai Bà Trưng, Hà Nội 100000","Bùi Thị Xuân, Hai Bà Trưng",147 P. Bà Triệu,Hà Nội,100000.0,"Hai Bà Trưng, Hà Nội",VN,"21.0144253,105.8493273"
62,ChIJgT87YJGrNTERGfkIG5rSfmw,Cửa hàng rượu vang 10 Dã Tượng - Wine shop,Cửa hàng rượu,024 3943 7226,"Cửa hàng rượu vang 10 Dã Tượng - Wine shop, 10 P. Dã Tượng, Trần Hưng Đạo, Hoàn Kiếm, Hà Nội","Trần Hưng Đạo, Hoàn Kiếm",10 P. Dã Tượng,Hà Nội,,"Hoàn Kiếm, Hà Nội",VN,"21.023577799999998,105.84647079999999"
63,ChIJn766hwWJoDERJpKFGOqEu3o,Đèn Trang Trí LED.160,Cửa hàng bán đồ điện tử,0903 920 047,"Đèn Trang Trí LED.160, 709 Đ. Nguyễn Văn Cừ, Phường An Khánh, Ninh Kiều, Cần Thơ 94117","Phường An Khánh, Ninh Kiều",709 Đ. Nguyễn Văn Cừ,Cần Thơ,94117.0,"Ninh Kiều, Cần Thơ",VN,"10.0417334,105.7635624"
64,ChIJdVbnsn6rNTERY5kXSTQU530,"Cửa Hàng Yến Sào Quang Lâm - 332 P. Xã Đàn, Đống Đa.",Cửa hàng bán thực phẩm sạch,0907 266 999,"Cửa Hàng Yến Sào Quang Lâm - 332 P. Xã Đàn, Đống Đa., 332 P. Xã Đàn, Phương Liên, Đống Đa, Hà Nội 11557","Phương Liên, Đống Đa",332 P. Xã Đàn,Hà Nội,11557.0,"Đống Đa, Hà Nội",VN,"21.013728399999998,105.834991"
65,ChIJfZeSQrOJoDERD4-DlrDzgVQ,WinMart+,Cửa hàng tạp phẩm,1800 6968,"2Q62+CPX WinMart+, An Bình, Ninh Kiều, Cần Thơ","An Bình, Ninh Kiều",2Q62+CPX,Cần Thơ,,"Ninh Kiều, Cần Thơ",VN,"10.0111248,105.75185379999999"
66,ChIJS9ygWvmJoDER3A98dE6ZqfA,Giấy Dán Tường Cần Thơ - Thành Nhân,Cửa hàng giấy dán tường,0901 099 441,"Giấy Dán Tường Cần Thơ - Thành Nhân, 321 Đ. Nguyễn Đệ, An Hoà, Ninh Kiều, Cần Thơ 94108","An Hoà, Ninh Kiều",321 Đ. Nguyễn Đệ,Cần Thơ,94108.0,"Ninh Kiều, Cần Thơ",VN,"10.0486261,105.76366039999999"
67,ChIJHQC5jomJoDERlthyjY1GBgI,Cửa Hàng Văn Phúc KSTtool - Đồ Nghề và Dụng Cụ Cầm Tay,Cửa hàng dụng cụ,0768 889 970,"Cửa Hàng Văn Phúc KSTtool - Đồ Nghề và Dụng Cụ Cầm Tay, 116A2 Mậu Thân Nối Dài, Ninh Kiều, Cần Thơ 94000","An Hoà, Ninh Kiều",116A2 Mậu Thân Nối Dài,Cần Thơ,94000.0,"Ninh Kiều, Cần Thơ",VN,"10.044838799999999,105.7642305"
68,ChIJW6Il4pOrNTERm_eXZBwO8-A,Cửa hàng in và văn phòng phẩm Thanh Nga,Cửa hàng in ấn,024 3942 8048,"Cửa hàng in và văn phòng phẩm Thanh Nga, 2 P. Dã Tượng, Trần Hưng Đạo, Hoàn Kiếm, Hà Nội","Trần Hưng Đạo, Hoàn Kiếm",2 P. Dã Tượng,Hà Nội,,"Hoàn Kiếm, Hà Nội",VN,"21.0241154,105.8466653"
69,ChIJH2vuFoerNTERgbdDilyaDlc,May 10 HÀ NỘI - Cửa Hàng May 10 Phạm Ngọc Thạch,Cửa hàng phụ kiện thời trang,0978 602 306,"May 10 HÀ NỘI - Cửa Hàng May 10 Phạm Ngọc Thạch, 22 P.Phạm Ngọc Thạch, Kim Liên, Đống Đa, Hà Nội","Kim Liên, Đống Đa",22 P.Phạm Ngọc Thạch,Hà Nội,,"Đống Đa, Hà Nội",VN,"21.0094137,105.83543399999999"
70,ChIJFdZDyiWIoDERRa-XFKKSKEc,Cửa hàng Mắt Kính AN GIA OPTIC,Cửa hàng kính mát,0888 199 991,"Cửa hàng Mắt Kính AN GIA OPTIC, Xuân Khánh, Ninh Kiều, Cần Thơ","Xuân Khánh, Ninh Kiều",,Cần Thơ,,"Ninh Kiều, Cần Thơ",VN,"10.0251855,105.7743035"
71,ChIJF8xUHKpioDEROtlsI9Xe9aM,Cửa Hàng Phụ Liệu Tóc Nail Toàn Mỹ,Cửa hàng mỹ phẩm,0292 3769 954,"Cửa Hàng Phụ Liệu Tóc Nail Toàn Mỹ, 07 Đ. Hồ Tùng Mậu, Thới Bình, Ninh Kiều, Cần Thơ","Thới Bình, Ninh Kiều",07 Đ. Hồ Tùng Mậu,Cần Thơ,,"Ninh Kiều, Cần Thơ",VN,"10.0467982,105.7825927"
75,ChIJt-WIoAKIoDER6N_sUMw2_HY,Mỹ Phẩm Phượng Cần Thơ,Cửa hàng mỹ phẩm,0918 363 774,"Mỹ Phẩm Phượng Cần Thơ, 16 Trần Quang Khải, Cái Khế, Ninh Kiều, Cần Thơ 940000","Cái Khế, Ninh Kiều",16 Trần Quang Khải,Cần Thơ,940000.0,"Ninh Kiều, Cần Thơ",VN,"10.0447486,105.78185959999999"
76,ChIJ8UYHox-IoDERAJnuRoAqOjQ,Cửa Hàng Máy May Nguyệt Trung,Cửa hàng máy khâu,0292 3833 758,"Cửa Hàng Máy May Nguyệt Trung, 18 Đ. Lý Tự Trọng, P, Ninh Kiều, Cần Thơ 901745","P, Ninh Kiều",18 Đ. Lý Tự Trọng,Cần Thơ,901745.0,"Ninh Kiều, Cần Thơ",VN,"10.0343708,105.77975649999999"
77,ChIJE3Zmm4yrNTERgO2MnjHx9BI,Elegante Shop,Cửa hàng quần áo nữ,0372 437 262,"Elegante Shop, 152E P. Triệu Việt Vương, Bùi Thị Xuân, Hai Bà Trưng, Hà Nội 112300","Bùi Thị Xuân, Hai Bà Trưng",152E P. Triệu Việt Vương,Hà Nội,112300.0,"Hai Bà Trưng, Hà Nội",VN,"21.0135969,105.8503583"
78,ChIJVwd7xTWIoDERNxjubbVquwM,Đồ gỗ Sơn Đông - Chi Nhánh Cần Thơ,Cửa hàng nội thất,0934 174 886,"Đồ gỗ Sơn Đông - Chi Nhánh Cần Thơ, 99b Đ. 3 Tháng 2, Hưng Lợi, Ninh Kiều, Cần Thơ","Hưng Lợi, Ninh Kiều",99b Đ. 3 Tháng 2,Cần Thơ,,"Ninh Kiều, Cần Thơ",VN,"10.016565499999999,105.7608411"
80,ChIJYYTDZ4KrNTERNeC6pPy_BX4,Bubble store,Cửa hàng quần áo,0967 408 333,"Bubble store, 269 P. Xã Đàn, Nam Đồng, Đống Đa, Hà Nội 100000","Nam Đồng, Đống Đa",269 P. Xã Đàn,Hà Nội,100000.0,"Đống Đa, Hà Nội",VN,"21.0173457,105.83043479999999"
81,ChIJo-WfvsyJoDERxh2gnM0q-aA,"Cửa hàng Gas4.0 &more P. Hưng Lợi, Q. Ninh Kiều",Cửa hàng ga,1900 1740,"Cửa hàng Gas4.0 &more P. Hưng Lợi, Q. Ninh Kiều, 55 Đ. Trần Hoàng Na, Hưng Lợi, Ninh Kiều, Cần Thơ 94000","Hưng Lợi, Ninh Kiều",55 Đ. Trần Hoàng Na,Cần Thơ,94000.0,"Ninh Kiều, Cần Thơ",VN,"10.0106345,105.7655625"
82,ChIJb_3bKaBioDERK0_UFr-jABM,Cửa hàng điện tử & Điện Gia Dụng Trần Phát,Cửa hàng bán đồ điện tử,0292 3827 287,"Cửa hàng điện tử & Điện Gia Dụng Trần Phát, 83 Võ Văn Tần, Tân An, Ninh Kiều, Cần Thơ","Tân An, Ninh Kiều",83 Võ Văn Tần,Cần Thơ,,"Ninh Kiều, Cần Thơ",VN,"10.0325227,105.7844825"
83,ChIJl6oGu6FioDERRXFENifMRL0,Cửa Hàng PNJ Co.op Cần Thơ,Cửa hàng bán buôn trang sức,0292 3815 305,"Cửa Hàng PNJ Co.op Cần Thơ, 01 Đại lộ Hoà Bình, P, Ninh Kiều, Cần Thơ","P, Ninh Kiều",01 Đại lộ Hoà Bình,Cần Thơ,,"Ninh Kiều, Cần Thơ",VN,"10.0341908,105.785592"
84,ChIJHYKLaJKrNTERd_o4lukLM2s,Cửa Hàng Chả Mực Thoan,Cửa hàng thực phẩm,0904 058 866,"Cửa Hàng Chả Mực Thoan, 1 P. Trương Hán Siêu, Trần Hưng Đạo, Hoàn Kiếm, Hà Nội","Trần Hưng Đạo, Hoàn Kiếm",1 P. Trương Hán Siêu,Hà Nội,,"Hoàn Kiếm, Hà Nội",VN,"21.020510899999998,105.8491943"
85,ChIJZeEutABjoDERKI6iNaiX9uQ,Miniso,Cửa hàng tạp phẩm,,"Miniso, 01 Đại lộ Hoà Bình, Tân An, Ninh Kiều, Cần Thơ","Tân An, Ninh Kiều",01 Đại lộ Hoà Bình,Cần Thơ,,"Ninh Kiều, Cần Thơ",VN,"10.0342149,105.78563559999999"
87,ChIJk0IFl8mJoDERC_cUesv6w4g,Cửa Hàng Trang Sức PNJ Lotte Mart Cần Thơ,Cửa hàng trang sức,1800 545457,"Cửa Hàng Trang Sức PNJ Lotte Mart Cần Thơ, Kiosk 1F15-A +1F16, Tầng trệt siêu thị Lotte, 84 Đ. Mậu Thân, P, Ninh Kiều, Cần Thơ","P, Ninh Kiều","Kiosk 1F15-A +1F16, Tầng trệt siêu thị Lotte, 84 Đ. Mậu Thân",Cần Thơ,,"Ninh Kiều, Cần Thơ",VN,"10.0417755,105.76718"
89,ChIJ6YfULpCrNTER-Q5OR4a_9WQ,Cửa Hàng Bohemia,Cửa hàng,024 3942 6707,"Cửa Hàng Bohemia, 88A, Nguyễn Du, Quận Hai Bà Trưng, Thành Phố Hà Nội, Nguyễn Du, Hai Bà Trưng, Hà Nội 100000","Nguyễn Du, Hai Bà Trưng","88A, Nguyễn Du, Quận Hai Bà Trưng, Thành Phố Hà Nội",Hà Nội,100000.0,"Hai Bà Trưng, Hà Nội",VN,"21.0202956,105.84303229999999"
90,ChIJMzMccjSIoDEReJZPN8Q7Pr8,Cửa hàng nệm Cần Thơ - Showroom Liên Á,Cửa hàng bán đệm,1800 9003,"Cửa hàng nệm Cần Thơ - Showroom Liên Á, 427 Đ. 30 Tháng 4, Hưng Lợi, Ninh Kiều, Cần Thơ 94000","Hưng Lợi, Ninh Kiều",427 Đ. 30 Tháng 4,Cần Thơ,94000.0,"Ninh Kiều, Cần Thơ",VN,"10.014985,105.7635631"
92,ChIJ11S3uzqIoDERwYf18W1S6XY,Cửa Hàng Nhân Sâm Thảo Lâm,Siêu thị,0916 176 464,"Cửa Hàng Nhân Sâm Thảo Lâm, 5A Đ. Trần Ngọc Quế, Xuân Khánh, Ninh Kiều, Cần Thơ","Xuân Khánh, Ninh Kiều",5A Đ. Trần Ngọc Quế,Cần Thơ,,"Ninh Kiều, Cần Thơ",VN,"10.0233125,105.7691904"
95,ChIJDWMBzY1joDER4f4ghVVaav0,Circle K Viet Nam,Cửa hàng tiện lợi,0292 3780 129,"Circle K Viet Nam, 129 Trần Văn Khéo, Cái Khế, Ninh Kiều, Cần Thơ","Cái Khế, Ninh Kiều",129 Trần Văn Khéo,Cần Thơ,,"Ninh Kiều, Cần Thơ",VN,"10.0460504,105.7863567"
97,ChIJ4yaWoo-rNTERAldP0SEk3F4,Cửa Hàng Anh Duy Audio,Cửa hàng bán đồ điện tử,024 3972 5014,"Cửa Hàng Anh Duy Audio, 70 P. Trần Nhân Tông, Nguyễn Du, Hai Bà Trưng, Hà Nội","Nguyễn Du, Hai Bà Trưng",70 P. Trần Nhân Tông,Hà Nội,,"Hai Bà Trưng, Hà Nội",VN,"21.0176068,105.8425869"
98,ChIJ7ZuhOsWrNTER2lFsO3MlwLQ,Cửa Hàng Đồ lót đồ ngủ Mialala Phạm Ngọc Thạch,Cửa hàng đồ lót,0379 455 365,"Cửa Hàng Đồ lót đồ ngủ Mialala Phạm Ngọc Thạch, 105B6 P.Phạm Ngọc Thạch, Trung Tự, Đống Đa, Hà Nội 10000","Trung Tự, Đống Đa",105B6 P.Phạm Ngọc Thạch,Hà Nội,10000.0,"Đống Đa, Hà Nội",VN,"21.0099542,105.83550389999999"
99,ChIJu3JecC2IoDERtN3ONlKk6zk,Cửa Hàng trà thảo dược An Khang,Cửa hàng trà,0939 889 262,"Cửa Hàng trà thảo dược An Khang, 246/8/9, Tầm Vu, Hưng Lợi, Ninh Kiều, Cần Thơ 94100","Hưng Lợi, Ninh Kiều","246/8/9, Tầm Vu",Cần Thơ,94100.0,"Ninh Kiều, Cần Thơ",VN,"10.0142334,105.76983779999999"
100,ChIJ3dtQsOeHoDERo2gjHHvUGBM,Chi nhánh Cần Thơ - Tổng công ty 28 và Cửa hàng Belluni Công ty kinh doanh thời trang 28,Doanh nghiệp bán vé sự kiện,0962 730 930,"Chi nhánh Cần Thơ - Tổng công ty 28 và Cửa hàng Belluni Công ty kinh doanh thời trang 28, 234 Võ Văn Kiệt, An Thới, Ninh Kiều, Cần Thơ 92000","An Thới, Ninh Kiều",234 Võ Văn Kiệt,Cần Thơ,92000.0,"Ninh Kiều, Cần Thơ",VN,"10.049421299999999,105.7571289"
102,ChIJL62wiEOIoDERwcNX8sZpbiM,NỘI THẤT NGỌC TÂN,Cửa hàng nội thất,0907 467 666,"NỘI THẤT NGỌC TÂN, 386 Đ. Nguyễn Văn Cừ, Phường An Khánh, Ninh Kiều, Cần Thơ","Phường An Khánh, Ninh Kiều",386 Đ. Nguyễn Văn Cừ,Cần Thơ,,"Ninh Kiều, Cần Thơ",VN,"10.0365826,105.7584193"
103,ChIJR3TZaRGJoDERwjXFF4dP7Mw,Cửa Hàng Mắt Kính Mắt Việt,Cửa hàng phụ kiện thời trang,1900 6081,"Cửa Hàng Mắt Kính Mắt Việt, PG 102 Trung tâm thương mại Vincom, 209 Hẻm 553, Xuân Khánh, Ninh Kiều, Cần Thơ 900000","Xuân Khánh, Ninh Kiều","PG 102 Trung tâm thương mại Vincom, 209 Hẻm 553",Cần Thơ,900000.0,"Ninh Kiều, Cần Thơ",VN,"10.0114454,105.7602246"
105,ChIJA-NAy6eHoDERu7sHC9d3gO0,Cửa Hàng LED Hiệp Tân Cần Thơ,Cửa hàng bán đồ điện tử,0292 7300 990,"Cửa Hàng LED Hiệp Tân Cần Thơ, 158 Đ. Cách Mạng Tháng 8, Cái Khế, Ninh Kiều, Cần Thơ","Cái Khế, Ninh Kiều",158 Đ. Cách Mạng Tháng 8,Cần Thơ,,"Ninh Kiều, Cần Thơ",VN,"10.0516592,105.77395899999999"
108,ChIJtbm1GIuJoDERAK_IKO2gt3I,Hưng Phát Sài Gòn Tại Cần Thơ Cửa Hàng Nội Thất Bàn Ghế Sofa,Cửa hàng nội thất,0898 655 119,"Hưng Phát Sài Gòn Tại Cần Thơ Cửa Hàng Nội Thất Bàn Ghế Sofa, 391 Đ. Nguyễn Văn Cừ, An Hoà, Ninh Kiều, Cần Thơ 900000","An Hoà, Ninh Kiều",391 Đ. Nguyễn Văn Cừ,Cần Thơ,900000.0,"Ninh Kiều, Cần Thơ",VN,"10.043996,105.76596099999999"
