,place_id,name,main_category,phone,address,address_ward,address_street,address_city,address_postal_code,address_state,address_country_code,coordinates
204,ChIJe4d_8o9joDERS4qbsHTPh3I,Triumph Cần Thơ 4,Cửa hàng bán đồ lót phụ nữ,0292 3769 669,"Triumph Cần Thơ 4, 9 Trần Văn Khéo, An Hội, Ninh Kiều, Cần Thơ 900000","An Hội, Ninh Kiều",9 Trần Văn Khéo,Cần Thơ,900000.0,"Ninh Kiều, Cần Thơ",VN,"10.0435511,105.782578"
205,ChIJ1weZ-haJoDER2PTRK_entTQ,Showroom Đông Trùng Hạ Thảo Đăng Thoa,Cửa hàng thực phẩm hữu cơ,0988 151 670,"Showroom Đông Trùng Hạ Thảo Đăng Thoa, 47a Đ. Nguyễn Đệ, An Hoà, Ninh Kiều, Cần Thơ 94108","An Hoà, Ninh Kiều",47a Đ. Nguyễn Đệ,Cần Thơ,94108.0,"Ninh Kiều, Cần Thơ",VN,"10.049418,105.7652045"
206,ChIJwW01cuyJoDERAp-624oAJrM,Cửa Hàng VNPT VinaPhone Võ Trường Toản,Cửa hàng,0913 186 667,"Cửa Hàng VNPT VinaPhone Võ Trường Toản, 49/53 Đ. Võ Trường Toản, An Hoà, Ninh Kiều, Cần Thơ","An Hoà, Ninh Kiều",49/53 Đ. Võ Trường Toản,Cần Thơ,,"Ninh Kiều, Cần Thơ",VN,"10.0474163,105.76685719999999"
207,ChIJ_dDLYa6JoDERBxA8gCS-T1s,Cửa hàng Phương ngọc,Cửa hàng đồng phục,0947 138 389,"Cửa hàng Phương ngọc, Lô 20 Đ. Nguyễn Đệ, An Hoà, Bình Thủy, Cần Thơ 900000","An Hoà, Bình Thủy",Lô 20 Đ. Nguyễn Đệ,Cần Thơ,900000.0,"Bình Thủy, Cần Thơ",VN,"10.0510399,105.76941269999999"
208,ChIJIVBQsfmJoDERwMPyH2Og5cI,Cửa hàng VNPT vinaphone Mậu Thân An Hoà,Cửa hàng,0917 723 456,"Cửa hàng VNPT vinaphone Mậu Thân An Hoà, 45/4 Đ. Mậu Thân, An Nghiệp, Ninh Kiều, Cần Thơ","An Nghiệp, Ninh Kiều",45/4 Đ. Mậu Thân,Cần Thơ,,"Ninh Kiều, Cần Thơ",VN,"10.0418305,105.7662249"
209,ChIJ-fy9uNGJoDERQaMKmtDkI7M,shopnice,Cửa hàng tiện lợi,,"shopnice, 152 Ngô Thì Nhậm, P, Ninh Kiều, Cần Thơ","P, Ninh Kiều",152 Ngô Thì Nhậm,Cần Thơ,,"Ninh Kiều, Cần Thơ",VN,"10.0414856,105.7554224"
210,ChIJ6XtHZBCJoDERM_5GRv6Z_gQ,Cửa Hàng Dụng Cụ Chăm Sóc Mẹ và Bé - Nguyet Thanh Mom And Baby Healthcare,Cửa hàng chăm sóc sức khỏe và làm đẹp,0292 3943 236,"Cửa Hàng Dụng Cụ Chăm Sóc Mẹ và Bé - Nguyet Thanh Mom And Baby Healthcare, LK2, 18 Nguyễn Văn Cừ Nối Dài, An Bình, Ninh Kiều, Cần Thơ 94159","An Bình, Ninh Kiều","LK2, 18 Nguyễn Văn Cừ Nối Dài",Cần Thơ,94159.0,"Ninh Kiều, Cần Thơ",VN,"10.0171022,105.7377734"
211,ChIJPX0woSSrNTER4_4YInEDe2c,Cửa Hàng Bán Sữa Grow Plus,Cửa hàng,0904 614 767,"Cửa Hàng Bán Sữa Grow Plus, 58 P. Trần Nhân Tông, Nguyễn Du, Hai Bà Trưng, Hà Nội 100000","Nguyễn Du, Hai Bà Trưng",58 P. Trần Nhân Tông,Hà Nội,100000.0,"Hai Bà Trưng, Hà Nội",VN,"21.0175988,105.8426035"
212,ChIJ6Vk4V4-rNTER3BHRUiyYWbA,Cửa Hàng Đồ Đồng Mỹ Nghệ,Cửa hàng lưu niệm,024 6683 4296,"Cửa Hàng Đồ Đồng Mỹ Nghệ, 235 Đ. Lê Duẩn, Trung Phụng, Đống Đa, Hà Nội","Trung Phụng, Đống Đa",235 Đ. Lê Duẩn,Hà Nội,,"Đống Đa, Hà Nội",VN,"21.015456099999998,105.8415503"
213,ChIJTdL8ZJGsNTERv7OeCcNzvFY,Cửa Hàng Tiêu Dùng,Cửa hàng đồ gia dụng,0944 397 266,"Cửa Hàng Tiêu Dùng, 5B, Ngõ 376/14/1, Phố Khương Đình, Phường Hạ Đình, Quận Thanh Xuân, Hạ Đình, Thanh Xuân, Hà Nội","Hạ Đình, Thanh Xuân","5B, Ngõ 376/14/1, Phố Khương Đình, Phường Hạ Đình, Quận Thanh Xuân",Hà Nội,,"Thanh Xuân, Hà Nội",VN,"20.994139099999998,105.8134607"
214,ChIJDXWZp42rNTERVJXYTwxWshU,Cửa Hàng Minh Tân,Cửa hàng giày dép,024 3822 8202,"Cửa Hàng Minh Tân, 150 P. Bà Triệu, Nguyễn Du, Hai Bà Trưng, Hà Nội","Nguyễn Du, Hai Bà Trưng",150 P. Bà Triệu,Hà Nội,,"Hai Bà Trưng, Hà Nội",VN,"21.017118,105.84912489999999"
215,ChIJz4viVBCrNTERw8GLeroSAXs,Cửa Hàng Rèm Á Âu,Cửa hàng rèm và màn trập,0912 994 832,"Cửa Hàng Rèm Á Âu, 87 Ng. Chợ Khâm Thiên, Trung Phụng, Đống Đa, Hà Nội 100000","Trung Phụng, Đống Đa",87 Ng. Chợ Khâm Thiên,Hà Nội,100000.0,"Đống Đa, Hà Nội",VN,"21.016375,105.838155"
216,ChIJ2fXy4IOrNTERMQskmO0RCqA,Công Ty Cp Thời Trang Hanosimex,Cửa hàng quần áo,024 3573 7653,"Công Ty Cp Thời Trang Hanosimex, 394 P. Xã Đàn, Nam Đồng, Đống Đa, Hà Nội","Nam Đồng, Đống Đa",394 P. Xã Đàn,Hà Nội,,"Đống Đa, Hà Nội",VN,"21.0150679,105.8336396"
217,ChIJIRlO9merNTERhFehELyImHk,Cửa hàng viện bảo vệ thực vật,Cửa hàng chăm sóc sức khỏe và làm đẹp,0911 849 557,"Cửa hàng viện bảo vệ thực vật, số 8 Nguyễn Viết Xuân, Thanh Xuân, Hà nội, Hà Nội 100000","Quốc Tử Giám, Hà nội","số 8 Nguyễn Viết Xuân, Thanh Xuân",Hà Nội,100000.0,"Hà nội, Hà Nội",VN,"21.027763999999998,105.83416"
218,ChIJNc_rIPSrNTERT6KNWPROAhE,Cửa hàng thời trang trẻ em ILABY KIDS Bà Triệu - Hai Bà Trưng,Cửa hàng quần áo trẻ em,0339 298 886,"Cửa hàng thời trang trẻ em ILABY KIDS Bà Triệu - Hai Bà Trưng, 170 P. Bà Triệu, Nguyễn Du, Hai Bà Trưng, Hà Nội 100000","Nguyễn Du, Hai Bà Trưng",170 P. Bà Triệu,Hà Nội,100000.0,"Hai Bà Trưng, Hà Nội",VN,"21.016417399999998,105.8491329"
219,ChIJ0RmT85CrNTER-xgA-7ceaQA,COT design - style - store,Cửa hàng quần áo,0904 581 433,"COT design - style - store, 27b Ng. Tức Mặc, Cửa Nam, Hoàn Kiếm, Hà Nội","Cửa Nam, Hoàn Kiếm",27b Ng. Tức Mặc,Hà Nội,,"Hoàn Kiếm, Hà Nội",VN,"21.023336,105.8423773"
220,ChIJXXXl01SrNTERWeyCx43hvGw,Cửa Hàng Bán Sữa A2 Úc Tại Hà Nội,Cửa hàng,0904 669 973,"Cửa Hàng Bán Sữa A2 Úc Tại Hà Nội, Số 9 P. Đào Duy Anh, Phương Liên, Đống Đa, Hà Nội 100000","Phương Liên, Đống Đa",Số 9 P. Đào Duy Anh,Hà Nội,100000.0,"Đống Đa, Hà Nội",VN,"21.0085299,105.83870809999999"
221,ChIJe6Su4JarNTERGy9W1do_v-g,Cửa Hàng Trang Phục Lót Triumph,Cửa hàng đồ lót,024 3942 7736,"Cửa Hàng Trang Phục Lót Triumph, 57D P. Hai Bà Trưng, Trần Hưng Đạo, Hoàn Kiếm, Hà Nội","Trần Hưng Đạo, Hoàn Kiếm",57D P. Hai Bà Trưng,Hà Nội,,"Hoàn Kiếm, Hà Nội",VN,"21.0266597,105.84416"
222,ChIJ0_tEoJOJoDERoYBolclGvN4,Cửa Hàng Vật Liệu Ốp Tường,Cửa hàng nội thất,0901 030 442,"Cửa Hàng Vật Liệu Ốp Tường, 96 Đường Trần Hoàng Na, Khu dân cư 91B, Ninh Kiều, Cần Thơ","Khu dân cư 91B, Ninh Kiều",96 Đường Trần Hoàng Na,Cần Thơ,,"Ninh Kiều, Cần Thơ",VN,"10.021846,105.7538479"
223,ChIJxbIriimJoDERsxhl0fxrBAU,Nhi Nhi Shop Quần Áo Gym,Cửa hàng quần áo thể thao,0848 119 698,"Nhi Nhi Shop Quần Áo Gym, 132 Đ. 3 Tháng 2, Hưng Lợi, Ninh Kiều, Cần Thơ","Hưng Lợi, Ninh Kiều",132 Đ. 3 Tháng 2,Cần Thơ,,"Ninh Kiều, Cần Thơ",VN,"10.019700499999999,105.75909159999999"
224,ChIJg7jiSyqJoDERlroBEctQqAM,"Cửa hàng VNPT Vinaphone 3/2, Hưng Lợi, Ninh Kiều, Cần Thơ",Cửa hàng,0917 533 584,"2Q96+J36 Cửa hàng VNPT Vinaphone 3/2, Hưng Lợi, Ninh Kiều, Cần Thơ, Hẻm 132 Đ. 3 Tháng 2, An Binh, Ninh Kiều, Cần Thơ","An Binh, Ninh Kiều","2Q96+J36, Hẻm 132 Đ. 3 Tháng 2",Cần Thơ,,"Ninh Kiều, Cần Thơ",VN,"10.0190276,105.76015149999999"
225,ChIJcfPSQH-JoDERTMlWsPQ2FFc,Cửa Hàng Thực Phẩm HUỲNH ĐĂNG,Cửa hàng bán thực phẩm sạch,0919 803 869,"Cửa Hàng Thực Phẩm HUỲNH ĐĂNG, Số 67-69 Đường số 3, KDC CBGV, Đ. Nguyễn Văn Linh, Phường An Khánh, Ninh Kiều, Cần Thơ","Phường An Khánh, Ninh Kiều","Số 67-69 Đường số 3, KDC CBGV, Đ. Nguyễn Văn Linh",Cần Thơ,,"Ninh Kiều, Cần Thơ",VN,"10.0282357,105.758147"
226,ChIJTT8ed3-JoDERnm9Bucpn8g4,Cửa hàng VNPT Vinaphone_ Nguyễn Kim Chưng đường 3 tháng 2,Cửa hàng,0943 594 351,"2Q86+342 Cửa hàng VNPT Vinaphone_ Nguyễn Kim Chưng đường 3 tháng 2, Hẻm 83 Đ. 3 Tháng 2, Hưng Lợi, Ninh Kiều, Cần Thơ","Hưng Lợi, Ninh Kiều","2Q86+342, Hẻm 83 Đ. 3 Tháng 2",Cần Thơ,,"Ninh Kiều, Cần Thơ",VN,"10.0151492,105.7602594"
227,ChIJIQZublqJoDERF7n8UfyLGB0,Cửa hàng VNPT Vinaphone_ đường 3 tháng 3,Cửa hàng,0943 594 351,"Cửa hàng VNPT Vinaphone_ đường 3 tháng 3, hẻm 71 Đ. 3 Tháng 2, Hưng Lợi, Ninh Kiều, Cần Thơ 94000","Hưng Lợi, Ninh Kiều",hẻm 71 Đ. 3 Tháng 2,Cần Thơ,94000.0,"Ninh Kiều, Cần Thơ",VN,"10.0212294,105.7621147"
231,ChIJDcngbK-JoDERLfzeboOXk6w,Cửa hàng nội thất Hồng Phát,Cửa hàng nội thất,0966 459 869,"Cửa hàng nội thất Hồng Phát, 557 Đường 30/04, Hưng Lợi, Ninh Kiều, Cần Thơ 900000","Hưng Lợi, Ninh Kiều",557 Đường 30/04,Cần Thơ,900000.0,"Ninh Kiều, Cần Thơ",VN,"10.0117432,105.7601136"
232,ChIJjXggqcOJoDERnV2W6gyeWo4,Cửa hàng VNPT Vinaphone_nguyễn văn linh,Cửa hàng,0858 451 089,"Cửa hàng VNPT Vinaphone_nguyễn văn linh, 1b1 Đ. Nguyễn Văn Linh, Hưng Lợi, Ninh Kiều, Cần Thơ","Hưng Lợi, Ninh Kiều",1b1 Đ. Nguyễn Văn Linh,Cần Thơ,,"Ninh Kiều, Cần Thơ",VN,"10.020550799999999,105.76607589999999"
233,ChIJ3fF1DOGJoDERhPFSeIw3HhI,Cửa hàng áo Sunflowers,Cửa hàng áo thun,0374 555 197,"Cửa hàng áo Sunflowers, Hẻm 49 Đ. Trần Hoàng Na, Hưng Lợi, Ninh Kiều, Cần Thơ 90000","Hưng Lợi, Ninh Kiều",Hẻm 49 Đ. Trần Hoàng Na,Cần Thơ,90000.0,"Ninh Kiều, Cần Thơ",VN,"10.0116554,105.76468299999999"
234,ChIJjUuMUQCJoDERhh07fwrgqM0,Cửa hàng nước hoa PL Perfume,Cửa hàng mỹ phẩm,,"Cửa hàng nước hoa PL Perfume, 15A Đ. Mậu Thân, An Phú, Ninh Kiều, Cần Thơ","An Phú, Ninh Kiều",15A Đ. Mậu Thân,Cần Thơ,,"Ninh Kiều, Cần Thơ",VN,"10.033671799999999,105.7737356"
235,ChIJfcenVSOIoDERy4g3MDHEn6A,Cửa Hàng Dụng Cụ Điện Cầm Tay Thanh Hoàng,Cửa hàng thiết bị điện,0292 3734 560,"Cửa Hàng Dụng Cụ Điện Cầm Tay Thanh Hoàng, 136 Đ. 3 Tháng 2, Xuân Khánh, Ninh Kiều, Cần Thơ","Xuân Khánh, Ninh Kiều",136 Đ. 3 Tháng 2,Cần Thơ,,"Ninh Kiều, Cần Thơ",VN,"10.027865799999999,105.7705953"
236,ChIJXY6gyiGIoDERMtl55zKtwrw,Cửa Hàng Nước Hoa Dubai Cần Thơ - SUDUBAI,Cửa hàng mỹ phẩm,,"Cửa Hàng Nước Hoa Dubai Cần Thơ - SUDUBAI, 108/46/29 Đ. Nguyễn Việt Hồng, An Lạc, Ninh Kiều, Cần Thơ","An Lạc, Ninh Kiều",108/46/29 Đ. Nguyễn Việt Hồng,Cần Thơ,,"Ninh Kiều, Cần Thơ",VN,"10.031301,105.7794615"
237,ChIJ2e-4VZ9ioDERJetBMYoURBU,Cửa Hàng Bánh Pía - Lạp Xưởng Thanh Lâm 2,Cửa hàng bán thực phẩm đặc sản,0292 3815 303,"Cửa Hàng Bánh Pía - Lạp Xưởng Thanh Lâm 2, 8 Nguyễn Thái Học, Tân An, Ninh Kiều, Cần Thơ","Tân An, Ninh Kiều",8 Nguyễn Thái Học,Cần Thơ,,"Ninh Kiều, Cần Thơ",VN,"10.0323722,105.7875966"
238,ChIJH2whZyKIoDER_82azDjQmbw,Shop Minh Thư,Siêu thị,0292 3838 546,"Shop Minh Thư, 364 Đ. 30 Tháng 4, Xuân Khánh, Ninh Kiều, Cần Thơ","Xuân Khánh, Ninh Kiều",364 Đ. 30 Tháng 4,Cần Thơ,,"Ninh Kiều, Cần Thơ",VN,"10.0221588,105.7709939"
239,ChIJCUiD0hyIoDERLC0Ejvesw6A,Cửa Hàng Mắt Kính Văn Nhiều,Cửa hàng kính,0292 3825 453,"Cửa Hàng Mắt Kính Văn Nhiều, 60 Hùng Vương, An Cư, Ninh Kiều, Cần Thơ","An Cư, Ninh Kiều",60 Hùng Vương,Cần Thơ,,"Ninh Kiều, Cần Thơ",VN,"10.0433194,105.7782897"
242,ChIJQy3hfp9ioDERSkPdDUUePaM,Cửa Hàng Bánh Bao - Xíu Mại - Há Cảo Viễn Hưng,Tiệm bánh,0292 3814 134,"Cửa Hàng Bánh Bao - Xíu Mại - Há Cảo Viễn Hưng, 61 Võ Văn Tần, Tân An, Ninh Kiều, Cần Thơ 900000","Tân An, Ninh Kiều",61 Võ Văn Tần,Cần Thơ,900000.0,"Ninh Kiều, Cần Thơ",VN,"10.0324308,105.78528639999999"
244,ChIJR3IAwDWIoDERPdhl_witFxo,Cửa hàng trang trí ôtô Lê Hào,Cửa hàng phụ tùng xe ô tô,0909 365 369,"Cửa hàng trang trí ôtô Lê Hào, 64 Đ. 3 Tháng 2, Hưng Lợi, Ninh Kiều, Cần Thơ","Hưng Lợi, Ninh Kiều",64 Đ. 3 Tháng 2,Cần Thơ,,"Ninh Kiều, Cần Thơ",VN,"10.0146416,105.75859419999999"
247,ChIJEehXGySIoDERlpb1NiiFNk4,Cửa hàng Mẹ và Bé Cần Thơ - Thegioisosinh.com,Cửa hàng quần áo trẻ em,0869 287 887,"Cửa hàng Mẹ và Bé Cần Thơ - Thegioisosinh.com, 72-74 Đ. 30 Tháng 4, An Lạc, Ninh Kiều, Cần Thơ 902480","An Lạc, Ninh Kiều",72-74 Đ. 30 Tháng 4,Cần Thơ,902480.0,"Ninh Kiều, Cần Thơ",VN,"10.029843999999999,105.7799034"
248,ChIJ-45s8J9ioDERwEOWG3dEXAg,Shop Đồng hồ HƯNG PHÁT,Cửa hàng đồng hồ,0292 3815 369,"Shop Đồng hồ HƯNG PHÁT, 19 Đại Lộ, Đại lộ Hoà Bình, An Lạc, Ninh Kiều, Cần Thơ","An Lạc, Ninh Kiều","19 Đại Lộ, Đại lộ Hoà Bình",Cần Thơ,,"Ninh Kiều, Cần Thơ",VN,"10.031979699999999,105.78285389999999"
249,ChIJH8K4uaCJoDER0Z_tsUhDuIs,Cửa Hàng Gia Dụng HOÀNG NAM,Cửa hàng đồ gia dụng,0949 656 007,"2QH6+FHW Cửa Hàng Gia Dụng HOÀNG NAM, Đ. Số 7, Phường An Khánh, Ninh Kiều, Cần Thơ","Phường An Khánh, Ninh Kiều","2QH6+FHW, Đ. Số 7",Cần Thơ,,"Ninh Kiều, Cần Thơ",VN,"10.0286134,105.76138739999999"
250,ChIJ4Q-V8R-IoDER3a5Z4M_zMus,Mắt Kính 42 Cần Thơ,Người đo thị lực,0292 3734 906,"Mắt Kính 42 Cần Thơ, 42 Đ. Lý Tự Trọng, An Cư, Ninh Kiều, Cần Thơ 94000","An Cư, Ninh Kiều",42 Đ. Lý Tự Trọng,Cần Thơ,94000.0,"Ninh Kiều, Cần Thơ",VN,"10.0348131,105.779376"
251,ChIJiX7xPSKIoDER9Kg_0RvsGNc,Cửa Hàng Th True Milk,Cửa hàng tạp phẩm,,"Cửa Hàng Th True Milk, 95 Đ. Mậu Thân, An Phú, Ninh Kiều, Cần Thơ","An Phú, Ninh Kiều",95 Đ. Mậu Thân,Cần Thơ,,"Ninh Kiều, Cần Thơ",VN,"10.0315329,105.77496459999999"
252,ChIJO9iGkqBioDERqsyPlyc4LVc,Bụi Store Cần Thơ,Cửa hàng giày dép,0939 908 850,"Bụi Store Cần Thơ, Hẻm 97, Tân An, Ninh Kiều, Cần Thơ 90000","Tân An, Ninh Kiều",Hẻm 97,Cần Thơ,90000.0,"Ninh Kiều, Cần Thơ",VN,"10.0351775,105.78300569999999"
253,ChIJwepf76FioDERth8Lmj9JN4s,Bánh Mì Gà 37,Tiệm bánh,0292 3810 203,"Bánh Mì Gà 37, 37 Phan Đình Phùng, Tân An, Ninh Kiều, Cần Thơ","Tân An, Ninh Kiều",37 Phan Đình Phùng,Cần Thơ,,"Ninh Kiều, Cần Thơ",VN,"10.033042499999999,105.78695069999999"
254,ChIJnSLYXYOrNTERLe2g7uCymHY,Cửa Hàng Tùng Linh,Cửa hàng mỹ phẩm,0934 418 848,"Cửa Hàng Tùng Linh, 214 P. Khâm Thiên, Khâm Thiên, Đống Đa, Hà Nội","Khâm Thiên, Đống Đa",214 P. Khâm Thiên,Hà Nội,,"Đống Đa, Hà Nội",VN,"21.0192508,105.8353783"
255,ChIJNUrNT59ioDER0FrZRgr1_78,Cửa Hàng Khải Hoàn,Cửa hàng quần áo,0292 3820 147,"Cửa Hàng Khải Hoàn, 50 Phan Bội Châu, Tân An, Ninh Kiều, Cần Thơ","Tân An, Ninh Kiều",50 Phan Bội Châu,Cần Thơ,,"Ninh Kiều, Cần Thơ",VN,"10.031867,105.78691099999999"
257,ChIJZd_lrQ-IoDERbWNIROt4BUg,ĐẶC SẢN QUÊ NHÀ - ĐẶC SẢN CẦN THƠ,Cửa hàng bán thực phẩm đặc sản,0939 991 011,"ĐẶC SẢN QUÊ NHÀ - ĐẶC SẢN CẦN THƠ, Số 21 Đường số 25, KDC An Khánh, Ninh Kiều, Cần Thơ","KDC An Khánh, Ninh Kiều",Số 21 Đường số 25,Cần Thơ,,"Ninh Kiều, Cần Thơ",VN,"10.0400754,105.75498189999999"
258,ChIJZX_PaQiJoDERxl5dAGaB7vs,Mỹ phẩm chenny shop,Cửa hàng mỹ phẩm,,"Mỹ phẩm chenny shop, 58 Đ. Võ Trường Toản, An Hoà, Ninh Kiều, Cần Thơ","An Hoà, Ninh Kiều",58 Đ. Võ Trường Toản,Cần Thơ,,"Ninh Kiều, Cần Thơ",VN,"10.0486196,105.76571059999999"
259,ChIJeZg5AKeJoDERVmv0dVwzYhA,Cửa hàng thuốc thú y Huỳnh Mai,Hiệu thuốc thú y,0292 3834 446,"Cửa hàng thuốc thú y Huỳnh Mai, 246 Đ. Trần Hưng Đạo, An Nghiệp, Ninh Kiều, Cần Thơ","An Nghiệp, Ninh Kiều",246 Đ. Trần Hưng Đạo,Cần Thơ,,"Ninh Kiều, Cần Thơ",VN,"10.0330849,105.77483679999999"
261,ChIJn-vA3IarNTERdSERDg6J0rM,Cửa Hàng 8X Mobile,Cửa hàng điện thoại di động,024 3999 3333,"Cửa Hàng 8X Mobile, 248 P. Xã Đàn, Phương Liên, Đống Đa, Hà Nội","Phương Liên, Đống Đa",248 P. Xã Đàn,Hà Nội,,"Đống Đa, Hà Nội",VN,"21.0124151,105.8361264"
262,ChIJrbdZSwqJoDERfZzhhVfMoxA,Cửa Hàng Tạp Hóa Diễm My,Cửa hàng bách hóa,0292 2483 646,"Cửa Hàng Tạp Hóa Diễm My, 251 Ấp Mỹ Phước, Huyện Phong Điền, An Bình, Ninh Kiều, Cần Thơ","An Bình, Ninh Kiều","251 Ấp Mỹ Phước, Huyện Phong Điền",Cần Thơ,,"Ninh Kiều, Cần Thơ",VN,"9.9999404,105.74154"
263,ChIJxXIAnp5ioDERZW4FAV7ZYek,Kim Hoang My Lan Gold Shop,Cửa hàng,0292 3821 404,"Kim Hoang My Lan Gold Shop, 84 Đường Hai Bà Trưng, Tân An, Ninh Kiều, Cần Thơ","Tân An, Ninh Kiều",84 Đường Hai Bà Trưng,Cần Thơ,,"Ninh Kiều, Cần Thơ",VN,"10.0327308,105.7880661"
264,ChIJc8W0ywSJoDER7s_0hZHUHmg,Cửa Hàng Gas Việt Phương,Cửa hàng,,"Cửa Hàng Gas Việt Phương, số 91/36 Đ. 30 Tháng 4, Hưng Lợi, Ninh Kiều, Cần Thơ","Hưng Lợi, Ninh Kiều",số 91/36 Đ. 30 Tháng 4,Cần Thơ,,"Ninh Kiều, Cần Thơ",VN,"10.0105649,105.75837879999999"
265,ChIJt5bfPCKIoDERb8TM_u6-tg8,Cửa Hàng Điện Cơ Tấn Hậu,Cửa hàng thiết bị điện,0292 3832 088,"Cửa Hàng Điện Cơ Tấn Hậu, 142 Đ. Mậu Thân, An Phú, Ninh Kiều, Cần Thơ","An Phú, Ninh Kiều",142 Đ. Mậu Thân,Cần Thơ,,"Ninh Kiều, Cần Thơ",VN,"10.0313223,105.775504"
267,ChIJf9lXJbqrNTERnnqZ5yq6Lo0,Cửa hàng hoa tươi HOA XUÂN,Cửa hàng hoa,024 3934 9810,"Cửa hàng hoa tươi HOA XUÂN, 81B P. Hai Bà Trưng, Cửa Nam, Hoàn Kiếm, Hà Nội","Cửa Nam, Hoàn Kiếm",81B P. Hai Bà Trưng,Hà Nội,,"Hoàn Kiếm, Hà Nội",VN,"21.027079399999998,105.8427116"
268,ChIJW8kIy1-rNTERE2jtwWFDPkA,Cửa Hàng Bếp Gas Thành Đạt,Cửa hàng ga,024 3212 7887,"Cửa Hàng Bếp Gas Thành Đạt, Số 9 phố Trần Duy Hưng, Trung Hoà, Cầu Giấy, Hà Nội","Trung Hoà, Cầu Giấy",Số 9 phố Trần Duy Hưng,Hà Nội,,"Cầu Giấy, Hà Nội",VN,"21.0145731,105.8043845"
269,ChIJTy-5VDOIoDERIxrdYmnrJQU,Cửa Hàng Tạp Hoá Bách Sơn,Cửa hàng bách hóa,,"Cửa Hàng Tạp Hoá Bách Sơn, 17 Đ. Trần Hoàng Na, Hưng Lợi, Ninh Kiều, Cần Thơ","Hưng Lợi, Ninh Kiều",17 Đ. Trần Hoàng Na,Cần Thơ,,"Ninh Kiều, Cần Thơ",VN,"10.0130204,105.7634131"
271,ChIJbfO_N6BioDER2UE5zJ8oTeg,Cửa Hàng Áo Tắm Cao Cấp Lan Hạnh,Cửa hàng đồ bơi,0292 3828 728,"Cửa Hàng Áo Tắm Cao Cấp Lan Hạnh, 32 A, Đại lộ Hoà Bình, Tân An, Ninh Kiều, Cần Thơ","Tân An, Ninh Kiều","32 A, Đại lộ Hoà Bình",Cần Thơ,,"Ninh Kiều, Cần Thơ",VN,"10.0338309,105.78428"
272,ChIJl7TmAxyIoDERZ33KWieXoWA,Cửa Hàng Sơn Hà Xìl - sơn xịt SAMURAI,Cửa hàng sơn,0939 015 715,"Cửa Hàng Sơn Hà Xìl - sơn xịt SAMURAI, 68-68A Đ. Trần Hưng Đạo, An Cư, Ninh Kiều, Cần Thơ","An Cư, Ninh Kiều",68-68A Đ. Trần Hưng Đạo,Cần Thơ,,"Ninh Kiều, Cần Thơ",VN,"10.0386246,105.7765762"
275,ChIJmdzZohOIoDERN5H6hxoVxgs,Cửa Hàng Tôn Hiệp Hưng Cần Thơ,Cửa hàng,0292 3897 450,"Cửa Hàng Tôn Hiệp Hưng Cần Thơ, 132 Nguyễn Văn Cừ Nối Dài, Phường An Khánh, Ninh Kiều, Cần Thơ","Phường An Khánh, Ninh Kiều",132 Nguyễn Văn Cừ Nối Dài,Cần Thơ,,"Ninh Kiều, Cần Thơ",VN,"10.0405468,105.7623339"
277,ChIJexLG3yKJoDERCi5h-uLkSX4,Cửa Hàng Dụng Cụ Câu Cá Việt Thu,Cửa hàng bán đồ câu cá,0907 303 189,"Cửa Hàng Dụng Cụ Câu Cá Việt Thu, 7 Đ. Số 4, KDC Metro, Ninh Kiều, Cần Thơ 900000","KDC Metro, Ninh Kiều",7 Đ. Số 4,Cần Thơ,900000.0,"Ninh Kiều, Cần Thơ",VN,"10.0216073,105.76031169999999"
282,ChIJH1OXRBSJoDER0L-RBz2juSI,Cửa hàng 108 STORE - Điện thoại iPhone giá rẻ Cần Thơ,Cửa hàng điện thoại di động,0981 180 108,"Cửa hàng 108 STORE - Điện thoại iPhone giá rẻ Cần Thơ, 108/4 Hẻm 108 Đ. 30 Tháng 4, An Lạc, Ninh Kiều, Cần Thơ 94000","An Lạc, Ninh Kiều",108/4 Hẻm 108 Đ. 30 Tháng 4,Cần Thơ,94000.0,"Ninh Kiều, Cần Thơ",VN,"10.0293653,105.7791659"
284,ChIJxUKM25mrNTERSlf9xkWvfPA,Cửa hàng 100 năm dao kéo Sinh Tài,Cửa hàng dao,024 3843 3622,"Cửa hàng 100 năm dao kéo Sinh Tài, 15A P. Nguyễn Khuyến, Văn Miếu, Đống Đa, Hà Nội","Văn Miếu, Đống Đa",15A P. Nguyễn Khuyến,Hà Nội,,"Đống Đa, Hà Nội",VN,"21.0277718,105.8402808"
285,ChIJX4CyFiOIoDER1PTVz3Ntmy0,Cửa Hàng Mắt Kính Sao Việt,Cửa hàng,0932 273 737,"Cửa Hàng Mắt Kính Sao Việt, 106, Đường 3/2, Phường Xuân Khánh, Quận Ninh Kiều, Thành Phố Cần Thơ, Xuân Khánh, Ninh Kiều, Cần Thơ","Xuân Khánh, Ninh Kiều","106, Đường 3/2, Phường Xuân Khánh, Quận Ninh Kiều, Thành Phố Cần Thơ",Cần Thơ,,"Ninh Kiều, Cần Thơ",VN,"10.0294127,105.77215179999999"
286,ChIJ6YypMCGIoDERyzmSR2YLpe4,Cửa Hàng Vàng Bạc Kim Phát Hoàng,Cửa hàng phụ kiện thời trang,0859 829 633,"Cửa Hàng Vàng Bạc Kim Phát Hoàng, 180A đường 30 Tháng 4, phường An Phú, quận Ninh Kiều, thành phố Cần Thơ, tỉnh Cần Thơ, Xuân Khánh, Ninh Kiều, Cần Thơ","Xuân Khánh, Ninh Kiều","180A đường 30 Tháng 4, phường An Phú, quận Ninh Kiều, thành phố Cần Thơ, tỉnh Cần Thơ",Cần Thơ,,"Ninh Kiều, Cần Thơ",VN,"10.028158,105.77799859999999"
287,ChIJU6JgJVGIoDER_BmcU9B7cEQ,Công Ty Tnhh May Xuất Khẩu Việt Thành,Cửa hàng may,,"Công Ty Tnhh May Xuất Khẩu Việt Thành, 246 Đ. Hoàng Quốc Việt, An Bình, Ninh Kiều, Cần Thơ","An Bình, Ninh Kiều",246 Đ. Hoàng Quốc Việt,Cần Thơ,,"Ninh Kiều, Cần Thơ",VN,"10.019965,105.7419438"
288,ChIJc6j0bZCrNTER_ABmkw6723I,Cửa Hàng Mắt Kính Mạnh Long,Cửa hàng kính mát,024 3942 3002,"Cửa Hàng Mắt Kính Mạnh Long, 151 Đ. Lê Duẩn, Khâm Thiên, Hoàn Kiếm, Hà Nội","Khâm Thiên, Hoàn Kiếm",151 Đ. Lê Duẩn,Hà Nội,,"Hoàn Kiếm, Hà Nội",VN,"21.0214327,105.8415842"
289,ChIJl784lfuJoDERD_ZvhALnVJs,"Cửa hàng Obinest Cần Thơ ( chuyên vật tư - thiết bị nhà yến, loa nhà yến,mùi nhà yến..)",Cửa hàng,0933 617 379,"Cửa hàng Obinest Cần Thơ ( chuyên vật tư - thiết bị nhà yến, loa nhà yến,mùi nhà yến..), 211 Đ. Nguyễn Văn Linh, Hưng Lợi, Ninh Kiều, Cần Thơ","Hưng Lợi, Ninh Kiều",211 Đ. Nguyễn Văn Linh,Cần Thơ,,"Ninh Kiều, Cần Thơ",VN,"10.0209949,105.7653339"
290,ChIJ0ZappTKJoDER_HoDEjICiXo,Cửa Hàng Cà Phê 65,Quán cà phê,,"Cửa Hàng Cà Phê 65, Cầu 3, Đ. Nguyễn Văn Linh, Phường An Khánh, Ninh Kiều, Cần Thơ","Phường An Khánh, Ninh Kiều","Cầu 3, Đ. Nguyễn Văn Linh",Cần Thơ,,"Ninh Kiều, Cần Thơ",VN,"10.0274258,105.7564203"
292,ChIJSSzkdZ6JoDERrxD0_9-ENjk,Cửa Hàng Giày Paranoid Sneakers Store,Cửa hàng giày dép,0906 735 337,"Cửa Hàng Giày Paranoid Sneakers Store, hẻm 53 Đ. Lê Lai, An Phú, Ninh Kiều, Cần Thơ 94114","An Phú, Ninh Kiều",hẻm 53 Đ. Lê Lai,Cần Thơ,94114.0,"Ninh Kiều, Cần Thơ",VN,"10.032465499999999,105.7800891"
293,ChIJ7WSM1KFioDERCSEjKV2Frhw,Cửa Hàng Băng Đĩa Nhạc 42,Cửa hàng bán đồ điện tử,0292 3828 921,"Cửa Hàng Băng Đĩa Nhạc 42, 27 Phan Đình Phùng, Tân An, Ninh Kiều, Cần Thơ","Tân An, Ninh Kiều",27 Phan Đình Phùng,Cần Thơ,,"Ninh Kiều, Cần Thơ",VN,"10.033407799999999,105.7870112"
294,ChIJAzpQIKJioDERPUI-BSfO7n8,Cửa Hàng Điện Máy Điện Gia Dụng Hùng,Cửa hàng bán đồ điện tử,0292 3823 324,"Cửa Hàng Điện Máy Điện Gia Dụng Hùng, 32 Đ. Lê Thánh Tôn, Tân An, Ninh Kiều, Cần Thơ","Tân An, Ninh Kiều",32 Đ. Lê Thánh Tôn,Cần Thơ,,"Ninh Kiều, Cần Thơ",VN,"10.032513,105.7875545"
295,ChIJGZzG4qFioDERrVKK8nKVQDo,Cửa Hàng Máy Tính Casio Tại Cần Thơ,Cửa hàng bán đồ điện tử,0292 3822 137,"Cửa Hàng Máy Tính Casio Tại Cần Thơ, 28 Nguyễn Thái Học, Tân An, Ninh Kiều, Cần Thơ","Tân An, Ninh Kiều",28 Nguyễn Thái Học,Cần Thơ,,"Ninh Kiều, Cần Thơ",VN,"10.0324593,105.7872328"
296,ChIJaZrI1tyJoDERkGjYu5WO8jE,Màn cửa nệm LỘC PHÁT,Cửa hàng nội thất,0932 888 928,"Màn cửa nệm LỘC PHÁT, 393 Nguyễn Văn Cừ Nối Dài, An Bình, Ninh Kiều, Cần Thơ","An Bình, Ninh Kiều",393 Nguyễn Văn Cừ Nối Dài,Cần Thơ,,"Ninh Kiều, Cần Thơ",VN,"10.0210724,105.74259819999999"
297,ChIJl24qX4yrNTERlrnmB431nVs,Cửa Hàng Linh Kiện Điện Thoại 64,Cửa hàng điện thoại di động,0912 035 888,"Cửa Hàng Linh Kiện Điện Thoại 64, 64 P. Tuệ Tĩnh, Bùi Thị Xuân, Hai Bà Trưng, Hà Nội","Bùi Thị Xuân, Hai Bà Trưng",64 P. Tuệ Tĩnh,Hà Nội,,"Hai Bà Trưng, Hà Nội",VN,"21.015262399999997,105.8493838"
298,ChIJTX-D24OrNTERreH7IrTouDg,Cửa Hàng Giới Thiệu Sản Phẩm Vinamilk,Cửa hàng tạp phẩm,024 3577 3074,"Cửa Hàng Giới Thiệu Sản Phẩm Vinamilk, 418 P. Xã Đàn, Nam Đồng, Đống Đa, Hà Nội","Nam Đồng, Đống Đa",418 P. Xã Đàn,Hà Nội,,"Đống Đa, Hà Nội",VN,"21.015631499999998,105.8331632"
299,ChIJBVYpQ62JoDERsamJ_Wb87zU,Cửa Hàng Tạp Hóa Tuyết,Cửa hàng bách hóa,0292 3844 138,"Cửa Hàng Tạp Hóa Tuyết, 249, Đường Cái Sơn Hàng Bàng, Quận Cái Răng, An Bình, Ninh Kiều, Cần Thơ","An Bình, Ninh Kiều","249, Đường Cái Sơn Hàng Bàng, Quận Cái Răng",Cần Thơ,,"Ninh Kiều, Cần Thơ",VN,"10.0115442,105.74609819999999"
