,place_id,name,main_category,phone,address,address_ward,address_street,address_city,address_postal_code,address_state,address_country_code,coordinates
682,ChIJyeVP56CJoDERGhPWWfdtCt8,Cửa Hàng Tạp Hóa Bảo Ngọc,Cửa hàng bách hóa,0292 3848 757,"Cửa Hàng Tạp Hóa Bảo Ngọc, 245 Ấp Mỹ Ái, Huyện Phong Điền, An Bình, Ninh Kiều, Cần Thơ","An Bình, Ninh Kiều","245 Ấp Mỹ Ái, Huyện Phong Điền",Cần Thơ,,"Ninh Kiều, Cần Thơ",VN,"9.9954346,105.7376554"
683,ChIJP-uihuqJoDERtcI1Ham_D0M,Cửa Hàng Thực Phẩm LeO,Cửa hàng thịt,0823 695 099,"Cửa Hàng Thực Phẩm LeO, 151a1 Nguyễn Văn Trường, An Bình, Ninh Kiều, Cần Thơ","An Bình, Ninh Kiều",151a1 Nguyễn Văn Trường,Cần Thơ,,"Ninh Kiều, Cần Thơ",VN,"10.0015197,105.7347681"
684,ChIJHSNy_KSJoDERmljxrdkhaqk,Cửa Hàng Tạp Hoá Kim Anh,Cửa hàng bách hóa,0292 6297 925,"Cửa Hàng Tạp Hoá Kim Anh, 61/3A, Võ Tánh, Phường Lê Bình, Quận Cái Răng, Thành Phố Cần Thơ, Lê Bình, Cái Răng, Cần Thơ","Lê Bình, Cái Răng","61/3A, Võ Tánh, Phường Lê Bình, Quận Cái Răng, Thành Phố Cần Thơ",Cần Thơ,,"Cái Răng, Cần Thơ",VN,"9.999007599999999,105.7444239"
685,ChIJKSlpRa6JoDER-RSHafDTZPM,Cửa Hàng Tạp Hóa Trúc,Cửa hàng bách hóa,0365 547 883,"Cửa Hàng Tạp Hóa Trúc, 154 ĐT923, An Bình, Ninh Kiều, Cần Thơ 902340","An Bình, Ninh Kiều",154 ĐT923,Cần Thơ,902340.0,"Ninh Kiều, Cần Thơ",VN,"10.0053719,105.74470939999999"
686,ChIJeQMGhqWJoDERt6K-PzZGPAA,Cửa Hàng Văn Phòng Phẩm,Cửa hàng văn phòng phẩm,0292 3846 469,"Cửa Hàng Văn Phòng Phẩm, 189/5, Lộ Vòng Cung, Phường An Bình, Quận Ninh Kiều, Thành Phố Cần Thơ, An Bình, Ninh Kiều, Cần Thơ","An Bình, Ninh Kiều","189/5, Lộ Vòng Cung, Phường An Bình, Quận Ninh Kiều, Thành Phố Cần Thơ",Cần Thơ,,"Ninh Kiều, Cần Thơ",VN,"10.0016771,105.74314559999999"
687,ChIJ5UeKYa2JoDERJ2C9rWVFsuo,Cửa Hàng ĐTDĐ Quang Thái,Cửa hàng điện thoại di động,0987 808 628,"Cửa Hàng ĐTDĐ Quang Thái, 221, Đường Cái Sơn Hàng Bàng, Quận Cái Răng, An Bình, Ninh Kiều, Cần Thơ","An Bình, Ninh Kiều","221, Đường Cái Sơn Hàng Bàng, Quận Cái Răng",Cần Thơ,,"Ninh Kiều, Cần Thơ",VN,"10.010962,105.7467449"
688,ChIJ03BArLOJoDERa4qsogzdxq0,Cửa Hàng Điện Nước Minh Quang,Cửa hàng bán đồ điện tử,0939 291 818,"Cửa Hàng Điện Nước Minh Quang, 109A/3 Đường, Can Tho City, Đ. 3 Tháng 2, An Bình, Ninh Kiều, Cần Thơ","An Bình, Ninh Kiều","109A/3 Đường, Can Tho City, Đ. 3 Tháng 2",Cần Thơ,,"Ninh Kiều, Cần Thơ",VN,"10.0093651,105.75003679999999"
689,ChIJJ20gwUyIoDER7vZ0df5dUt4,Cửa Hàng Mỹ Phẩm Thanh Thoảng,Cửa hàng mỹ phẩm,0907 094 450,"Cửa Hàng Mỹ Phẩm Thanh Thoảng, 145/4C Đ. Trần Vĩnh Kiết, An Bình, Ninh Kiều, Cần Thơ","An Bình, Ninh Kiều",145/4C Đ. Trần Vĩnh Kiết,Cần Thơ,,"Ninh Kiều, Cần Thơ",VN,"10.0135513,105.7510956"
690,ChIJ3dKqerOJoDERrZpqDbI1oV8,Cửa Hàng Điện Thoại Di Động Bích Trân,Cửa hàng điện thoại di động,0977 988 667,"Cửa Hàng Điện Thoại Di Động Bích Trân, 108A, Quốc Lộ 1A, P. An Bình, Quận Ninh Kiều, An Bình, Ninh Kiều, Cần Thơ","An Bình, Ninh Kiều","108A, Quốc Lộ 1A, P. An Bình, Quận Ninh Kiều",Cần Thơ,,"Ninh Kiều, Cần Thơ",VN,"10.0106521,105.7513737"
691,ChIJOQn6DbKJoDERIaqn742ZapU,Tuan Kiet Grocery Store,Cửa hàng bách hóa,0292 6280 290,"Tuan Kiet Grocery Store, 226C, Lo Vong Cung Street, Ninh Kieu District, Can Tho City, An Bình, Ninh Kiều, Cần Thơ","An Bình, Ninh Kiều","226C, Lo Vong Cung Street, Ninh Kieu District, Can Tho City",Cần Thơ,,"Ninh Kiều, Cần Thơ",VN,"10.0083089,105.74761"
693,ChIJJ8hWp7OJoDERJGZ9f1WZ3WQ,Cửa Hàng Điện Nước Gia Lập,Cửa hàng thiết bị điện,0292 3913 515,"Cửa Hàng Điện Nước Gia Lập, 1 Đ. 3 Tháng 2, An Bình, Ninh Kiều, Cần Thơ","An Bình, Ninh Kiều",1 Đ. 3 Tháng 2,Cần Thơ,,"Ninh Kiều, Cần Thơ",VN,"10.0106054,105.75122379999999"
694,ChIJjTxR_62JoDERGS3r8X4aUfQ,Cửa Hàng Thiết Bị Âm Thanh Đức Nguyễn,Cửa hàng thiết bị điện,0366 619 386,"Cửa Hàng Thiết Bị Âm Thanh Đức Nguyễn, Lô 4-21, Chợ An Bình, An Bình, Ninh Kiều, Cần Thơ","An Bình, Ninh Kiều","Lô 4-21, Chợ An Bình",Cần Thơ,,"Ninh Kiều, Cần Thơ",VN,"10.007534999999999,105.746826"
695,ChIJaeXvE66JoDERVVea_woa2cc,Cửa Hàng Tạp Hóa Quốc Hương,Cửa hàng bách hóa,0292 3913 001,"Cửa Hàng Tạp Hóa Quốc Hương, An Bình, Ninh Kiều, Cần Thơ","An Bình, Ninh Kiều",,Cần Thơ,,"Ninh Kiều, Cần Thơ",VN,"10.0063079,105.7457041"
696,ChIJ2a3LbrKJoDERQXv8tjUtHww,Cửa Hàng Điện Thoại Quang Thái,Cửa hàng điện thoại di động,0939 154 968,"Cửa Hàng Điện Thoại Quang Thái, 221F Đ. Hoàng Quốc Việt, An Bình, Ninh Kiều, Cần Thơ","An Bình, Ninh Kiều",221F Đ. Hoàng Quốc Việt,Cần Thơ,,"Ninh Kiều, Cần Thơ",VN,"10.008918399999999,105.7479001"
697,ChIJrTj4GbGJoDERP692YFFgzP4,Cửa hàng bách hóa Kim Hiền,Cửa hàng bách hóa,0981 776 422,"Cửa hàng bách hóa Kim Hiền, 61 Trần Hưng Đạo, Lê Bình, Cái Răng, Cần Thơ","Lê Bình, Cái Răng",61 Trần Hưng Đạo,Cần Thơ,,"Cái Răng, Cần Thơ",VN,"10.0049239,105.7509242"
698,ChIJ9ZRp3VOJoDER8suRw0X1bGg,Cửa hàng tiện ích Kim Hiền,Cửa hàng,0776 826 861,"Cửa hàng tiện ích Kim Hiền, 12/16b Hẻm 132 Đ. 3 Tháng 2, Hưng Lợi, Ninh Kiều, Cần Thơ","Hưng Lợi, Ninh Kiều",12/16b Hẻm 132 Đ. 3 Tháng 2,Cần Thơ,,"Ninh Kiều, Cần Thơ",VN,"10.0146736,105.7550636"
699,ChIJATbPFLGJoDERYr8ssyelkTY,Cửa Hàng Gạo Diễm,Cửa hàng thực phẩm,0939 390 549,"2Q42+6CR Cửa Hàng Gạo Diễm, Đinh Tiên Hoàng, Lê Bình, Cái Răng, Cần Thơ","Lê Bình, Cái Răng","2Q42+6CR, Đinh Tiên Hoàng",Cần Thơ,,"Cái Răng, Cần Thơ",VN,"10.0056181,105.7510087"
700,ChIJqQuoQbGJoDERtuJTosE6yPw,Cửa Hàng Đồ Nhựa Ông Siêu,Cửa hàng,0292 3846 247,"Cửa Hàng Đồ Nhựa Ông Siêu, 24 Ngô Quyền, Lê Bình, Cái Răng, Cần Thơ","Lê Bình, Cái Răng",24 Ngô Quyền,Cần Thơ,,"Cái Răng, Cần Thơ",VN,"10.0058589,105.7514333"
701,ChIJG3k3q7SJoDERnOgw5OTpz6g,Cửa Hàng Điện Thoại Di Động Minh Hòa,Cửa hàng điện thoại di động,0292 3846 447,"Cửa Hàng Điện Thoại Di Động Minh Hòa, 121A, Đường 3/2 Nối Dài, p. An Bình, Quận Ninh Kiều, Hưng Lợi, Ninh Kiều, Cần Thơ","Hưng Lợi, Ninh Kiều","121A, Đường 3/2 Nối Dài, p. An Bình, Quận Ninh Kiều",Cần Thơ,,"Ninh Kiều, Cần Thơ",VN,"10.0115666,105.75284549999999"
702,ChIJ55U4QLGJoDEReZyBKYM0Q-E,Cửa Hàng Đồ Nhựa Triều Phát,Cửa hàng,0292 3846 039,"Cửa Hàng Đồ Nhựa Triều Phát, 57 Đinh Tiên Hoàng, Lê Bình, Cái Răng, Cần Thơ","Lê Bình, Cái Răng",57 Đinh Tiên Hoàng,Cần Thơ,,"Cái Răng, Cần Thơ",VN,"10.0058185,105.75132119999999"
703,ChIJOYXierOJoDEREUJgGzxO984,Cửa Hàng Sữa Long Thành,Cửa hàng thực phẩm,0292 3846 384,"Cửa Hàng Sữa Long Thành, 108/3, Quốc Lộ 1A, P. An Bình, Quận Ninh Kiều, An Bình, Ninh Kiều, Cần Thơ","An Bình, Ninh Kiều","108/3, Quốc Lộ 1A, P. An Bình, Quận Ninh Kiều",Cần Thơ,,"Ninh Kiều, Cần Thơ",VN,"10.0102503,105.75216979999999"
704,ChIJzcRUOrGJoDERFEMSmZC4bUg,Cửa Hàng Phụ Liệu Tóc - Mỹ Phẩm Lam Khương,Cửa hàng mỹ phẩm,0292 2469 966,"Cửa Hàng Phụ Liệu Tóc - Mỹ Phẩm Lam Khương, 19 Ngô Quyền, Lê Bình, Cái Răng, Cần Thơ","Lê Bình, Cái Răng",19 Ngô Quyền,Cần Thơ,,"Cái Răng, Cần Thơ",VN,"10.0050256,105.7518923"
705,ChIJhf1MRbOJoDERYRLWpqICwhk,Cửa Hàng Điện Thoại Di Động Hiền,Cửa hàng điện thoại di động,0292 2463 378,"Cửa Hàng Điện Thoại Di Động Hiền, 85/5, Quốc Lộ 1A, TP Cần Thơ, Quận Cái Răng, An Bình, Ninh Kiều, Cần Thơ","An Bình, Ninh Kiều","85/5, Quốc Lộ 1A, TP Cần Thơ, Quận Cái Răng",Cần Thơ,,"Ninh Kiều, Cần Thơ",VN,"10.0115651,105.7528433"
706,ChIJI5dwPrGJoDERLlefjjHDvM0,Cửa Hàng Kính Nhân,Cửa hàng vật liệu xây dựng,0989 037 426,"Cửa Hàng Kính Nhân, 53/2 Hàm Nghi, Lê Bình, Cái Răng, Cần Thơ","Lê Bình, Cái Răng",53/2 Hàm Nghi,Cần Thơ,,"Cái Răng, Cần Thơ",VN,"10.0052953,105.7514964"
707,ChIJNTXkELGJoDER9N2wSC6E1is,Cửa Hàng Xe Đạp Hưng Phát,Cửa hàng đồ thể thao,0292 2464 222,"Cửa Hàng Xe Đạp Hưng Phát, 64 Trần Hưng Đạo, Lê Bình, Cái Răng, Cần Thơ","Lê Bình, Cái Răng",64 Trần Hưng Đạo,Cần Thơ,,"Cái Răng, Cần Thơ",VN,"10.0052097,105.75066"
708,ChIJcVvRAkuIoDERSlzbSOkXmFY,Cửa Hàng Nhôm Nhựa Gia Dụng Nguyên,Cửa hàng,0911 878 224,"Cửa Hàng Nhôm Nhựa Gia Dụng Nguyên, 12/5B Hẻm 132 Đ. 3 Tháng 2, Hưng Lợi, Ninh Kiều, Cần Thơ","Hưng Lợi, Ninh Kiều",12/5B Hẻm 132 Đ. 3 Tháng 2,Cần Thơ,,"Ninh Kiều, Cần Thơ",VN,"10.014336,105.7555216"
709,ChIJv9QIwLCJoDERMoz4Y6x9wOQ,Cửa Hàng Điện -Nước- Gia Dụng Thiên Quang,Cửa hàng thiết bị điện,0919 145 832,"Cửa Hàng Điện -Nước- Gia Dụng Thiên Quang, 454 Nguyễn Trãi, Lê Bình, Cái Răng, Cần Thơ","Lê Bình, Cái Răng",454 Nguyễn Trãi,Cần Thơ,,"Cái Răng, Cần Thơ",VN,"10.0030744,105.75099209999999"
710,ChIJf7R0T7WJoDER2KgkyfLaFDk,Cửa Hàng Điện Máy,Cửa hàng bán đồ điện tử,0292 3837 689,"Cửa Hàng Điện Máy, 59, Đường 30/4, Quận Ninh Kiều, Tp Cần Thơ, Hưng Lợi, Ninh Kiều, Cần Thơ","Hưng Lợi, Ninh Kiều","59, Đường 30/4, Quận Ninh Kiều, Tp Cần Thơ",Cần Thơ,,"Ninh Kiều, Cần Thơ",VN,"10.0115535,105.7576735"
711,ChIJWRvzZLOJoDERar90qErNjdw,Cửa Hàng Dầu Nhớt AMALIE,Cửa hàng phụ tùng xe ô tô,0292 3512 036,"Cửa Hàng Dầu Nhớt AMALIE, 110/3, Quốc Lộ 1A, P. An Bình, Quận Ninh Kiều, An Bình, Ninh Kiều, Cần Thơ","An Bình, Ninh Kiều","110/3, Quốc Lộ 1A, P. An Bình, Quận Ninh Kiều",Cần Thơ,,"Ninh Kiều, Cần Thơ",VN,"10.010464899999999,105.75221909999999"
712,ChIJHT-z2LCJoDER4CAEkE682yU,Cửa Hàng Đồng Hồ Cường,Cửa hàng đồng hồ,0292 3911 528,"Cửa Hàng Đồng Hồ Cường, 13 Lê Thái Tổ, Lê Bình, Cái Răng, Cần Thơ","Lê Bình, Cái Răng",13 Lê Thái Tổ,Cần Thơ,,"Cái Răng, Cần Thơ",VN,"10.0040772,105.75174779999999"
713,ChIJXfur-rCJoDERth_7wpX0ZLs,Cửa Hàng Xe Đạp Điện Minh Nhiên,Cửa hàng,0907 312 111,"Cửa Hàng Xe Đạp Điện Minh Nhiên, 45/5, KV Yên Bình, Cái Răng, Cần Thơ","Lê Bình, Cái Răng","45/5, KV Yên Bình",Cần Thơ,,"Cái Răng, Cần Thơ",VN,"10.0034872,105.7504359"
714,ChIJI2iqGraJoDERzfAmHErMRao,Cửa Hàng Điện Thoại Phát Tiến 2,Cửa hàng bán đồ điện tử,,"Cửa Hàng Điện Thoại Phát Tiến 2, 55a Hẻm 132 Đ. 3 Tháng 2, Hưng Lợi, Ninh Kiều, Cần Thơ","Hưng Lợi, Ninh Kiều",55a Hẻm 132 Đ. 3 Tháng 2,Cần Thơ,,"Ninh Kiều, Cần Thơ",VN,"10.0196875,105.7576764"
717,ChIJs0zobLOJoDER4QuWT6SZKKo,Ngoc Tung Repair-Wash Motocar Store,Cửa hàng bảo trì và sửa chữ ô tô,0292 3834 393,"Ngoc Tung Repair-Wash Motocar Store, 107/3, Highway 1A, An Binh Ward, Ninh Kieu District, Can Tho City, An Bình, Ninh Kiều, Cần Thơ","An Bình, Ninh Kiều","107/3, Highway 1A, An Binh Ward, Ninh Kieu District, Can Tho City",Cần Thơ,,"Ninh Kiều, Cần Thơ",VN,"10.0106152,105.75135399999999"
718,ChIJbyVxFLGJoDERS3ENWoSJwIE,Mi Ngot Store,Cửa hàng bách hóa,0292 3915 859,"Mi Ngot Store, 59 Đinh Tiên Hoàng, Lê Bình, Cái Răng, Cần Thơ","Lê Bình, Cái Răng",59 Đinh Tiên Hoàng,Cần Thơ,,"Cái Răng, Cần Thơ",VN,"10.005444299999999,105.75077089999999"
719,ChIJCT5PFa6JoDERNsyysjeK1C0,Cửa Hàng Gạo A Huê,Cửa hàng,0292 3847 983,"Cửa Hàng Gạo A Huê, 182 ĐT923, An Bình, Ninh Kiều, Cần Thơ","An Bình, Ninh Kiều",182 ĐT923,Cần Thơ,,"Ninh Kiều, Cần Thơ",VN,"10.0059351,105.7452168"
720,ChIJuWFWErGJoDERCy-00brg7qQ,Công Ty Tnhh Hakia - Cửa Hàng Điện Gia Dụng,Cửa hàng thiết bị điện,,"Công Ty Tnhh Hakia - Cửa Hàng Điện Gia Dụng, 63 Trần Hưng Đạo, Lê Bình, Cái Răng, Cần Thơ","Lê Bình, Cái Răng",63 Trần Hưng Đạo,Cần Thơ,,"Cái Răng, Cần Thơ",VN,"10.005528,105.75074869999999"
721,ChIJE0ViFbGJoDERKRmMlnzD9oM,Hieu Chi Flower Shop,Cửa hàng hoa,0977 113 846,"Hieu Chi Flower Shop, City, 59/2 Đinh Tiên Hoàng, Street, Cái Răng, Cần Thơ","Street, Cái Răng","City, 59/2 Đinh Tiên Hoàng",Cần Thơ,,"Cái Răng, Cần Thơ",VN,"10.005543699999999,105.7512467"
722,ChIJy2CDOjaIoDERZviyt2KA-EE,Cửa Hàng Mỹ Phẩm Nhật Vy,Cửa hàng mỹ phẩm,0978 380 078,"Cửa Hàng Mỹ Phẩm Nhật Vy, 132/25 Đ. 3 Tháng 2, Hưng Lợi, Ninh Kiều, Cần Thơ","Hưng Lợi, Ninh Kiều",132/25 Đ. 3 Tháng 2,Cần Thơ,,"Ninh Kiều, Cần Thơ",VN,"10.019448899999999,105.7595025"
723,ChIJ_-M4QTaIoDER2DbWvBcBSJY,Cửa Hàng Ốp Lưng Bé Cà Chua,Cửa hàng điện thoại di động,0899 500 750,"Cửa Hàng Ốp Lưng Bé Cà Chua, 132/15 Đ. 3 Tháng 2, Hưng Lợi, Ninh Kiều, Cần Thơ","Hưng Lợi, Ninh Kiều",132/15 Đ. 3 Tháng 2,Cần Thơ,,"Ninh Kiều, Cần Thơ",VN,"10.0190965,105.76037129999999"
724,ChIJl9NpYDaIoDERVE8f3BZ9rhI,Cửa Hàng Hàng Thái Lan 36,Cửa hàng đồ gia dụng,0948 061 660,"Cửa Hàng Hàng Thái Lan 36, 148/6 Hẻm 132 Đ. 3 Tháng 2, Hưng Lợi, Ninh Kiều, Cần Thơ","Hưng Lợi, Ninh Kiều",148/6 Hẻm 132 Đ. 3 Tháng 2,Cần Thơ,,"Ninh Kiều, Cần Thơ",VN,"10.0187413,105.76112719999999"
726,ChIJ36FT6keIoDERd-rMRudYNf4,Cửa Hàng 45 Gạo,Cửa hàng,,"Cửa Hàng 45 Gạo, 43 Đ. Nguyễn Hiền, Hưng Lợi, Ninh Kiều, Cần Thơ 900000","Hưng Lợi, Ninh Kiều",43 Đ. Nguyễn Hiền,Cần Thơ,900000.0,"Ninh Kiều, Cần Thơ",VN,"10.0241244,105.7573413"
727,ChIJSRi0C0aIoDER534I0oJ4Ods,Cửa Hàng Trang Thiết Bị Y Tế Dksh,Cửa hàng,,"Cửa Hàng Trang Thiết Bị Y Tế Dksh, 164 Đường B21, Khu dân cư 91B, Ninh Kiều, Cần Thơ","Khu dân cư 91B, Ninh Kiều",164 Đường B21,Cần Thơ,,"Ninh Kiều, Cần Thơ",VN,"10.024292599999999,105.75290749999999"
728,ChIJXY3k_riJoDER4MKrNHn2hKc,Cửa hàng ĐTDĐ TN Shop,Cửa hàng điện thoại di động,0901 018 910,"2QG4+39V Cửa hàng ĐTDĐ TN Shop, Đ. B19, Khu dân cư 91B, Ninh Kiều, Cần Thơ","Khu dân cư 91B, Ninh Kiều","2QG4+39V, Đ. B19",Cần Thơ,,"Ninh Kiều, Cần Thơ",VN,"10.025239599999999,105.7559283"
729,ChIJfVEOqQKJoDERMSN-Yyorn9Y,THỂ THAO THẮNG LỢI,Cửa hàng đồ lưu niệm thể thao,0982 939 409,"THỂ THAO THẮNG LỢI, 38 Hẻm 132 Đ. 3 Tháng 2, Hưng Lợi, Ninh Kiều, Cần Thơ","Hưng Lợi, Ninh Kiều",38 Hẻm 132 Đ. 3 Tháng 2,Cần Thơ,,"Ninh Kiều, Cần Thơ",VN,"10.019687,105.75767619999999"
730,ChIJochLBeiJoDERtYIJm7xcRmE,CỬA HÀNG SƠN TRUNG NAM CẦN THƠ,Cửa hàng sơn,0902 650 637,"CỬA HÀNG SƠN TRUNG NAM CẦN THƠ, 41 Đ. Số 7, KDC Metro, Ninh Kiều, Cần Thơ 94000","KDC Metro, Ninh Kiều",41 Đ. Số 7,Cần Thơ,94000.0,"Ninh Kiều, Cần Thơ",VN,"10.0221886,105.7590266"
732,ChIJr9raj0eIoDER2tBd0WxNtZQ,Cửa Hàng Điện Nước Huy Ngữ,Cửa hàng thiết bị điện,0778 171 583,"Cửa Hàng Điện Nước Huy Ngữ, 2 Đ. Nguyễn Hiền, Khu dân cư 91B, Ninh Kiều, Cần Thơ","Khu dân cư 91B, Ninh Kiều",2 Đ. Nguyễn Hiền,Cần Thơ,,"Ninh Kiều, Cần Thơ",VN,"10.0249683,105.7580765"
733,ChIJ-UN8ZjiIoDERXxP6ZEXSu54,Cửa Hàng Tạp Hóa Ngọc Xuyến,Cửa hàng tạp hóa,0907 829 430,"Cửa Hàng Tạp Hóa Ngọc Xuyến, Hưng Lợi, Ninh Kiều, Cần Thơ","Hưng Lợi, Ninh Kiều",,Cần Thơ,,"Ninh Kiều, Cần Thơ",VN,"10.025034999999999,105.7598179"
734,ChIJ7fLEPseJoDERDIIa1fpKLBI,Cửa Hàng Siêu Rẻ 39k Cần Thơ,Cửa hàng đồ gia dụng,0901 027 989,"Cửa Hàng Siêu Rẻ 39k Cần Thơ, 102 Đường Trần Hoàng Na, Hưng Lợi, Ninh Kiều, Cần Thơ 94000","Hưng Lợi, Ninh Kiều",102 Đường Trần Hoàng Na,Cần Thơ,94000.0,"Ninh Kiều, Cần Thơ",VN,"10.0170469,105.7590257"
735,ChIJRZgHSjmJoDERRxefJf0EiTw,Cửa hàng dụng cụ thể dục thể thao PT,Cửa hàng,,"Cửa hàng dụng cụ thể dục thể thao PT, 150 Đ. 3 Tháng 2, Hưng Lợi, Ninh Kiều, Cần Thơ","Hưng Lợi, Ninh Kiều",150 Đ. 3 Tháng 2,Cần Thơ,,"Ninh Kiều, Cần Thơ",VN,"10.0198419,105.7615502"
736,ChIJBWc9cEeIoDERzgjtSmfVXu4,Cửa Hàng Gas Anh Thơ,Cửa hàng,0292 3894 111,"Cửa Hàng Gas Anh Thơ, 337 QL91B, Hưng Lợi, Ninh Kiều, Cần Thơ","Hưng Lợi, Ninh Kiều",337 QL91B,Cần Thơ,,"Ninh Kiều, Cần Thơ",VN,"10.0262123,105.7576423"
737,ChIJgTITn7yJoDERk3jIqTSA-tE,Cửa hàng vật tư nông nghiệp Hưng Lợi,Cửa hàng,0907 761 890,"Cửa hàng vật tư nông nghiệp Hưng Lợi, 27 Đ. Nguyễn Văn Linh, P, Ninh Kiều, Cần Thơ","P, Ninh Kiều",27 Đ. Nguyễn Văn Linh,Cần Thơ,,"Ninh Kiều, Cần Thơ",VN,"10.024763199999999,105.76039039999999"
738,ChIJD4JejTaIoDERK-vPatBLUxE,Cửa Hàng Mỹ Phẩm Kim Lý,Cửa hàng mỹ phẩm,0706 756 768,"Cửa Hàng Mỹ Phẩm Kim Lý, 10, Ba Tháng Hai, Phường Hưng Lợi, Quận Ninh Kiều, Thành Phố Cần Thơ, Hưng Lợi, Ninh Kiều, Cần Thơ","Hưng Lợi, Ninh Kiều","10, Ba Tháng Hai, Phường Hưng Lợi, Quận Ninh Kiều, Thành Phố Cần Thơ",Cần Thơ,,"Ninh Kiều, Cần Thơ",VN,"10.018600099999999,105.762236"
739,ChIJ52Cb9zOIoDERyuzlhcqsrEU,Cửa Hàng Đtdđ - Cầm Đồ Hoàng Châu,Cửa hàng điện thoại di động,0292 6290 186,"Cửa Hàng Đtdđ - Cầm Đồ Hoàng Châu, 566 Đ. 30 Tháng 4, Hưng Lợi, Ninh Kiều, Cần Thơ","Hưng Lợi, Ninh Kiều",566 Đ. 30 Tháng 4,Cần Thơ,,"Ninh Kiều, Cần Thơ",VN,"10.016502,105.7645572"
740,ChIJDYlnxzWIoDERu-E5IxTwkbY,Cửa Hàng Dầu Mỡ Nhờn Mipec Hoàng Long Phi,Cửa hàng phụ tùng xe ô tô,7103783668,"Cửa Hàng Dầu Mỡ Nhờn Mipec Hoàng Long Phi, 111 Đ. 3 Tháng 2, Hưng Lợi, Ninh Kiều, Cần Thơ","Hưng Lợi, Ninh Kiều",111 Đ. 3 Tháng 2,Cần Thơ,,"Ninh Kiều, Cần Thơ",VN,"10.0160831,105.7605468"
741,ChIJ6f6JfDiIoDERqUOIMMv4a2c,Cửa Hàng Ống Nhựa Huy Ngữ,Cửa hàng vật liệu xây dựng,0292 3833 403,"Cửa Hàng Ống Nhựa Huy Ngữ, 2 QL91B, Hưng Lợi, Ninh Kiều, Cần Thơ","Hưng Lợi, Ninh Kiều",2 QL91B,Cần Thơ,,"Ninh Kiều, Cần Thơ",VN,"10.0253806,105.75918539999999"
742,ChIJQ4Sp6TCIoDERt4ulAUwDSj8,Cửa Hàng Thực Phẩm,Cửa hàng bán thực phẩm sạch,0989 952 590,"Cửa Hàng Thực Phẩm, 404A/13, Nguyễn Văn Linh, Quận Ninh Kiều, Thành Phố Cần Thơ, Hưng Lợi, Ninh Kiều, Cần Thơ","Hưng Lợi, Ninh Kiều","404A/13, Nguyễn Văn Linh, Quận Ninh Kiều, Thành Phố Cần Thơ",Cần Thơ,,"Ninh Kiều, Cần Thơ",VN,"10.0214511,105.7656322"
743,ChIJi4ECDUeIoDERZj9Geg0W0OI,Cửa Hàng Sim Số Vạn Toàn,Cửa hàng điện thoại di động,7102222888,"Cửa Hàng Sim Số Vạn Toàn, 19A Khu Dân Cư Metro, QL91B, Hưng Lợi, Ninh Kiều, Cần Thơ","Hưng Lợi, Ninh Kiều","19A Khu Dân Cư Metro, QL91B",Cần Thơ,,"Ninh Kiều, Cần Thơ",VN,"10.026167899999999,105.75701029999999"
744,ChIJWTW7jjaIoDER9JSqnrrWEZU,Cửa Hàng Xe Máy Tân Tín Việt,Đại lý xe mô tô,1800 1551,"Cửa Hàng Xe Máy Tân Tín Việt, 126 Đ. 3 Tháng 2, Hưng Lợi, Ninh Kiều, Cần Thơ","Hưng Lợi, Ninh Kiều",126 Đ. 3 Tháng 2,Cần Thơ,,"Ninh Kiều, Cần Thơ",VN,"10.018336699999999,105.7618677"
745,ChIJ_4z6eDWIoDERCAFJ9dveR-w,Cửa Hàng Vlxd Diễm Ngọc,Cửa hàng vật liệu xây dựng,,"Cửa Hàng Vlxd Diễm Ngọc, 69 Đ. 3 Tháng 2, Hưng Lợi, Ninh Kiều, Cần Thơ","Hưng Lợi, Ninh Kiều",69 Đ. 3 Tháng 2,Cần Thơ,,"Ninh Kiều, Cần Thơ",VN,"10.0150332,105.7589134"
746,ChIJ4cHHz6WJoDERKiIZGtyEepA,CỬA HÀNG THỰC PHẨM TƯƠI SỐNG,Cửa hàng thịt,,"CỬA HÀNG THỰC PHẨM TƯƠI SỐNG, 154 Đ. Nguyễn Hiền, Khu dân cư 91B, Ninh Kiều, Cần Thơ","Khu dân cư 91B, Ninh Kiều",154 Đ. Nguyễn Hiền,Cần Thơ,,"Ninh Kiều, Cần Thơ",VN,"10.0225359,105.7553545"
747,ChIJUU1UEziIoDERxz3ukhCNTsg,Cửa Hàng Nhựa Inox Gia Khang,Cửa hàng vật liệu xây dựng,0292 3740 877,"Cửa Hàng Nhựa Inox Gia Khang, 29A Quốc Lộ 91B, Quận Ninh Kiều, Tp Cần Thơ, Hưng Lợi, Ninh Kiều, Cần Thơ","Hưng Lợi, Ninh Kiều","29A Quốc Lộ 91B, Quận Ninh Kiều, Tp Cần Thơ",Cần Thơ,,"Ninh Kiều, Cần Thơ",VN,"10.0242021,105.7596796"
748,ChIJ_xWXQjiIoDERWNZdIJ40eqY,Cửa Hàng Ngọc Quang,Cửa hàng quà tặng,0292 3687 766,"Cửa Hàng Ngọc Quang, 410P, Nguyễn Văn Linh, Phường Hưng Lợi, Quận Ninh Kiều, Thành Phố Cần Thơ, Hưng Lợi, Ninh Kiều, Cần Thơ","Hưng Lợi, Ninh Kiều","410P, Nguyễn Văn Linh, Phường Hưng Lợi, Quận Ninh Kiều, Thành Phố Cần Thơ",Cần Thơ,,"Ninh Kiều, Cần Thơ",VN,"10.0248086,105.76021659999999"
749,ChIJad8GZTiIoDERottf8E_iHZc,Cửa Hàng Đtdđ Thời Gian,Cửa hàng,,"Cửa Hàng Đtdđ Thời Gian, 33 Đ. Nguyễn Văn Linh, Hưng Lợi, Ninh Kiều, Cần Thơ","Hưng Lợi, Ninh Kiều",33 Đ. Nguyễn Văn Linh,Cần Thơ,,"Ninh Kiều, Cần Thơ",VN,"10.024994699999999,105.7594658"
750,ChIJYa87TDeIoDERk9HdtKJBKCI,Cửa Hàng Kho Nệm Sỉ,Cửa hàng nội thất,1800 888909,"Cửa Hàng Kho Nệm Sỉ, 1L1, Đ. Nguyễn Văn Linh, Hưng Lợi, Ninh Kiều, Cần Thơ","Hưng Lợi, Ninh Kiều","1L1, Đ. Nguyễn Văn Linh",Cần Thơ,,"Ninh Kiều, Cần Thơ",VN,"10.0217367,105.7641117"
751,ChIJz-zabUeIoDERaPYJUyx-WIA,Cửa Hàng Đtdđ Ngọc Lan,Cửa hàng,0944 134 678,"Cửa Hàng Đtdđ Ngọc Lan, 327 QL91B, Hưng Lợi, Ninh Kiều, Cần Thơ","Hưng Lợi, Ninh Kiều",327 QL91B,Cần Thơ,,"Ninh Kiều, Cần Thơ",VN,"10.026538799999999,105.7574956"
752,ChIJH7m6QEeIoDER9cQkaZPat3w,Cửa Hàng Dán Xe Tạo 91B,Đại lý xe mô tô,0292 3897 834,"Cửa Hàng Dán Xe Tạo 91B, 410 QL91B, Hưng Lợi, Ninh Kiều, Cần Thơ","Hưng Lợi, Ninh Kiều",410 QL91B,Cần Thơ,,"Ninh Kiều, Cần Thơ",VN,"10.0273021,105.7572297"
753,ChIJkUsS2EaIoDERPpBij6vTEUc,Cửa Hàng Nội Thất Nhựa Đài Loan Cao Cấp Lộc Phát,Cửa hàng nội thất,0848 626 468,"Cửa Hàng Nội Thất Nhựa Đài Loan Cao Cấp Lộc Phát, 7 Đ. Nguyễn Văn Linh, Phường An Khánh, Ninh Kiều, Cần Thơ","Phường An Khánh, Ninh Kiều",7 Đ. Nguyễn Văn Linh,Cần Thơ,,"Ninh Kiều, Cần Thơ",VN,"10.0274439,105.75582999999999"
754,ChIJ_RZW0DmIoDERoHRiENKxz88,Cửa Hàng Đtdđ Quốc Trường,Cửa hàng điện thoại di động,,"Cửa Hàng Đtdđ Quốc Trường, 17 QL91B, Hưng Lợi, Ninh Kiều, Cần Thơ","Hưng Lợi, Ninh Kiều",17 QL91B,Cần Thơ,,"Ninh Kiều, Cần Thơ",VN,"10.0229976,105.76170189999999"
755,ChIJK6JkSDiIoDERpMTLbrnipHw,Cửa Hàng Đtdđ Ngọc Thảnh,Cửa hàng,0936 614 172,"Cửa Hàng Đtdđ Ngọc Thảnh, 40 Đ. Nguyễn Văn Linh, Hưng Lợi, Ninh Kiều, Cần Thơ","Hưng Lợi, Ninh Kiều",40 Đ. Nguyễn Văn Linh,Cần Thơ,,"Ninh Kiều, Cần Thơ",VN,"10.0243802,105.76084519999999"
756,ChIJldE9ZDiIoDER68DLKsb7N90,Cửa Hàng Đtdđ Huy Hiệp 2,Cửa hàng,0292 3781 355,"Cửa Hàng Đtdđ Huy Hiệp 2, 46A QL91B, Hưng Lợi, Ninh Kiều, Cần Thơ","Hưng Lợi, Ninh Kiều",46A QL91B,Cần Thơ,,"Ninh Kiều, Cần Thơ",VN,"10.0256209,105.75917199999999"
757,ChIJb7P93kOIoDERKTxWrbGqfBo,Cửa Hàng Hoa Tươi Phong Cách Thiên Nhiên,Cửa hàng hoa,0939 715 660,"Cửa Hàng Hoa Tươi Phong Cách Thiên Nhiên, 310/10 Đ. Nguyễn Văn Linh, Phường An Khánh, Ninh Kiều, Cần Thơ","Phường An Khánh, Ninh Kiều",310/10 Đ. Nguyễn Văn Linh,Cần Thơ,,"Ninh Kiều, Cần Thơ",VN,"10.026589099999999,105.7571294"
758,ChIJ_xWXQjiIoDERbneDJomwIyk,Cửa Hàng Phụ Tùng Vinh,Đại lý xe mô tô,0989 237 044,"Cửa Hàng Phụ Tùng Vinh, 233, Nguyễn Văn Linh, Phường Hưng Lợi, Quận Ninh Kiều, Thành Phố Cần Thơ, Hưng Lợi, Ninh Kiều, Cần Thơ","Hưng Lợi, Ninh Kiều","233, Nguyễn Văn Linh, Phường Hưng Lợi, Quận Ninh Kiều, Thành Phố Cần Thơ",Cần Thơ,,"Ninh Kiều, Cần Thơ",VN,"10.0247715,105.7601109"
759,ChIJaRUciDiIoDERop9pDySLJNo,Cửa Hàng Phụ Tùng Xe Trần Văn Trí,Đại lý xe mô tô,0988 413 304,"Cửa Hàng Phụ Tùng Xe Trần Văn Trí, 290A Đ. Nguyễn Văn Linh, Hưng Lợi, Ninh Kiều, Cần Thơ","Hưng Lợi, Ninh Kiều",290A Đ. Nguyễn Văn Linh,Cần Thơ,,"Ninh Kiều, Cần Thơ",VN,"10.025603,105.7593565"
761,ChIJgREtGzWIoDERrAVlwRKf3cM,Cửa Hàng Thời Trang Subin,Cửa hàng quần áo,0292 3837 280,"Cửa Hàng Thời Trang Subin, 223, Đường 30/04, Quận Ninh Kiều, Tp Cần Thơ, Hưng Lợi, Ninh Kiều, Cần Thơ","Hưng Lợi, Ninh Kiều","223, Đường 30/04, Quận Ninh Kiều, Tp Cần Thơ",Cần Thơ,,"Ninh Kiều, Cần Thơ",VN,"10.013934299999999,105.76098759999999"
762,ChIJK7E8QjGIoDER2qN_UWGGHrs,Hoang Chau Mobile Store,Cửa hàng,0919 334 244,"Hoang Chau Mobile Store, 176, 30/4 Street, Ninh Kieu District, Can Tho City, Hưng Lợi, Ninh Kiều, Cần Thơ","Hưng Lợi, Ninh Kiều","176, 30/4 Street, Ninh Kieu District, Can Tho City",Cần Thơ,,"Ninh Kiều, Cần Thơ",VN,"10.018116599999999,105.7658165"
