,place_id,name,main_category,phone,address,address_ward,address_street,address_city,address_postal_code,address_state,address_country_code,coordinates
411,ChIJ-T7j7xGIoDERV0r0n701mr4,Van Anh Mobile Store,Cửa hàng,0292 3891 456,"Van Anh Mobile Store, 335 Đ. Nguyễn Văn Cừ, An Hoà, Ninh Kiều, Cần Thơ","An Hoà, Ninh Kiều",335 Đ. Nguyễn Văn Cừ,Cần Thơ,,"Ninh Kiều, Cần Thơ",VN,"10.0455407,105.7674464"
412,ChIJq6qqBw-IoDERM4QWJL4Q-vs,Cửa Hàng Ngọc Khóa Việt Tiệp,Cửa hàng,0292 3827 384,"Cửa Hàng Ngọc Khóa Việt Tiệp, 28 Đ. Nguyễn Văn Cừ, An Hoà, Ninh Kiều, Cần Thơ","An Hoà, Ninh Kiều",28 Đ. Nguyễn Văn Cừ,Cần Thơ,,"Ninh Kiều, Cần Thơ",VN,"10.047019299999999,105.76794439999999"
413,ChIJq6qqBw-IoDERXyvmrtJ09rk,Cửa Hàng VLXD Ngọc Vinh,Cửa hàng vật liệu xây dựng,0292 3896 117,"Cửa Hàng VLXD Ngọc Vinh, 175, Đường Nguyễn Văn Cừ, Phường An Hoà, Quận Ninh Kiều, Tp Cần Thơ, An Hoà, Ninh Kiều, Cần Thơ","An Hoà, Ninh Kiều","175, Đường Nguyễn Văn Cừ, Phường An Hoà, Quận Ninh Kiều, Tp Cần Thơ",Cần Thơ,,"Ninh Kiều, Cần Thơ",VN,"10.047019299999999,105.76794439999999"
414,ChIJa9xlyw-IoDERQ04kxKWMVN8,Cửa Hàng Điện Thoại Di Động Hưng Nguyễn,Cửa hàng điện thoại di động,0904 535 158,"Cửa Hàng Điện Thoại Di Động Hưng Nguyễn, 335 Đ. Nguyễn Văn Cừ, An Hoà, Ninh Kiều, Cần Thơ","An Hoà, Ninh Kiều",335 Đ. Nguyễn Văn Cừ,Cần Thơ,,"Ninh Kiều, Cần Thơ",VN,"10.0455407,105.7674464"
415,ChIJq6qqBw-IoDERness_z9Slc0,Cửa Hàng Gas Phương Nam,Cửa hàng,0292 3898 222,"Cửa Hàng Gas Phương Nam, 10A K4 Đ. Nguyễn Văn Cừ, An Hoà, Ninh Kiều, Cần Thơ","An Hoà, Ninh Kiều",10A K4 Đ. Nguyễn Văn Cừ,Cần Thơ,,"Ninh Kiều, Cần Thơ",VN,"10.047019299999999,105.76794439999999"
416,ChIJD5BAuGuIoDERbXAoC4eaIfQ,Cửa Hàng Điện Thoại,Cửa hàng điện thoại di động,0938 238 861,"Cửa Hàng Điện Thoại, 75 Đ. số 30, Phường An Khánh, Ninh Kiều, Cần Thơ","Phường An Khánh, Ninh Kiều",75 Đ. số 30,Cần Thơ,,"Ninh Kiều, Cần Thơ",VN,"10.0375338,105.7541239"
418,ChIJ22uERWiJoDER9eZP8WV-qU0,Cửa hàng Thực phẩm Thuỷ Sản Cần Thơ,Cửa hàng tạp phẩm,0902 010 615,"Cửa hàng Thực phẩm Thuỷ Sản Cần Thơ, 14 Đường số 23, Phường An Khánh, Ninh Kiều, Cần Thơ","Phường An Khánh, Ninh Kiều",14 Đường số 23,Cần Thơ,,"Ninh Kiều, Cần Thơ",VN,"10.0390979,105.75746769999999"
419,ChIJIWTQtn-JoDERwBIvPjB4ep8,Cửa Hàng ĐTDĐ Văn Apple Cần Thơ,Cửa hàng điện thoại di động,0386 145 679,"Cửa Hàng ĐTDĐ Văn Apple Cần Thơ, 75b Đ. Phạm Thế Hiển, Phường An Khánh, Ninh Kiều, Cần Thơ","Phường An Khánh, Ninh Kiều",75b Đ. Phạm Thế Hiển,Cần Thơ,,"Ninh Kiều, Cần Thơ",VN,"10.039500799999999,105.7566635"
420,ChIJJ5bitv-JoDERuk-jaug-LDY,Cửa Hàng Thiên Hoa Sen,Cửa hàng tạp phẩm,0939 858 793,"Cửa Hàng Thiên Hoa Sen, 55 Đ. Số 2, KDC Thới Nhựt 1, Ninh Kiều, Cần Thơ","KDC Thới Nhựt 1, Ninh Kiều",55 Đ. Số 2,Cần Thơ,,"Ninh Kiều, Cần Thơ",VN,"10.0425457,105.7542174"
421,ChIJfz9_2WqIoDERJH9I69R2Vlo,Cửa Hàng Màn Cửa - Nệm Cao Cấp Hoàng Gia,Cửa hàng nội thất,0961 509 599,"Cửa Hàng Màn Cửa - Nệm Cao Cấp Hoàng Gia, 394 Đ. Nguyễn Văn Cừ, Phường An Khánh, Ninh Kiều, Cần Thơ","Phường An Khánh, Ninh Kiều",394 Đ. Nguyễn Văn Cừ,Cần Thơ,,"Ninh Kiều, Cần Thơ",VN,"10.0361183,105.7578585"
422,ChIJ4RpnQFGIoDERcj9XDPlbG1U,Cửa Hàng Điện Nước Minh Tuấn,Cửa hàng thiết bị điện,0292 3898 580,"Cửa Hàng Điện Nước Minh Tuấn, 401 Đ.Xuân Thủy, An Bình, Ninh Kiều, Cần Thơ","An Bình, Ninh Kiều",401 Đ.Xuân Thủy,Cần Thơ,,"Ninh Kiều, Cần Thơ",VN,"10.019632999999999,105.7426945"
423,ChIJDUQsQ1GIoDERYm0Q3ovn1Z0,Cửa Hàng Thực Phẩm Chay Diệu Hiền,Cửa hàng tạp phẩm,0944 550 775,"Cửa Hàng Thực Phẩm Chay Diệu Hiền, 315 Cái Sơn Hàng Bàng, An Bình, Ninh Kiều, Cần Thơ","An Bình, Ninh Kiều",315 Cái Sơn Hàng Bàng,Cần Thơ,,"Ninh Kiều, Cần Thơ",VN,"10.019019499999999,105.7423086"
424,ChIJyZBb3lCIoDERBiN8bMQI2FQ,Cửa Hàng Nội Thất Gỗ Việt Nhung,Cửa hàng nội thất,0916 277 799,"Cửa Hàng Nội Thất Gỗ Việt Nhung, 393AA Nguyễn Văn Cừ Nối Dài, An Bình, Ninh Kiều, Cần Thơ","An Bình, Ninh Kiều",393AA Nguyễn Văn Cừ Nối Dài,Cần Thơ,,"Ninh Kiều, Cần Thơ",VN,"10.021254599999999,105.74226469999999"
425,ChIJC97M5vOJoDERJvmZ2IqQx3U,Cửa Hàng Xe Máy TÂN LẬP HƯNG,Cửa hàng xe máy,0795 929 689,"Cửa Hàng Xe Máy TÂN LẬP HƯNG, 174 Đ. Hoàng Quốc Việt, An Bình, Ninh Kiều, Cần Thơ","An Bình, Ninh Kiều",174 Đ. Hoàng Quốc Việt,Cần Thơ,,"Ninh Kiều, Cần Thơ",VN,"10.0152025,105.74433599999999"
426,ChIJq6qqqhWIoDERh10W9-vTKko,Cửa Hàng Điện Thoại Di Động ĐỘC và LẠ 3,Cửa hàng điện thoại di động,0939 397 393,"Cửa Hàng Điện Thoại Di Động ĐỘC và LẠ 3, 107 Nguyễn Văn Cừ Nối Dài, Phường An Khánh, Ninh Kiều, Cần Thơ","Phường An Khánh, Ninh Kiều",107 Nguyễn Văn Cừ Nối Dài,Cần Thơ,,"Ninh Kiều, Cần Thơ",VN,"10.025714899999999,105.7473873"
427,ChIJ_3SGDgOJoDERqTsHiU8c5fs,Cửa hàng Dê Ngon 79 sỉ và lẻ,Cửa hàng tạp phẩm,,"Cửa hàng Dê Ngon 79 sỉ và lẻ, 120 Đ. Tú Xương, An Bình, Ninh Kiều, Cần Thơ","An Bình, Ninh Kiều",120 Đ. Tú Xương,Cần Thơ,,"Ninh Kiều, Cần Thơ",VN,"10.0251997,105.74726229999999"
428,ChIJyYjwWiGJoDERl47MkLlrj8w,CỬA HÀNG XE PHẨM XUÂN,Cửa hàng xe máy,0702 525 283,"CỬA HÀNG XE PHẨM XUÂN, 177 Đ.Xuân Thủy, An Bình, Ninh Kiều, Cần Thơ","An Bình, Ninh Kiều",177 Đ.Xuân Thủy,Cần Thơ,,"Ninh Kiều, Cần Thơ",VN,"10.023142199999999,105.746264"
429,ChIJB0ggrKGrNTERbfPn3B_3R9g,Chụt Store,Cửa hàng bán đồ điện tử,,"Chụt Store, 15 Ng. 4 P.Đặng Văn Ngữ, Trung Tự, Đống Đa, Hà Nội","Trung Tự, Đống Đa",15 Ng. 4 P.Đặng Văn Ngữ,Hà Nội,,"Đống Đa, Hà Nội",VN,"21.0101837,105.8344298"
430,ChIJH6omX4WrNTERt_yi02BMbpE,Cửa Hàng Cặp - Túi Xách Chính Nga,Cửa hàng phụ kiện thời trang,024 3516 2698,"Cửa Hàng Cặp - Túi Xách Chính Nga, 2 P. Khâm Thiên, Khâm Thiên, Đống Đa, Hà Nội","Khâm Thiên, Đống Đa",2 P. Khâm Thiên,Hà Nội,,"Đống Đa, Hà Nội",VN,"21.0189734,105.8402785"
431,ChIJZRfyLpCrNTERiwiWOtUr9Hw,Cửa Hàng Bảo Hộ Lao Động,Cửa hàng tạp phẩm,024 3942 7886,"Cửa Hàng Bảo Hộ Lao Động, 86 P. Nguyễn Du, Trần Hưng Đạo, Hai Bà Trưng, Hà Nội","Trần Hưng Đạo, Hai Bà Trưng",86 P. Nguyễn Du,Hà Nội,,"Hai Bà Trưng, Hà Nội",VN,"21.0201416,105.84353619999999"
432,ChIJwVJAUo-rNTER1iCr06U2omk,Đồ Gỗ Mỹ Nghệ Minh Châu,Cửa hàng nội thất,0915 312 468,"Đồ Gỗ Mỹ Nghệ Minh Châu, 436 Đ. Lê Duẩn, Phương Liên, Đống Đa, Hà Nội","Phương Liên, Đống Đa",436 Đ. Lê Duẩn,Hà Nội,,"Đống Đa, Hà Nội",VN,"21.0087141,105.84115469999999"
433,ChIJkRG7z5qrNTERWGE9f5eFABU,Cửa Hàng VLXD Dũng Lan,Cửa hàng vật liệu xây dựng,0972 395 885,"Cửa Hàng VLXD Dũng Lan, 42 Ng. Trung Tiền, Khâm Thiên, Đống Đa, Hà Nội","Khâm Thiên, Đống Đa",42 Ng. Trung Tiền,Hà Nội,,"Đống Đa, Hà Nội",VN,"21.0195533,105.8380736"
434,ChIJa9hYuYKrNTERzpyATpBybFA,Cửa Hàng Thời Trang Trẻ Em,Cửa hàng quần áo trẻ em,024 3511 9094,"2R9J+P2H Cửa Hàng Thời Trang Trẻ Em, Đường Tôn Đức Thắng, Quận Đống Đa, Hàng Bột, Đống Đa, Hà Nội","Hàng Bột, Đống Đa","2R9J+P2H, Đường Tôn Đức Thắng, Quận Đống Đa",Hà Nội,,"Đống Đa, Hà Nội",VN,"21.01932,105.8301212"
435,ChIJD8xxzYSrNTER2kmB2sdpDko,Cửa Hàng Tạp Hóa Hoàng Hiệp,Cửa hàng bách hóa,024 3516 2198,"Cửa Hàng Tạp Hóa Hoàng Hiệp, 305 Ng. Văn Chương, Khâm Thiên, Đống Đa, Hà Nội","Khâm Thiên, Đống Đa",305 Ng. Văn Chương,Hà Nội,,"Đống Đa, Hà Nội",VN,"21.0203644,105.8371361"
436,ChIJ_db0K5CrNTERk-Go37p0zIo,Cửa Hàng Rum,Cửa hàng tổng hợp,0948 556 988,"Cửa Hàng Rum, 63 P. Nguyễn Du, Nguyễn Du, Hai Bà Trưng, Hà Nội 100000","Nguyễn Du, Hai Bà Trưng",63 P. Nguyễn Du,Hà Nội,100000.0,"Hai Bà Trưng, Hà Nội",VN,"21.0198057,105.8437658"
437,ChIJ-wI98ISrNTERKhdAZJaOSyo,Cửa Hàng Đá Phong Thủy Hieu Jade,Cửa hàng,0976 710 620,"Cửa Hàng Đá Phong Thủy Hieu Jade, 196 P.Trung Phụng, Nam Đồng, Đống Đa, Hà Nội","Nam Đồng, Đống Đa",196 P.Trung Phụng,Hà Nội,,"Đống Đa, Hà Nội",VN,"21.0181434,105.8370144"
438,ChIJ08QUg4-rNTERt24J2OCtum0,Minizon Kids,Cửa hàng quần áo trẻ em,0982 069 598,"Minizon Kids, 200 P. Khâm Thiên, Khâm Thiên, Đống Đa, Hà Nội","Khâm Thiên, Đống Đa",200 P. Khâm Thiên,Hà Nội,,"Đống Đa, Hà Nội",VN,"21.0171544,105.8412791"
439,ChIJqw8z-qSJoDERG6eGUDNX5pA,Cửa Hàng Tạp Hoá Cô Chí,Cửa hàng bách hóa,0919 202 213,"Cửa Hàng Tạp Hoá Cô Chí, 65/1, Võ Tánh, Phường Lê Bình, Quận Cái Răng, Thành Phố Cần Thơ, Lê Bình, Cái Răng, Cần Thơ","Lê Bình, Cái Răng","65/1, Võ Tánh, Phường Lê Bình, Quận Cái Răng, Thành Phố Cần Thơ",Cần Thơ,,"Cái Răng, Cần Thơ",VN,"9.998661799999999,105.7443783"
440,ChIJDyvbU66JoDERZukN2Ih4XSA,Cửa Hàng Đồ Gỗ Lộc Phát,Cửa hàng bán dụng cụ sửa nhà,0292 2210 489,"2P3V+XPQ Cửa Hàng Đồ Gỗ Lộc Phát, ĐT923, An Bình, Ninh Kiều, Cần Thơ","An Bình, Ninh Kiều","2P3V+XPQ, ĐT923",Cần Thơ,,"Ninh Kiều, Cần Thơ",VN,"10.004959999999999,105.7443713"
441,ChIJ_7vxx5qJoDERgzlVxY2ADao,Cửa Hàng Gỗ Hà Yến,Cửa hàng đồ gia dụng,,"XPJW+94H Cửa Hàng Gỗ Hà Yến, Ba Láng, Cái Răng, Cần Thơ","Ba Láng, Cái Răng",XPJW+94H,Cần Thơ,,"Cái Răng, Cần Thơ",VN,"9.980941,105.74534949999999"
442,ChIJr5lCCK6JoDERYfR9bifm-Bs,Cửa Hàng Bao Bì,Cửa hàng bán dụng cụ đóng gói,0292 3846 871,"Cửa Hàng Bao Bì, 89A/2, Đường 3-2 Nối Dài, Phường An Bình, Quận Ninh Kiều, Thành Phố Cần Thơ, An Bình, Ninh Kiều, Cần Thơ","An Bình, Ninh Kiều","89A/2, Đường 3-2 Nối Dài, Phường An Bình, Quận Ninh Kiều, Thành Phố Cần Thơ",Cần Thơ,,"Ninh Kiều, Cần Thơ",VN,"10.0071426,105.746026"
443,ChIJrzHktKWJoDERtxlWCnU1uk0,Cửa Hàng Inox Minh Anh,Cửa hàng vật liệu xây dựng,0888 882 627,"Cửa Hàng Inox Minh Anh, 109 Lộ Vòng Cung, An Bình, Ninh Kiều, Cần Thơ","An Bình, Ninh Kiều",109 Lộ Vòng Cung,Cần Thơ,,"Ninh Kiều, Cần Thơ",VN,"9.9994192,105.7425944"
444,ChIJC_JMWbiJoDERwtlzb9aylP4,Cửa hàng thực phẩm An Bình,Cửa hàng tạp phẩm,0849 001 096,"Cửa hàng thực phẩm An Bình, 247 Đ. Hoàng Quốc Việt, An Bình, Ninh Kiều, Cần Thơ","An Bình, Ninh Kiều",247 Đ. Hoàng Quốc Việt,Cần Thơ,,"Ninh Kiều, Cần Thơ",VN,"10.010505799999999,105.7466446"
445,ChIJT2CL6EyIoDERsOR_69_53mo,Cửa Hàng Toàn Cúc,Cửa hàng thiết bị điện,0907 104 646,"Cửa Hàng Toàn Cúc, 3 Đ. Trần Vĩnh Kiết, An Bình, Ninh Kiều, Cần Thơ","An Bình, Ninh Kiều",3 Đ. Trần Vĩnh Kiết,Cần Thơ,,"Ninh Kiều, Cần Thơ",VN,"10.0116102,105.7513625"
446,ChIJpYho90yIoDERlHteFyiHBhM,Cửa Hàng Đồ Gỗ Xuân Phương,Cửa hàng bán dụng cụ sửa nhà,,"Cửa Hàng Đồ Gỗ Xuân Phương, 75 Đ. Trần Vĩnh Kiết, An Bình, Ninh Kiều, Cần Thơ","An Bình, Ninh Kiều",75 Đ. Trần Vĩnh Kiết,Cần Thơ,,"Ninh Kiều, Cần Thơ",VN,"10.0149176,105.7505413"
447,ChIJ38zspLOJoDERdeWM9-Q7j0g,Cửa Hàng Mua Bán & Trao Đổi Xe Cũ Minh Thành,Cửa hàng,0918 391 706,"Cửa Hàng Mua Bán & Trao Đổi Xe Cũ Minh Thành, 14, Quốc Lộ 1A, Quận Cái Răng, An Bình, Ninh Kiều, Cần Thơ","An Bình, Ninh Kiều","14, Quốc Lộ 1A, Quận Cái Răng",Cần Thơ,,"Ninh Kiều, Cần Thơ",VN,"10.0092158,105.7508282"
448,ChIJG-PS4q2JoDERccH0zuy31lA,Cửa Hàng Nhật Quang,Cửa hàng bán thực phẩm sạch,0292 3847 048,"Cửa Hàng Nhật Quang, 108B/3, Đường 3-2 Nối Dài, Phường An Bình, Quận Ninh Kiều, Thành Phố Cần Thơ, An Bình, Ninh Kiều, Cần Thơ","An Bình, Ninh Kiều","108B/3, Đường 3-2 Nối Dài, Phường An Bình, Quận Ninh Kiều, Thành Phố Cần Thơ",Cần Thơ,,"Ninh Kiều, Cần Thơ",VN,"10.0075966,105.7465891"
449,ChIJP-iWsZKJoDERJrAlcWwUGOo,Cửa Hàng Thực Phẩm Bếp Nàng 2,Cửa hàng,0938 945 256,"2Q83+6PM Cửa Hàng Thực Phẩm Bếp Nàng 2, Hẻm 12 Đ. 3 Tháng 2, Hưng Lợi, Ninh Kiều, Cần Thơ","Hưng Lợi, Ninh Kiều","2Q83+6PM, Hẻm 12 Đ. 3 Tháng 2",Cần Thơ,,"Ninh Kiều, Cần Thơ",VN,"10.0155794,105.7543097"
450,ChIJ1UtufrCJoDERTgAAa10RVaw,Cửa Hàng Điện Gia Dụng Hữu Thạnh,Cửa hàng thiết bị điện,0292 3846 487,"Cửa Hàng Điện Gia Dụng Hữu Thạnh, 75/9, Đường Nguyễn Trãi, Quận Cái Răng, TP Cần Thơ, Lê Bình, Cái Răng, Cần Thơ","Lê Bình, Cái Răng","75/9, Đường Nguyễn Trãi, Quận Cái Răng, TP Cần Thơ",Cần Thơ,,"Cái Răng, Cần Thơ",VN,"10.001984799999999,105.7496525"
454,ChIJn7kzG7KJoDERmFr9TlIwDgM,Cửa Hàng VLXD Hồng Phước,Cửa hàng vật liệu xây dựng,0919 367 907,"Cửa Hàng VLXD Hồng Phước, 4 Lộ Vòng Cung, An Bình, Ninh Kiều, Cần Thơ","An Bình, Ninh Kiều",4 Lộ Vòng Cung,Cần Thơ,,"Ninh Kiều, Cần Thơ",VN,"10.0077365,105.746665"
456,ChIJwZ_KDrOJoDERZkt16pKrnu0,Cửa Hàng Vật Liệu Xây Dựng Thanh Phát,Cửa hàng vật liệu xây dựng,0292 3847 847,"Cửa Hàng Vật Liệu Xây Dựng Thanh Phát, 83/2, Quốc Lộ 1A, Phường An Bình, Quận Ninh Kiều, An Bình, Ninh Kiều, Cần Thơ","An Bình, Ninh Kiều","83/2, Quốc Lộ 1A, Phường An Bình, Quận Ninh Kiều",Cần Thơ,,"Ninh Kiều, Cần Thơ",VN,"10.0120274,105.7537165"
457,ChIJ26b9fTiIoDERdiiX5uSOZlM,Cửa Hàng Hằng,Cửa hàng bán thực phẩm sạch,0292 3833 839,"Cửa Hàng Hằng, 1N, Quốc Lộ 91B, Phường Hưng Lợi, Quận Ninh Kiều, Thành Phố Cần Thơ, Hưng Lợi, Ninh Kiều, Cần Thơ","Hưng Lợi, Ninh Kiều","1N, Quốc Lộ 91B, Phường Hưng Lợi, Quận Ninh Kiều, Thành Phố Cần Thơ",Cần Thơ,,"Ninh Kiều, Cần Thơ",VN,"10.0255739,105.7589649"
458,ChIJFeaXaziIoDER5FkzI33SBHc,Cửa Hàng Tạp Hóa Huỳnh Thị Mỹ Duyên,Cửa hàng bách hóa,0763 792 313,"Cửa Hàng Tạp Hóa Huỳnh Thị Mỹ Duyên, 21C, Tỉnh Lộ 91B, Phường Hưng Lợi, Quận Ninh Kiều, Hưng Lợi, Ninh Kiều, Cần Thơ","Hưng Lợi, Ninh Kiều","21C, Tỉnh Lộ 91B, Phường Hưng Lợi, Quận Ninh Kiều",Cần Thơ,,"Ninh Kiều, Cần Thơ",VN,"10.0244606,105.7597957"
459,ChIJeb-oMFmJoDERognrpi0cpL4,BAO BÌ TÂN HỮU THIỆN CẦN THƠ,Cửa hàng tạp hóa,0945 949 409,"BAO BÌ TÂN HỮU THIỆN CẦN THƠ, 49 Đường Số 1 Khu Dân Cư Metro, P.Hưng Lợi, Q.Ninh Kiều Cần Thơ Can Tho City, 94118","Hưng Lợi, Ninh Kiều","49 Đường Số 1 Khu Dân Cư Metro, P.Hưng Lợi, Q.Ninh Kiều Cần Thơ Can Tho City",Cần Thơ,94118.0,"Ninh Kiều, Cần Thơ",VN,"10.0227092,105.7597284"
460,ChIJl7Q9QDqJoDERA-PFMfcconY,Shop Bụi. Cửa Hàng Thời Trang Nam,Cửa hàng quần áo,0976 626 665,"Shop Bụi. Cửa Hàng Thời Trang Nam, 176 Đ. 3 Tháng 2, Hưng Lợi, Ninh Kiều, Cần Thơ","Hưng Lợi, Ninh Kiều",176 Đ. 3 Tháng 2,Cần Thơ,,"Ninh Kiều, Cần Thơ",VN,"10.0236606,105.7670009"
461,ChIJFcip8jaIoDERXgcQTS8kDIU,Cửa Hàng Ván Ép Bích Thủy,Cửa hàng,0292 3840 441,"Cửa Hàng Ván Ép Bích Thủy, 142 Đ. 3 Tháng 2, Hưng Lợi, Ninh Kiều, Cần Thơ","Hưng Lợi, Ninh Kiều",142 Đ. 3 Tháng 2,Cần Thơ,,"Ninh Kiều, Cần Thơ",VN,"10.018728399999999,105.7621892"
462,ChIJd7suZzaIoDER3jjo4-S2FVk,BEN'S Shop,Cửa hàng quần áo,0967 331 061,"BEN'S Shop, 7 Đ. Nguyễn Văn Linh, Hưng Lợi, Ninh Kiều, Cần Thơ","Hưng Lợi, Ninh Kiều",7 Đ. Nguyễn Văn Linh,Cần Thơ,,"Ninh Kiều, Cần Thơ",VN,"10.018587499999999,105.76111549999999"
463,ChIJwdz9QTiIoDERYxAm_1vIC6U,Cửa Hàng Bao Cao Su Núi Lửa,Hiệu thuốc,0292 6526 683,"Cửa Hàng Bao Cao Su Núi Lửa, 32 QL91B, Hưng Lợi, Ninh Kiều, Cần Thơ","Hưng Lợi, Ninh Kiều",32 QL91B,Cần Thơ,,"Ninh Kiều, Cần Thơ",VN,"10.0245164,105.7600545"
464,ChIJye3LXziIoDERBHth0kqoyWM,Cửa Hàng Quần Áo Ngân,Cửa hàng quần áo,0292 3894 834,"Cửa Hàng Quần Áo Ngân, 40 Quốc Lộ 91B, Quận Ninh Kiều, Hưng Lợi, Ninh Kiều, Cần Thơ","Hưng Lợi, Ninh Kiều","40 Quốc Lộ 91B, Quận Ninh Kiều",Cần Thơ,,"Ninh Kiều, Cần Thơ",VN,"10.0253891,105.76017159999999"
465,ChIJD4JejTaIoDERIubih070Jew,Cửa Hàng Hoàng Ngân,Cửa hàng vật liệu xây dựng,0292 3817 818,"Cửa Hàng Hoàng Ngân, 39, Ba Tháng Hai, Phường Hưng Lợi, Quận Ninh Kiều, Thành Phố Cần Thơ, Hưng Lợi, Ninh Kiều, Cần Thơ","Hưng Lợi, Ninh Kiều","39, Ba Tháng Hai, Phường Hưng Lợi, Quận Ninh Kiều, Thành Phố Cần Thơ",Cần Thơ,,"Ninh Kiều, Cần Thơ",VN,"10.0180435,105.7615835"
466,ChIJJYCy9aWJoDERZ0aSWNzBrmg,Cửa Hàng Điện Thoại Nguyễn Thông mobile,Cửa hàng bán đồ điện tử,,"2QG5+CF6 Cửa Hàng Điện Thoại Nguyễn Thông mobile, khu cán bộ giảng viên đại học cần thơ, Đ. Nguyễn Văn Linh, Phường An Khánh, Ninh Kiều, Cần Thơ","Phường An Khánh, Ninh Kiều","2QG5+CF6, khu cán bộ giảng viên đại học cần thơ, Đ. Nguyễn Văn Linh",Cần Thơ,,"Ninh Kiều, Cần Thơ",VN,"10.0260498,105.75865329999999"
467,ChIJ11abWjeIoDERvghjAdUeWYs,Cửa Hàng Đtdđ Nguyễn Nhân,Cửa hàng điện thoại di động,0939 832 383,"Cửa Hàng Đtdđ Nguyễn Nhân, 7 Đ. Nguyễn Văn Linh, Hưng Lợi, Ninh Kiều, Cần Thơ","Hưng Lợi, Ninh Kiều",7 Đ. Nguyễn Văn Linh,Cần Thơ,,"Ninh Kiều, Cần Thơ",VN,"10.0218534,105.763911"
468,ChIJHSb0FMeJoDERuP6NcpVcOPA,Cửa hàng xe gắn máy Hoà Phát,Cửa hàng,0903 101 175,"Cửa hàng xe gắn máy Hoà Phát, 119 Hẻm 132 Đ. 3 Tháng 2, Hưng Lợi, Ninh Kiều, Cần Thơ","Hưng Lợi, Ninh Kiều",119 Hẻm 132 Đ. 3 Tháng 2,Cần Thơ,,"Ninh Kiều, Cần Thơ",VN,"10.0174889,105.761651"
469,ChIJmRP1piaIoDERS3-q3NSpr04,Cửa Hàng Nhựa Phụng Vỹ,Cửa hàng,,"Cửa Hàng Nhựa Phụng Vỹ, 195 Đ. 30 Tháng 4, Hưng Lợi, Ninh Kiều, Cần Thơ","Hưng Lợi, Ninh Kiều",195 Đ. 30 Tháng 4,Cần Thơ,,"Ninh Kiều, Cần Thơ",VN,"10.019759299999999,105.76437179999999"
470,ChIJA0A63zmIoDERi1Ex5onhGt0,Cửa Hàng Phụ Tùng Ô Tô Cường Thịnh,Cửa hàng phụ tùng xe ô tô,0292 3838 717,"Cửa Hàng Phụ Tùng Ô Tô Cường Thịnh, 13 QL91B, Hưng Lợi, Ninh Kiều, Cần Thơ","Hưng Lợi, Ninh Kiều",13 QL91B,Cần Thơ,,"Ninh Kiều, Cần Thơ",VN,"10.022737099999999,105.7626504"
471,ChIJD4JejTaIoDERpDsy8hc2_X0,Cửa Hàng Điện Thoại Hoài Minh,Cửa hàng điện thoại di động,0907 210 350,"Cửa Hàng Điện Thoại Hoài Minh, 58, Ba Tháng Hai, Phường Hưng Lợi, Quận Ninh Kiều, Thành Phố Cần Thơ, Hưng Lợi, Ninh Kiều, Cần Thơ","Hưng Lợi, Ninh Kiều","58, Ba Tháng Hai, Phường Hưng Lợi, Quận Ninh Kiều, Thành Phố Cần Thơ",Cần Thơ,,"Ninh Kiều, Cần Thơ",VN,"10.018600099999999,105.762236"
472,ChIJY5iaEruJoDERndqBoBvOUwg,Cửa Hàng Điện Lạnh Hoàng Tâm,Cửa hàng đồ gia dụng,0931 794 030,"Cửa Hàng Điện Lạnh Hoàng Tâm, 21 Đ. Nguyễn Văn Linh, Hưng Lợi, Ninh Kiều, Cần Thơ","Hưng Lợi, Ninh Kiều",21 Đ. Nguyễn Văn Linh,Cần Thơ,,"Ninh Kiều, Cần Thơ",VN,"10.0223356,105.76374469999999"
474,ChIJkbKKkjWIoDERWITODXYAw_U,Cửa Hàng Thiên Tân,Cửa hàng điện thoại di động,0901 214 066,"Cửa Hàng Thiên Tân, 1D, Đường Ba Tháng Hai Nối Dài, Phường An Bình, Quận Ninh Kiều, Thành Phố Cần Thơ, Hưng Lợi, Ninh Kiều, Cần Thơ","Hưng Lợi, Ninh Kiều","1D, Đường Ba Tháng Hai Nối Dài, Phường An Bình, Quận Ninh Kiều, Thành Phố Cần Thơ",Cần Thơ,,"Ninh Kiều, Cần Thơ",VN,"10.0159331,105.7594156"
479,ChIJkYMS0TWIoDER8gNnv2JvDtM,Cửa Hàng Đá Hoa Cương Phú Tài,Cửa hàng vật liệu xây dựng,0292 3739 598,"Cửa Hàng Đá Hoa Cương Phú Tài, 107 Đ. 3 Tháng 2, Hưng Lợi, Ninh Kiều, Cần Thơ","Hưng Lợi, Ninh Kiều",107 Đ. 3 Tháng 2,Cần Thơ,,"Ninh Kiều, Cần Thơ",VN,"10.0168132,105.76105779999999"
481,ChIJKcgGhTWIoDERRLYp4ngJJag,Cửa Hàng Vật Liệu Xây Dựng Đại Sơn,Cửa hàng vật liệu xây dựng,0292 6250 278,"Cửa Hàng Vật Liệu Xây Dựng Đại Sơn, 67A, Đường 3/2, Quận Ninh Kiều, Tp Cần Thơ, Hưng Lợi, Ninh Kiều, Cần Thơ","Hưng Lợi, Ninh Kiều","67A, Đường 3/2, Quận Ninh Kiều, Tp Cần Thơ",Cần Thơ,,"Ninh Kiều, Cần Thơ",VN,"10.0152814,105.759135"
482,ChIJy2WNRjeIoDERYUtjl8KwHX8,Cửa Hàng Gạo Chợ Đào Long An Kim Chi,Cửa hàng bách hóa,0292 3782 625,"Cửa Hàng Gạo Chợ Đào Long An Kim Chi, 7D Quốc Lộ 91B, Quận Ninh Kiều, Hưng Lợi, Ninh Kiều, Cần Thơ","Hưng Lợi, Ninh Kiều","7D Quốc Lộ 91B, Quận Ninh Kiều",Cần Thơ,,"Ninh Kiều, Cần Thơ",VN,"10.021782199999999,105.76402879999999"
483,ChIJ9ZJZ2DaIoDERu9R3TyK4xBU,Cửa Hàng Vlxd - Trang Trí Nội Thất Đông Tiến,Cửa hàng vật liệu xây dựng,0292 3830 857,"Cửa Hàng Vlxd - Trang Trí Nội Thất Đông Tiến, 183 Đ. 3 Tháng 2, Hưng Lợi, Ninh Kiều, Cần Thơ","Hưng Lợi, Ninh Kiều",183 Đ. 3 Tháng 2,Cần Thơ,,"Ninh Kiều, Cần Thơ",VN,"10.0196854,105.76359629999999"
484,ChIJ8_cKmUqIoDER0BOj9g9h5jU,Cửa Hàng Đá Hoa Cương Kim Thành Phát,Cửa hàng vật liệu xây dựng,0919 099 294,"Cửa Hàng Đá Hoa Cương Kim Thành Phát, 51 Hẻm 132 Đ. 3 Tháng 2, Hưng Lợi, Ninh Kiều, Cần Thơ","Hưng Lợi, Ninh Kiều",51 Hẻm 132 Đ. 3 Tháng 2,Cần Thơ,,"Ninh Kiều, Cần Thơ",VN,"10.0136234,105.7581039"
487,ChIJg1UKysqJoDERsdG7rp7U_14,Cửa Hàng Phụ Tùng Xe Máy Hoàng Sơn 2,Đại lý xe mô tô,,"Cửa Hàng Phụ Tùng Xe Máy Hoàng Sơn 2, 1018 Hẻm 553, Hưng Lợi, Ninh Kiều, Cần Thơ","Hưng Lợi, Ninh Kiều",1018 Hẻm 553,Cần Thơ,,"Ninh Kiều, Cần Thơ",VN,"10.0117513,105.76010959999999"
489,ChIJx2BIl9CJoDER20im4XUb-q0,Cửa Hàng Xe Máy Nhập Khẩu Cần Thơ Cơ Sở 1,Cửa hàng xe máy,0292 3780 164,"Cửa Hàng Xe Máy Nhập Khẩu Cần Thơ Cơ Sở 1, 164/1B Đ. Trần Ngọc Quế, Xuân Khánh, Ninh Kiều, Cần Thơ","Xuân Khánh, Ninh Kiều",164/1B Đ. Trần Ngọc Quế,Cần Thơ,,"Ninh Kiều, Cần Thơ",VN,"10.024227999999999,105.768496"
490,ChIJSRX1SjCJoDERLCmMRcpvUos,Cửa hàng tiện lợi KTX A ĐHCT,Cửa hàng tiện lợi,,"2QM9+CXH Cửa hàng tiện lợi KTX A ĐHCT, Xuân Khánh, Ninh Kiều, Cần Thơ","Xuân Khánh, Ninh Kiều",2QM9+CXH,Cần Thơ,,"Ninh Kiều, Cần Thơ",VN,"10.0335533,105.7699762"
491,ChIJnxGpgg6JoDEROXuZZTm7EfY,MAMA - Cửa hàng tiện lợi,Cửa hàng tiện lợi,,"MAMA - Cửa hàng tiện lợi, 142 Đ. 3 Tháng 2, Xuân Khánh, Ninh Kiều, Cần Thơ 900000","Xuân Khánh, Ninh Kiều",142 Đ. 3 Tháng 2,Cần Thơ,900000.0,"Ninh Kiều, Cần Thơ",VN,"10.027637799999999,105.77056019999999"
492,ChIJL9Y-YEOJoDERtLW-lOtKEAc,Cửa Hàng giầy Giép TÚ TÀI,Cửa hàng,0355 547 777,"Cửa Hàng giầy Giép TÚ TÀI, 95 Đ. Mậu Thân, An Phú, Ninh Kiều, Cần Thơ","An Phú, Ninh Kiều",95 Đ. Mậu Thân,Cần Thơ,,"Ninh Kiều, Cần Thơ",VN,"10.0313838,105.77509069999999"
494,ChIJD-70YSGIoDERb8gJYG2Znw0,Cửa Hàng Đồ Chơi Trẻ Em Thanh,Cửa hàng đồ chơi,0292 3832 808,"Cửa Hàng Đồ Chơi Trẻ Em Thanh, 84 Đ. Mậu Thân, Xuân Khánh, Ninh Kiều, Cần Thơ","Xuân Khánh, Ninh Kiều",84 Đ. Mậu Thân,Cần Thơ,,"Ninh Kiều, Cần Thơ",VN,"10.029556,105.77653"
495,ChIJk1UQ9yCIoDERbaS5KPOz36k,Cửa Hàng Yến Việt,Cửa hàng thực phẩm thiên nhiên,0292 3821 789,"Cửa Hàng Yến Việt, 76 Đ. 30 Tháng 4, An Lạc, Ninh Kiều, Cần Thơ","An Lạc, Ninh Kiều",76 Đ. 30 Tháng 4,Cần Thơ,,"Ninh Kiều, Cần Thơ",VN,"10.02985,105.7798564"
497,ChIJM_iaHCOIoDERdJSm6oQp4kE,Cửa Hàng Thể Dục Thể Thao K - Sport,Cửa hàng đồ thể thao,0989 700 179,"Cửa Hàng Thể Dục Thể Thao K - Sport, 90 Đ. 3 Tháng 2, Xuân Khánh, Ninh Kiều, Cần Thơ","Xuân Khánh, Ninh Kiều",90 Đ. 3 Tháng 2,Cần Thơ,,"Ninh Kiều, Cần Thơ",VN,"10.0300136,105.77244429999999"
498,ChIJdSUrZKBioDERfmw8Tq2bpUY,"Cửa Hàng In Áo, Huy Hiệu, Móc Khoá Werota",Cửa hàng bách hóa,0926 681 234,"Cửa Hàng In Áo, Huy Hiệu, Móc Khoá Werota, 28 Đ. Nguyễn Khuyến, Tân An, Ninh Kiều, Cần Thơ","Tân An, Ninh Kiều",28 Đ. Nguyễn Khuyến,Cần Thơ,,"Ninh Kiều, Cần Thơ",VN,"10.034766999999999,105.78315429999999"
499,ChIJwxOX2x-IoDERw2yFguS9-rs,Pham Thuy Linh Fashion Shop,Cửa hàng quần áo nữ,0941 068 410,"Pham Thuy Linh Fashion Shop, 88 Đ. Đề Thám, Tân An, Ninh Kiều, Cần Thơ","Tân An, Ninh Kiều",88 Đ. Đề Thám,Cần Thơ,,"Ninh Kiều, Cần Thơ",VN,"10.034792099999999,105.7816771"
