,place_id,name,main_category,phone,address,address_ward,address_street,address_city,address_postal_code,address_state,address_country_code
488,ChIJQxW6WUKIoDERQ1xqzBKqXNI,Cửa Hàng Gas Petimex,Cửa hàng,0292 3895 453,"Cửa Hàng Gas Petimex, 329 QL91B, Phường An Khánh, Bình Thủy, Cần Thơ","Phường An Khánh, Bình Thủy",329 QL91B,Cần Thơ,,"Bình Thủy, Cần Thơ",VN
490,ChIJgfa4is6JoDERwSKQl5xWx7w,Cây xăng hoàng yến,Trạm xăng,,"Cây xăng hoàng yến, 158 Võ Văn Kiệt, An Hoà, Ninh Kiều, Cần Thơ 900000","An Hoà, Ninh Kiều",158 Võ Văn Kiệt,Cần Thơ,900000.0,"Ninh Kiều, Cần Thơ",VN
500,ChIJhTzDpyyJoDERdfxFev82aQU,GAS KHẢ VĂN,Cửa hàng tạp phẩm,0901 283 283,"GAS KHẢ VĂN, 103c/3 khu dân cư 3A khu vực 5 P. An Bình Q. NK, Hưng Phú, Cái Răng, Cần Thơ","Hưng Phú, Cái Răng",103c/3 khu dân cư 3A khu vực 5 P. An Bình Q. NK,Cần Thơ,,"Cái Răng, Cần Thơ",VN
509,ChIJiwfaI7-JoDERGVPSGx-dskc,Cửa Hàng Gas Petrolimex Cái Răng,Cửa hàng ga,0292 3912 912,"Cửa Hàng Gas Petrolimex Cái Răng, 176a Đ. Phạm Hùng, Lê Bình, Cái Răng, Cần Thơ","Lê Bình, Cái Răng",176a Đ. Phạm Hùng,Cần Thơ,,"Cái Răng, Cần Thơ",VN
514,ChIJlR2Z-46PoDERdpRn2tgB3w4,Cửa hàng Xăng dầu Petrolimex Số 20,Trạm xăng,0907 521 405,"Cửa hàng Xăng dầu Petrolimex Số 20, 65 ĐT926, Nhơn ái, Phong Điền, Cần Thơ","Nhơn ái, Phong Điền",65 ĐT926,Cần Thơ,,"Phong Điền, Cần Thơ",VN
560,ChIJBWc9cEeIoDERzgjtSmfVXu4,Cửa Hàng Gas Anh Thơ,Cửa hàng,0292 3894 111,"Cửa Hàng Gas Anh Thơ, 337 QL91B, Hưng Lợi, Ninh Kiều, Cần Thơ","Hưng Lợi, Ninh Kiều",337 QL91B,Cần Thơ,,"Ninh Kiều, Cần Thơ",VN
561,ChIJN7LRuBmIoDERM5tl6lk9R4M,Cửa Hàng Gas Quang Nhu,Cửa hàng,,"Cửa Hàng Gas Quang Nhu, 31 Đ. Mậu Thân, Xuân Khánh, Ninh Kiều, Cần Thơ","Xuân Khánh, Ninh Kiều",31 Đ. Mậu Thân,Cần Thơ,,"Ninh Kiều, Cần Thơ",VN
562,ChIJH-8j7waIoDERs_p3f5T_R7s,Cửa Hàng Điện Gia Dụng Bếp Gas 125,Cửa hàng,0292 3824 631,"Cửa Hàng Điện Gia Dụng Bếp Gas 125, 125 Đ. Cách Mạng Tháng 8, An Hoà, Ninh Kiều, Cần Thơ 94000","An Hoà, Ninh Kiều",125 Đ. Cách Mạng Tháng 8,Cần Thơ,94000.0,"Ninh Kiều, Cần Thơ",VN
563,ChIJ4_PsBcOJoDERvdta3xUH7hw,Gas Lê Uyên,Công ty ga,0939 750 101,"Gas Lê Uyên, 95 Huỳnh Cương, An Cư, Ninh Kiều, Cần Thơ","An Cư, Ninh Kiều",95 Huỳnh Cương,Cần Thơ,,"Ninh Kiều, Cần Thơ",VN
564,ChIJ4XUHGfWJoDERQwyst4MELQ0,Gas Khánh Văn,Cửa hàng,,"Gas Khánh Văn, 6 Đường Số 10, Phường An Khánh, Ninh Kiều, Cần Thơ","Phường An Khánh, Ninh Kiều",6 Đường Số 10,Cần Thơ,,"Ninh Kiều, Cần Thơ",VN
565,ChIJlR2L-kGJoDERZjuCLsSJC9E,Cửa hàng gas - LPG Phương Nam,Cửa hàng,0292 3898 222,"Cửa hàng gas - LPG Phương Nam, 24-20 Nguyễn Văn Cừ Nối Dài, An Bình, Ninh Kiều, Cần Thơ","An Bình, Ninh Kiều",24-20 Nguyễn Văn Cừ Nối Dài,Cần Thơ,,"Ninh Kiều, Cần Thơ",VN
566,ChIJk9GC0iKJoDER8ywhTEh31Hs,Cửa hàng Gas Thiên Lộc,Cửa hàng ga,,"Cửa hàng Gas Thiên Lộc, 148/99 Hẻm 132 Đ. 3 Tháng 2, Hưng Lợi, Ninh Kiều, Cần Thơ","Hưng Lợi, Ninh Kiều",148/99 Hẻm 132 Đ. 3 Tháng 2,Cần Thơ,,"Ninh Kiều, Cần Thơ",VN
567,ChIJ8ZcwW0GIoDER-wdgsrr9lFE,Cửa Hàng Gas Lê Gia,Cửa hàng,0292 6530 078,"Cửa Hàng Gas Lê Gia, 307 Đ. Nguyễn Văn Linh, Phường An Khánh, Ninh Kiều, Cần Thơ","Phường An Khánh, Ninh Kiều",307 Đ. Nguyễn Văn Linh,Cần Thơ,,"Ninh Kiều, Cần Thơ",VN
568,ChIJI6YAO-yJEgMR9J_oONtggw4,Gas Biển Ngọc 1,Cửa tiệm bán lẻ trực tiếp,0379 935 999,,,,,,,
569,ChIJW99_HGiIoDERG2HkqlWrHvE,Cửa Hàng Gas Sơn Hà,Cửa hàng,0292 6783 783,"Cửa Hàng Gas Sơn Hà, 130 KDC Thới Nhựt, Quận Ninh Kiều, Tp Cần Thơ, Phường An Khánh, Ninh Kiều, Cần Thơ","Phường An Khánh, Ninh Kiều","130 KDC Thới Nhựt, Quận Ninh Kiều, Tp Cần Thơ",Cần Thơ,,"Ninh Kiều, Cần Thơ",VN
570,ChIJi5w2OVWJoDERtC4BS5bjt5o,Gas,Trạm khí nén thiên nhiên,0973 742 530,"Gas, Đ. Trần Nam Phú, Xuân Khánh, Ninh Kiều, Cần Thơ 94000","Xuân Khánh, Ninh Kiều",Đ. Trần Nam Phú,Cần Thơ,94000.0,"Ninh Kiều, Cần Thơ",VN
571,ChIJw1qPkESIoDERGgCAcqz9-LI,Cửa Hàng Gas Miền Tây,Cửa hàng nội thất,0292 6298 298,"Cửa Hàng Gas Miền Tây, 210/AA, Nguyễn Văn Cừ Nối Dài, Khu Vực 4, Phường An Bình, Quận Ninh Kiều, Thành Phố Cần Thơ, Phường An Khánh, Ninh Kiều, Cần Thơ","Phường An Khánh, Ninh Kiều","210/AA, Nguyễn Văn Cừ Nối Dài, Khu Vực 4, Phường An Bình, Quận Ninh Kiều, Thành Phố Cần Thơ",Cần Thơ,,"Ninh Kiều, Cần Thơ",VN
572,ChIJ743Be6lioDERmc_h92mwNE8,Cửa Hàng Gas 15 Phút,Cửa hàng đồ gia dụng,,"Cửa Hàng Gas 15 Phút, Cái Khế, Ninh Kiều, Cần Thơ","Cái Khế, Ninh Kiều",,Cần Thơ,,"Ninh Kiều, Cần Thơ",VN
573,ChIJbxAIMSGIoDER79BOac3Jq4M,Cửa Hàng Gas Petrolimex Số 2,Cửa hàng ga,0292 3812 807,"Cửa Hàng Gas Petrolimex Số 2, 137 Đ. 30 Tháng 4, Xuân Khánh, Ninh Kiều, Cần Thơ","Xuân Khánh, Ninh Kiều",137 Đ. 30 Tháng 4,Cần Thơ,,"Ninh Kiều, Cần Thơ",VN
575,ChIJ-2P7tS9joDERaInr62aggxk,Gas Nhật Tiến,Cửa hàng ga,0939 273 955,"Gas Nhật Tiến, M34 Đ. A2, KDC Hưng Phú 1, Cái Răng, Cần Thơ 900000","KDC Hưng Phú 1, Cái Răng",M34 Đ. A2,Cần Thơ,900000.0,"Cái Răng, Cần Thơ",VN
579,ChIJdS9iXy2IoDERVMwu4wqjhow,Đại Lý Gas Toàn Phát,Cửa hàng,0292 3918 919,"Đại Lý Gas Toàn Phát, 220 Tầm Vu, Hưng Lợi, Ninh Kiều, Cần Thơ","Hưng Lợi, Ninh Kiều",220 Tầm Vu,Cần Thơ,,"Ninh Kiều, Cần Thơ",VN
580,ChIJVcubhORjoDERR2tSkm3z0lc,CTY TNHH cơ điện lạnh và gas Khánh Phương Nam,Cửa hàng đồ gia dụng,0911 678 101,"2QCM+GHR CTY TNHH cơ điện lạnh và gas Khánh Phương Nam, Đường Số 16, KDC Hưng Phú 1, Cái Răng, Cần Thơ","KDC Hưng Phú 1, Cái Răng","2QCM+GHR, Đường Số 16",Cần Thơ,,"Cái Răng, Cần Thơ",VN
586,ChIJucOd7S-IoDERr_pivylAQJE,Đại Lý Gas Anh Hoàng,Cửa hàng nội thất,0292 3894 389,"Đại Lý Gas Anh Hoàng, 141/8B, Đường 30-4, Phường Hưng Lợi, Quận Ninh Kiều, Thành Phố Cần Thơ, Xuân Khánh, Ninh Kiều, Cần Thơ","Xuân Khánh, Ninh Kiều","141/8B, Đường 30-4, Phường Hưng Lợi, Quận Ninh Kiều, Thành Phố Cần Thơ",Cần Thơ,,"Ninh Kiều, Cần Thơ",VN
588,ChIJqReHKT6IoDERwtTc76gkkL8,Cửa Hàng Petrovietnam Gas,Cửa hàng nội thất,7106528989,"Cửa Hàng Petrovietnam Gas, 39I1/9, Đ. Nguyễn Văn Cừ, Phường An Khánh, Ninh Kiều, Cần Thơ","Phường An Khánh, Ninh Kiều","39I1/9, Đ. Nguyễn Văn Cừ",Cần Thơ,,"Ninh Kiều, Cần Thơ",VN
589,ChIJK19tvYdioDERiVplTNJJAt8,Đại Lý Gas Ngọc Thuận,Cửa hàng nội thất,0292 3916 117,"Đại Lý Gas Ngọc Thuận, A38, Khu Dân Cư 586, Đường Số 9, Phường Phú Thứ, Quận Cái Răng, Thành Phố Cần Thơ, Hưng Phú, Cái Răng, Cần Thơ","Hưng Phú, Cái Răng","A38, Khu Dân Cư 586, Đường Số 9, Phường Phú Thứ, Quận Cái Răng, Thành Phố Cần Thơ",Cần Thơ,,"Cái Răng, Cần Thơ",VN
590,ChIJBXSa9_mJoDER-3cHCC370b8,Cửa hàng Xăng dầu Petrolimex Số 21,Trạm xăng,,"XQW4+CQ4 Cửa hàng Xăng dầu Petrolimex Số 21, Thường Thạnh, Cái Răng, Cần Thơ","Thường Thạnh, Cái Răng",XQW4+CQ4,Cần Thơ,,"Cái Răng, Cần Thơ",VN
591,ChIJR6OWA7mJoDERCHHBazzDsDM,Cửa Hàng Gas - Bếp Gas Huy Hoàng 3,Cửa hàng nội thất,0907 446 702,"Cửa Hàng Gas - Bếp Gas Huy Hoàng 3, 180 Lê Bình, Cái Răng, Cần Thơ","Lê Bình, Cái Răng",180 Lê Bình,Cần Thơ,,"Cái Răng, Cần Thơ",VN
597,ChIJU1wv4NaJoDERe2U1B5ajHl0,CH Gas Thiên Lộc,Cửa hàng,0292 3912 913,"CH Gas Thiên Lộc, 148 Hẻm 132 Đ. 3 Tháng 2, Hưng Lợi, Ninh Kiều, Cần Thơ","Hưng Lợi, Ninh Kiều",148 Hẻm 132 Đ. 3 Tháng 2,Cần Thơ,,"Ninh Kiều, Cần Thơ",VN
610,ChIJf1KZB3irNTERP14o6REXmIE,Gas Trần Gia,Cửa hàng ga,,"Gas Trần Gia, 500b P. Xã Đàn, Nam Đồng, Đống Đa, Hà Nội","Nam Đồng, Đống Đa",500b P. Xã Đàn,Hà Nội,,"Đống Đa, Hà Nội",VN
611,ChIJgXnVhbirNTERGEVOSaLV0gw,Cửa hàng gas PeTroLiMex hùng anh,Cửa hàng,0353 353 337,"Cửa hàng gas PeTroLiMex hùng anh, 37/88 P. Trần Quý Cáp, Văn Chương, Đống Đa, Hà Nội","Văn Chương, Đống Đa",37/88 P. Trần Quý Cáp,Hà Nội,,"Đống Đa, Hà Nội",VN
639,ChIJN7LRuBmIoDERGkF2iGn6Tr0,Cửa Hàng Gas Anh Thuận,Cửa hàng,,"Cửa Hàng Gas Anh Thuận, 31 Đ. Mậu Thân, Xuân Khánh, Ninh Kiều, Cần Thơ","Xuân Khánh, Ninh Kiều",31 Đ. Mậu Thân,Cần Thơ,,"Ninh Kiều, Cần Thơ",VN
660,ChIJIb_LOEiJoDERv_ImNQXvhd4,Đổi Gas - Bếp Gas Gia Hân,Cửa hàng tổng hợp,,"2QP4+WHQ Đổi Gas - Bếp Gas Gia Hân, Đ. Nguyễn Minh Quang, Phường An Khánh, Ninh Kiều, Cần Thơ","Phường An Khánh, Ninh Kiều","2QP4+WHQ, Đ. Nguyễn Minh Quang",Cần Thơ,,"Ninh Kiều, Cần Thơ",VN
682,ChIJNS2XgciJoDEReL6_v42BZg0,Eagle Gas,Cửa hàng bán đồ điện tử,0782 995 792,"Eagle Gas, 12 Đ. 3 Tháng 2, Hưng Lợi, Ninh Kiều, Cần Thơ","Hưng Lợi, Ninh Kiều",12 Đ. 3 Tháng 2,Cần Thơ,,"Ninh Kiều, Cần Thơ",VN
692,ChIJQVqycdmJoDERJoji5etln-Y,Cửa hàng gas gạo Hưng Thịnh,Cửa hàng gạo,0932 838 458,"Cửa hàng gas gạo Hưng Thịnh, Đường huyện 19, Cần Thơ","Phường An Khánh, Ninh Kiều",Đường huyện 19,Cần Thơ,,"Ninh Kiều, Cần Thơ",VN
695,ChIJO7lS7TSIoDERdPcsa2SY6eU,Đại Lý Gas & Bếp Gas Châu Giang,Cửa hàng bán dụng cụ sửa nhà,0292 3838 661,"Đại Lý Gas & Bếp Gas Châu Giang, 6 Đ. Trần Hoàng Na, Hưng Lợi, Ninh Kiều, Cần Thơ","Hưng Lợi, Ninh Kiều",6 Đ. Trần Hoàng Na,Cần Thơ,,"Ninh Kiều, Cần Thơ",VN
699,ChIJkX9IuhCIoDERsGXMMck719U,Công Ty Tnhh Dầu Khí Nam Bộ,Trạm xăng,,"Công Ty Tnhh Dầu Khí Nam Bộ, 4 Đ. Mậu Thân, An Nghiệp, Ninh Kiều, Cần Thơ","An Nghiệp, Ninh Kiều",4 Đ. Mậu Thân,Cần Thơ,,"Ninh Kiều, Cần Thơ",VN
702,ChIJO7mV1giJoDEReRuQxzQHv_Y,CH Xăng Dầu Hoàng Yến 9,Trạm xăng,0292 3798 389,"CH Xăng Dầu Hoàng Yến 9, 306 Nguyễn Văn Cừ Nối Dài, An Bình, Ninh Kiều, Cần Thơ","An Bình, Ninh Kiều",306 Nguyễn Văn Cừ Nối Dài,Cần Thơ,,"Ninh Kiều, Cần Thơ",VN
710,ChIJG-u6I7-JoDERpnfS1pRtQ2U,Cửa Hàng Gas Hừng Sáng,Cửa hàng nội thất,0292 3737 111,"Cửa Hàng Gas Hừng Sáng, 292, Khu Vực Yên Trung, Quốc Lộ 1A, Phường Lê Bình, Quận Cái Răng, Thành Phố Cần Thơ, Thường Thạnh, Cái Răng, Cần Thơ","Thường Thạnh, Cái Răng","292, Khu Vực Yên Trung, Quốc Lộ 1A, Phường Lê Bình, Quận Cái Răng, Thành Phố Cần Thơ",Cần Thơ,,"Cái Răng, Cần Thơ",VN
711,ChIJgxSmocGJoDERBbXrGwwksQ8,Gas Thành Mới,Cửa hàng ga,0919 334 969,"Gas Thành Mới, Ấp mỹ ái, Phong Điền, Cần Thơ","Ấp mỹ ái, Phong Điền",,Cần Thơ,,"Phong Điền, Cần Thơ",VN
714,ChIJpTRSMzmJoDERgQ21HM6VMTU,Cửa Hàng Gas A Hào,Trạm xăng,0292 3944 942,"Cửa Hàng Gas A Hào, 247, Ấp Mỹ Phước, Xã Mỹ Khánh, Huyện Phong Điền, Thành Phố Cần Thơ, Mỹ Khánh, Phong Điền, Cần Thơ","Mỹ Khánh, Phong Điền","247, Ấp Mỹ Phước, Xã Mỹ Khánh, Huyện Phong Điền, Thành Phố Cần Thơ",Cần Thơ,,"Phong Điền, Cần Thơ",VN
717,ChIJQXwLCK-JoDERi4jNZuzr6K0,Cửa Hàng Gas & Bếp Anh Hà,Cửa hàng bán dụng cụ sửa nhà,0292 3527 137,"Cửa Hàng Gas & Bếp Anh Hà, 102 ĐT923, An Bình, Ninh Kiều, Cần Thơ","An Bình, Ninh Kiều",102 ĐT923,Cần Thơ,,"Ninh Kiều, Cần Thơ",VN
718,ChIJtyGZ50SIoDER_jxaZdNFEBI,Công Ty TNHH TM DV Dương Sao Mai,Trạm xăng,0292 3688 799,"Công Ty TNHH TM DV Dương Sao Mai, 46-AC1, Đường 2, An Bình, Ninh Kiều, Cần Thơ","An Bình, Ninh Kiều","46-AC1, Đường 2",Cần Thơ,,"Ninh Kiều, Cần Thơ",VN
725,ChIJDTgTvf2IoDERnOPY45jxQ0Q,Resolub,Trạm xăng,,"Resolub, Long Tuyền, Bình Thủy, Cần Thơ","Long Tuyền, Bình Thủy",,Cần Thơ,,"Bình Thủy, Cần Thơ",VN
736,ChIJqT21S4GJoDERikyBKgP7lOI,Trung Tâm Gas Và Bếp Gas Thu Hà,Cửa hàng bán dụng cụ sửa nhà,,"Trung Tâm Gas Và Bếp Gas Thu Hà, 106 QL1A, Ba Láng, Ninh Kiều, Cần Thơ","Ba Láng, Ninh Kiều",106 QL1A,Cần Thơ,,"Ninh Kiều, Cần Thơ",VN
737,ChIJOYa7z2SPoDERAbN_gY774M8,Cửa Hàng Gas Ngọc Tính,Cửa hàng ga,0939 707 991,"2MHP+5V2 Cửa Hàng Gas Ngọc Tính, Giai Xuân, Phong Điền, Cần Thơ","Giai Xuân, Phong Điền",2MHP+5V2,Cần Thơ,,"Phong Điền, Cần Thơ",VN
738,ChIJAQCcGwiJoDER11TRYC4Audg,Công Ty TNHH Vận Tải Xăng Dầu Sài Gòn - Cần Thơ,Trạm xăng,0918 727 673,"Công Ty TNHH Vận Tải Xăng Dầu Sài Gòn - Cần Thơ, 151 Nguyễn Văn Trường, Phường An Khánh, Ninh Kiều, Cần Thơ","Phường An Khánh, Ninh Kiều",151 Nguyễn Văn Trường,Cần Thơ,,"Ninh Kiều, Cần Thơ",VN
740,ChIJN7v0G5iJoDERo_w_1zrpS2s,Gas 24h,Công ty ga,,"Gas 24h, 286 Khu Vực Yên Hòa - P. Lê Bình - Q, Cái Răng, Cần Thơ 100000","Lê Bình, Cái Răng",286 Khu Vực Yên Hòa - P. Lê Bình - Q,Cần Thơ,100000.0,"Cái Răng, Cần Thơ",VN
758,ChIJZXbaLt-JoDER5BGulywgk90,Xăng dầu Ngân Tín,Trạm xăng,,"Xăng dầu Ngân Tín, 1 Võ Tánh, Lê Bình, Cái Răng, Cần Thơ 90000","Lê Bình, Cái Răng",1 Võ Tánh,Cần Thơ,90000.0,"Cái Răng, Cần Thơ",VN
765,ChIJj8OUKq6JoDERplbdiZaIJog,Chinh Giang 8 Petroleum Store,Trạm xăng,0292 3844 881,"Chinh Giang 8 Petroleum Store, 26/2, Vo Tanh Street, Cai Rang District, Can Tho City, Lê Bình, Cái Răng, Cần Thơ","Lê Bình, Cái Răng","26/2, Vo Tanh Street, Cai Rang District, Can Tho City",Cần Thơ,,"Cái Răng, Cần Thơ",VN
783,ChIJs3evvsyJoDERB7hrZVgoqSo,Đại Lý Gas 4.0,Cửa hàng nội thất,0292 3641 641,"Đại Lý Gas 4.0, 55 Đ. Trần Hoàng Na, Hưng Lợi, Ninh Kiều, Cần Thơ 94000","Hưng Lợi, Ninh Kiều",55 Đ. Trần Hoàng Na,Cần Thơ,94000.0,"Ninh Kiều, Cần Thơ",VN
785,ChIJJ2HRpzGIoDERNWYum_6VxBo,Đại Lý Gas Kim Phượng,Cửa hàng,0292 3838 975,"Đại Lý Gas Kim Phượng, 258 Đ. 30 Tháng 4, Hưng Lợi, Ninh Kiều, Cần Thơ","Hưng Lợi, Ninh Kiều",258 Đ. 30 Tháng 4,Cần Thơ,,"Ninh Kiều, Cần Thơ",VN
790,ChIJ-7wq2TmIoDERKdemadNXClI,Cửa Hàng Gas Lê Gia,Cửa hàng,,"Cửa Hàng Gas Lê Gia, 16A QL91B, Hưng Lợi, Ninh Kiều, Cần Thơ","Hưng Lợi, Ninh Kiều",16A QL91B,Cần Thơ,,"Ninh Kiều, Cần Thơ",VN
842,ChIJZUVjXy2IoDERNOS4sTTzPIs,Đại Lý Xăng Dầu Toàn Phát 2,Trạm xăng,0292 3839 877,"Đại Lý Xăng Dầu Toàn Phát 2, 220 Tầm Vu, Hưng Lợi, Ninh Kiều, Cần Thơ","Hưng Lợi, Ninh Kiều",220 Tầm Vu,Cần Thơ,,"Ninh Kiều, Cần Thơ",VN
867,ChIJI6sj0VSJoDERUgz9XsGMbXo,Cây Xăng Hữu Tỷ,Trạm xăng,,"Cây Xăng Hữu Tỷ, 35 Đ. 3 Tháng 2, Xuân Khánh, Ninh Kiều, Cần Thơ","Xuân Khánh, Ninh Kiều",35 Đ. 3 Tháng 2,Cần Thơ,,"Ninh Kiều, Cần Thơ",VN
875,ChIJM3PJ-haJoDERXRD7GhFOfJc,Gas Ngọc Trân,Công ty ga,,"Gas Ngọc Trân, 137 Đ. Lý Tự Trọng, An Phú, Ninh Kiều, Cần Thơ","An Phú, Ninh Kiều",137 Đ. Lý Tự Trọng,Cần Thơ,,"Ninh Kiều, Cần Thơ",VN
