,place_id,name,main_category,phone,address,address_ward,address_street,address_city,address_postal_code,address_state,address_country_code,coordinates
305,ChIJOfGqLgOIoDERBuLn-EQuj7c,Phòng Khám,,,"Phòng Khám, 57 Hùng Vương, An Hội, Ninh Kiều, Cần Thơ","An Hội, Ninh Kiều",57 Hùng Vương,Cần Thơ,,"Ninh Kiều, Cần Thơ",VN,"10.043961,105.778756"
306,ChIJq6qqBw-IoDERKvtzvMqp1C4,Phòng Khám Nha Khoa Minh Tân,Phòng khám nha khoa,0292 3837 369,"Phòng Khám Nha Khoa Minh Tân, 176A, 30/4, Quận Ninh Kiều, Tp Cần Thơ, An Hoà, Ninh Kiều, Cần Thơ","An Hoà, Ninh Kiều","176A, 30/4, Quận Ninh Kiều, Tp Cần Thơ",Cần Thơ,,"Ninh Kiều, Cần Thơ",VN,"10.047019299999999,105.76794439999999"
307,ChIJieM8RKFioDERQNNuAQzV4Hw,Phòng Khám BS Đặng Thị Bích Phượng,Bệnh viện,0292 3817 141,"Phòng Khám BS Đặng Thị Bích Phượng, 8 Đ. Nguyễn Đình Chiểu, Tân An, Ninh Kiều, Cần Thơ","Tân An, Ninh Kiều",8 Đ. Nguyễn Đình Chiểu,Cần Thơ,,"Ninh Kiều, Cần Thơ",VN,"10.0376107,105.78729519999999"
308,ChIJ2XHAkKBioDER2PTnPTHKImQ,Phòng Khám Tư Nhân - Bs Lê Thị Kim Đài,Phòng khám,0292 3812 747,"Phòng Khám Tư Nhân - Bs Lê Thị Kim Đài, 3 Hẻm 22 Đ. Mạc Đĩnh Chi, Tân An, Ninh Kiều, Cần Thơ","Tân An, Ninh Kiều",3 Hẻm 22 Đ. Mạc Đĩnh Chi,Cần Thơ,,"Ninh Kiều, Cần Thơ",VN,"10.0361228,105.7829182"
309,ChIJnWyybKhioDERuwD-d5BQw1U,Phòng Khám Bệnh Tư Nhân,Phòng khám miễn phí,0292 3822 579,"Phòng Khám Bệnh Tư Nhân, 100, Đường Trần Văn Khéo, Phường Cái Khế, Quận Ninh Kiều, An Hội, Ninh Kiều, Cần Thơ","An Hội, Ninh Kiều","100, Đường Trần Văn Khéo, Phường Cái Khế, Quận Ninh Kiều",Cần Thơ,,"Ninh Kiều, Cần Thơ",VN,"10.0447676,105.7834506"
310,ChIJZ4D8M6dioDERTchpbnwtBVY,Phòng Khám Lê Quang Dũng,Phòng khám,0292 3823 475,"Phòng Khám Lê Quang Dũng, 25 Đ. Xô Viết Nghệ Tĩnh, An Hội, Ninh Kiều, Cần Thơ","An Hội, Ninh Kiều",25 Đ. Xô Viết Nghệ Tĩnh,Cần Thơ,,"Ninh Kiều, Cần Thơ",VN,"10.0381763,105.7838747"
311,ChIJ12aMHq9ioDERlOyOxr-4VS8,Phòng Khám Bệnh BS Trần Bửu Giám,Bệnh viện đa khoa,0949 196 586,"Phòng Khám Bệnh BS Trần Bửu Giám, 35, Đường Lê Lợi, Quận Thốt Nốt, Cái Khế, Ninh Kiều, Cần Thơ","Cái Khế, Ninh Kiều","35, Đường Lê Lợi, Quận Thốt Nốt",Cần Thơ,,"Ninh Kiều, Cần Thơ",VN,"10.0455652,105.7896299"
312,ChIJy1oqMqFioDERKEb64FjR2x0,Phòng Khám Nguyễn Hoàng Dũng,Phòng khám,0292 2220 427,"Phòng Khám Nguyễn Hoàng Dũng, 9 Võ Thị Sáu, Tân An, Ninh Kiều, Cần Thơ","Tân An, Ninh Kiều",9 Võ Thị Sáu,Cần Thơ,,"Ninh Kiều, Cần Thơ",VN,"10.036899,105.78619669999999"
313,ChIJKRwuFR2IoDERGBtQT28SalY,Phòng Khám Bệnh Ngoài Giờ BS Trần Thị Hòa Minh,Phòng khám,0292 3813 987,"Phòng Khám Bệnh Ngoài Giờ BS Trần Thị Hòa Minh, 2A, Đinh Tiên Hoàng, Quận Ninh Kiều, Tp Cần Thơ","An Hội, Ninh Kiều","2A, Đinh Tiên Hoàng, Quận Ninh Kiều, Tp Cần Thơ",Cần Thơ,,"Ninh Kiều, Cần Thơ",VN,"10.0420442,105.7805729"
314,ChIJ6y03NqBioDERc5psuADaakA,Phòng Khám Tư Nhân - Bs Lưu Thị Nhất Phương,Phòng khám,0292 3738 320,"Phòng Khám Tư Nhân - Bs Lưu Thị Nhất Phương, 30 Đại lộ Hoà Bình, Tân An, Ninh Kiều, Cần Thơ","Tân An, Ninh Kiều",30 Đại lộ Hoà Bình,Cần Thơ,,"Ninh Kiều, Cần Thơ",VN,"10.0338996,105.78437629999999"
315,ChIJsd0ysKZioDERk8aaabNnoPE,Phòng Khám Chuyên Khoa Mắt,Bệnh viện,0908 951 747,"Phòng Khám Chuyên Khoa Mắt, 7 Nguyễn Trãi, Tân An, Ninh Kiều, Cần Thơ","Tân An, Ninh Kiều",7 Nguyễn Trãi,Cần Thơ,,"Ninh Kiều, Cần Thơ",VN,"10.038191399999999,105.7871019"
316,ChIJZy1Pi6BioDER_bXZO5QCg1g,Phòng Khám Hồ Đắc Hoàn,Phòng khám miễn phí,0292 3824 927,"2QPM+699 Phòng Khám Hồ Đắc Hoàn, Ấp Thạnh Hưng, Ninh Kiều, Cần Thơ","Ấp Thạnh Hưng, Ninh Kiều",2QPM+699,Cần Thơ,,"Ninh Kiều, Cần Thơ",VN,"10.035530999999999,105.7834977"
317,ChIJmaCSmqdioDERP3NH4Xd0mpc,Phòng Khám - Bs Trần Văn Phúc,Phòng khám,0292 3842 163,"Phòng Khám - Bs Trần Văn Phúc, 15 Hoàng Văn Thụ, An Hội, Ninh Kiều, Cần Thơ","An Hội, Ninh Kiều",15 Hoàng Văn Thụ,Cần Thơ,,"Ninh Kiều, Cần Thơ",VN,"10.041493,105.78300349999999"
318,ChIJa3wvJgOIoDERAqLT47o_DuM,Phòng Khám Tư Nhân - Bs Lê Văn Tám,Phòng khám,,"Phòng Khám Tư Nhân - Bs Lê Văn Tám, 44 Hùng Vương, An Hội, Ninh Kiều, Cần Thơ","An Hội, Ninh Kiều",44 Hùng Vương,Cần Thơ,,"Ninh Kiều, Cần Thơ",VN,"10.0442353,105.7789856"
319,ChIJyTqX7qdioDER5w96-RhJ6f4,Phòng Khám Tư Nhân - Bs Nguyễn Phước Thiện,Phòng khám,0292 3811 025,"Phòng Khám Tư Nhân - Bs Nguyễn Phước Thiện, 7 Nguyễn Trãi, An Hội, Ninh Kiều, Cần Thơ","An Hội, Ninh Kiều",7 Nguyễn Trãi,Cần Thơ,,"Ninh Kiều, Cần Thơ",VN,"10.042356,105.7827518"
320,ChIJhcZJlqBioDERF9l37sMq4Ck,Phòng Khám Danh Anh Khanh,Phòng khám miễn phí,0292 3824 922,"2QPM+G4M Phòng Khám Danh Anh Khanh, Ấp Thạnh Hưng, Ninh Kiều, Cần Thơ","Ấp Thạnh Hưng, Ninh Kiều",2QPM+G4M,Cần Thơ,,"Ninh Kiều, Cần Thơ",VN,"10.0363373,105.7827815"
321,ChIJ9TROJ6hioDER3yeXNTJgYJk,Phòng Khám Y Học Cổ Truyền Khánh Đan,Phòng khám miễn phí,0292 3827 364,"Phòng Khám Y Học Cổ Truyền Khánh Đan, 120/118B, Trần Quang Khải, Quận Ninh Kiều, An Hội, Ninh Kiều, Cần Thơ","An Hội, Ninh Kiều","120/118B, Trần Quang Khải, Quận Ninh Kiều",Cần Thơ,,"Ninh Kiều, Cần Thơ",VN,"10.045506399999999,105.7825144"
322,ChIJK5YGMKpioDERY2zQVR5UbFY,Phòng khám Đông Y Lê Hồng,Phòng khám,,"2QXM+QP8 Phòng khám Đông Y Lê Hồng, Cái Khế, Ninh Kiều, Cần Thơ","Cái Khế, Ninh Kiều",2QXM+QP8,Cần Thơ,,"Ninh Kiều, Cần Thơ",VN,"10.0494118,105.7843225"
323,ChIJieTTNxyIoDERxS3vLyaOyD0,Phòng Khám Bệnh BS Phan Thành Tường,Phòng khám,0292 3835 112,"Phòng Khám Bệnh BS Phan Thành Tường, 151/111, Đường Huỳnh Cương, Quận Ninh Kiều, Tp Cần Thơ, An Cư, Ninh Kiều, Cần Thơ","An Cư, Ninh Kiều","151/111, Đường Huỳnh Cương, Quận Ninh Kiều, Tp Cần Thơ",Cần Thơ,,"Ninh Kiều, Cần Thơ",VN,"10.0395352,105.7785612"
324,ChIJk6jp_R6IoDERaBosI6xtySc,Phòng Khám Tư Nhân - Nhi 86,Phòng khám miễn phí,0292 3831 310,"Phòng Khám Tư Nhân - Nhi 86, 86 Đường Đ. Lý Tự Trọng, An Cư, Ninh Kiều, Cần Thơ","An Cư, Ninh Kiều",86 Đường Đ. Lý Tự Trọng,Cần Thơ,,"Ninh Kiều, Cần Thơ",VN,"10.0356197,105.77871619999999"
325,ChIJlyBHi6lioDERBTYr4ssqt-0,Huynh Van Tuyen Traditional Medicine Clinic,Phòng khám miễn phí,0778 559 425,"Huynh Van Tuyen Traditional Medicine Clinic, 112C Trần Phú, Cái Khế, Ninh Kiều, Cần Thơ","Cái Khế, Ninh Kiều",112C Trần Phú,Cần Thơ,,"Ninh Kiều, Cần Thơ",VN,"10.0478831,105.7834532"
326,ChIJbbapE-GJoDER7UGuqQLBmNY,Phòng Khám Sản Phụ Khoa - Bác sĩ Nguyễn Thị Linh Hà,Phòng khám phụ khoa,0908 040 979,"Phòng Khám Sản Phụ Khoa - Bác sĩ Nguyễn Thị Linh Hà, 6 Đ. Trương Định, Tân An, Ninh Kiều, Cần Thơ","Tân An, Ninh Kiều",6 Đ. Trương Định,Cần Thơ,,"Ninh Kiều, Cần Thơ",VN,"10.0356224,105.7822515"
337,ChIJYUZ4Kh2IoDERpXoVgQHKr88,Phòng Khám Phan Thanh Trường,Phòng khám,0292 3500 153,"Phòng Khám Phan Thanh Trường, 16 Đ. Đinh Tiên Hoàng, An Hội, Ninh Kiều, Cần Thơ 900000","An Hội, Ninh Kiều",16 Đ. Đinh Tiên Hoàng,Cần Thơ,900000.0,"Ninh Kiều, Cần Thơ",VN,"10.0436521,105.7791204"
344,ChIJBQqumkeIoDERbtrgz8cNV1g,Phòng Khám Tai Mũi Họng Bsck2 Phạm Ngọc Minh Cần thơ,Bệnh viện,0919 232 959,"Phòng Khám Tai Mũi Họng Bsck2 Phạm Ngọc Minh Cần thơ, 102/9 Đ. Ung Văn Khiêm, An Hội, Ninh Kiều, Cần Thơ","An Hội, Ninh Kiều",102/9 Đ. Ung Văn Khiêm,Cần Thơ,,"Ninh Kiều, Cần Thơ",VN,"10.0442064,105.7829087"
345,ChIJ0UGgrQKIoDER5GKNxc-oz18,Phòng Khám Răng Hàm Mặt Phan Quốc Dũng,Phòng khám nha khoa,0918 648 561,"Phòng Khám Răng Hàm Mặt Phan Quốc Dũng, 53C Nguyễn Trãi, An Hội, Ninh Kiều, Cần Thơ","An Hội, Ninh Kiều",53C Nguyễn Trãi,Cần Thơ,,"Ninh Kiều, Cần Thơ",VN,"10.044105,105.781363"
357,ChIJ6zkD6AOIoDERACnRjUqIMmk,Phòng Khám Tư Nhân - Bs Nguyễn Hoàng Khải,Phòng khám,0913 794 507,"Phòng Khám Tư Nhân - Bs Nguyễn Hoàng Khải, 70 Đ. Cách Mạng Tháng 8, Cái Khế, Ninh Kiều, Cần Thơ","Cái Khế, Ninh Kiều",70 Đ. Cách Mạng Tháng 8,Cần Thơ,,"Ninh Kiều, Cần Thơ",VN,"10.048405299999999,105.77760939999999"
358,ChIJ8e6D4wOIoDERP2dcGiHWq60,Phòng Khám Bệnh BS Trần Thị Mỹ Phương,Phòng khám,0292 3894 356,"Phòng Khám Bệnh BS Trần Thị Mỹ Phương, 58, Đường Cách Mạng Tháng 8, Quận Ninh Kiều, Tp Cần Thơ, Cái Khế, Ninh Kiều, Cần Thơ","Cái Khế, Ninh Kiều","58, Đường Cách Mạng Tháng 8, Quận Ninh Kiều, Tp Cần Thơ",Cần Thơ,,"Ninh Kiều, Cần Thơ",VN,"10.048800199999999,105.7771343"
375,ChIJHSTm3gKIoDER9bx9sFqOm_8,Phòng Khám Y Học Cổ Truyền Phương Đông Hồng,Bệnh viện,0292 3767 288,"Phòng Khám Y Học Cổ Truyền Phương Đông Hồng, 17 Hùng Vương, An Hội, Ninh Kiều, Cần Thơ","An Hội, Ninh Kiều",17 Hùng Vương,Cần Thơ,,"Ninh Kiều, Cần Thơ",VN,"10.044506799999999,105.779546"
376,ChIJpVIk4gKIoDERaHmhbznDnzY,Phòng Khám - Bs Trần Trọng Nghiêm,,0292 3810 532,"Phòng Khám - Bs Trần Trọng Nghiêm, 67 Đ. Phan Đăng Lưu, Thới Bình, Ninh Kiều, Cần Thơ","Thới Bình, Ninh Kiều",67 Đ. Phan Đăng Lưu,Cần Thơ,,"Ninh Kiều, Cần Thơ",VN,"10.0453688,105.7793162"
380,ChIJy9Gi0gSIoDERAPqcg0tFZTg,Phòng Khám Tư Nhân - Bs Nguyễn Tiến An,Phòng khám,,"Phòng Khám Tư Nhân - Bs Nguyễn Tiến An, 141 Đ. Phạm Ngũ Lão, Thới Bình, Ninh Kiều, Cần Thơ","Thới Bình, Ninh Kiều",141 Đ. Phạm Ngũ Lão,Cần Thơ,,"Ninh Kiều, Cần Thơ",VN,"10.0438382,105.7740182"
384,ChIJj5nwTgOIoDERB1Cf7iSids4,Phòng Khám Ngoài Giờ BS Lê Dũng,Bệnh viện,0947 223 478,"Phòng Khám Ngoài Giờ BS Lê Dũng, 8 Hùng Vương, Thới Bình, Ninh Kiều, Cần Thơ","Thới Bình, Ninh Kiều",8 Hùng Vương,Cần Thơ,,"Ninh Kiều, Cần Thơ",VN,"10.044119,105.77711699999999"
389,ChIJFdUjsw6IoDERT3XIiG5Dh0o,Phòng Khám Y Học Ngọc Hân,Bệnh viện,0979 738 424,"Phòng Khám Y Học Ngọc Hân, 34 Đ. Nguyễn Đệ, An Hoà, Bình Thủy, Cần Thơ","An Hoà, Bình Thủy",34 Đ. Nguyễn Đệ,Cần Thơ,,"Bình Thủy, Cần Thơ",VN,"10.049618299999999,105.7651819"
390,ChIJldOjbAyIoDERPDpI99TtpCw,Phòng Khám Anh Tuấn,Bệnh viện,0292 6252 606,"Phòng Khám Anh Tuấn, 42, Nguyễn Đệ, Phường An Thới, Quận Bình Thuỷ, Thành Phố Cần Thơ, An Hoà, Ninh Kiều, Cần Thơ","An Hoà, Ninh Kiều","42, Nguyễn Đệ, Phường An Thới, Quận Bình Thuỷ, Thành Phố Cần Thơ",Cần Thơ,,"Ninh Kiều, Cần Thơ",VN,"10.0487928,105.76290309999999"
391,ChIJq6qqBw-IoDER_8eojfXUm-o,Cơ Sở Khám Bệnh Tư Nhân BS Lê Thị Tuyên CK Nội Thần Kinh,Phòng khám,0292 3892 473,"Cơ Sở Khám Bệnh Tư Nhân BS Lê Thị Tuyên CK Nội Thần Kinh, 134A Đ. Nguyễn Văn Cừ, An Hoà, Ninh Kiều, Cần Thơ","An Hoà, Ninh Kiều",134A Đ. Nguyễn Văn Cừ,Cần Thơ,,"Ninh Kiều, Cần Thơ",VN,"10.047019299999999,105.76794439999999"
392,ChIJvTgmcyaJoDER4Igy4UgNVLA,PHÒNG KHÁM BỆNH BÁC SĨ NGUYỄN VĂN LÂM,Phòng khám,0918 822 120,"PHÒNG KHÁM BỆNH BÁC SĨ NGUYỄN VĂN LÂM, 68 Đ. Đồng Văn Cống, An Thới, Bình Thủy, Cần Thơ","An Thới, Bình Thủy",68 Đ. Đồng Văn Cống,Cần Thơ,,"Bình Thủy, Cần Thơ",VN,"10.0516621,105.7566995"
393,ChIJq6qqBw-IoDER7UXKRk7Yofo,Phòng Khám BS Trần Anh Tiến,Phòng khám,0918 221 195,"Phòng Khám BS Trần Anh Tiến, 390V/14, Đường Nguyễn Văn Cừ, Quận Ninh Kiều, Tp Cần Thơ, An Hoà, Ninh Kiều, Cần Thơ","An Hoà, Ninh Kiều","390V/14, Đường Nguyễn Văn Cừ, Quận Ninh Kiều, Tp Cần Thơ",Cần Thơ,,"Ninh Kiều, Cần Thơ",VN,"10.047019299999999,105.76794439999999"
394,ChIJj0b34BGIoDERQ9sY2GAlKUE,Phòng Khám Tư Nhân - Bs Lương Văn Thái,Phòng khám,0919 455 477,"Phòng Khám Tư Nhân - Bs Lương Văn Thái, 387 Đ. Nguyễn Văn Cừ, An Hoà, Ninh Kiều, Cần Thơ","An Hoà, Ninh Kiều",387 Đ. Nguyễn Văn Cừ,Cần Thơ,,"Ninh Kiều, Cần Thơ",VN,"10.0440139,105.76581379999999"
396,ChIJCcEhwA-IoDERtL0rxAH3oVI,Phòng Khám Chuyên Khoa Nội Bs Trần Văn Tính,Bệnh viện,0982 770 998,"Phòng Khám Chuyên Khoa Nội Bs Trần Văn Tính, 35 Đ. Nguyễn Văn Cừ, An Hoà, Ninh Kiều, Cần Thơ","An Hoà, Ninh Kiều",35 Đ. Nguyễn Văn Cừ,Cần Thơ,,"Ninh Kiều, Cần Thơ",VN,"10.045361999999999,105.768845"
397,ChIJUWPRBg2IoDERDc9zVKeXxTM,Phòng Khám Bệnh Tư Nhân Huỳnh Dương Hữu Hạnh,Phòng khám nha khoa,0292 3896 302,"Phòng Khám Bệnh Tư Nhân Huỳnh Dương Hữu Hạnh, 135 Đ. Mậu Thân, An Hoà, Ninh Kiều, Cần Thơ","An Hoà, Ninh Kiều",135 Đ. Mậu Thân,Cần Thơ,,"Ninh Kiều, Cần Thơ",VN,"10.0469637,105.7611069"
404,ChIJ0Y8LJQqJoDERT8TA1-7-LNA,Phòng khám chuyên khoa nội,Phòng khám chuyên khoa,,"Phòng khám chuyên khoa nội, 112 Đ. Phan Huy Chú, Phường An Khánh, Ninh Kiều, Cần Thơ","Phường An Khánh, Ninh Kiều",112 Đ. Phan Huy Chú,Cần Thơ,,"Ninh Kiều, Cần Thơ",VN,"10.0404581,105.7556434"
405,ChIJC9iAvxmIoDERz6LTmCPvk9A,Phòng Khám Tư Nhân B.S Nguyễn Văn Bi,Phòng khám,0903 111 661,"Phòng Khám Tư Nhân B.S Nguyễn Văn Bi, 106 Đ. Mậu Thân, An Nghiệp, Ninh Kiều, Cần Thơ","An Nghiệp, Ninh Kiều",106 Đ. Mậu Thân,Cần Thơ,,"Ninh Kiều, Cần Thơ",VN,"10.0370942,105.7718694"
407,ChIJX3tWc8SHoDERLABbUBJ6SmY,Phòng Khám Đông Y - Lâm Phượng Hưng,Phòng khám,0947 456 780,"Phòng Khám Đông Y - Lâm Phượng Hưng, 138D7 Đ. Nguyễn Văn Cừ, Phường An Khánh, Ninh Kiều, Cần Thơ 900000","Phường An Khánh, Ninh Kiều",138D7 Đ. Nguyễn Văn Cừ,Cần Thơ,900000.0,"Ninh Kiều, Cần Thơ",VN,"10.0409176,105.7622169"
408,ChIJIZOBeW2IoDERziLhwPzLJ2E,Phòng Khám BS Lưu Hùng Dũng,Bệnh viện,0292 3899 265,"Phòng Khám BS Lưu Hùng Dũng, 1B, Đường 6A, Khu Vực 4, Phường An Khánh, Quận Ninh Kiều, Thành Phố Cần Thơ, Phường An Khánh, Ninh Kiều, Cần Thơ","Phường An Khánh, Ninh Kiều","1B, Đường 6A, Khu Vực 4, Phường An Khánh, Quận Ninh Kiều, Thành Phố Cần Thơ",Cần Thơ,,"Ninh Kiều, Cần Thơ",VN,"10.0441975,105.7560199"
412,ChIJgb8b-BGIoDERrIsFxVGFsRU,Phòng Khám Bệnh Bác Sỹ Dương Hoàng Vũ,Bệnh viện,0913 822 633,"Phòng Khám Bệnh Bác Sỹ Dương Hoàng Vũ, 163 D1 Đ. Nguyễn Văn Cừ, An Hoà, Ninh Kiều, Cần Thơ","An Hoà, Ninh Kiều",163 D1 Đ. Nguyễn Văn Cừ,Cần Thơ,,"Ninh Kiều, Cần Thơ",VN,"10.043604499999999,105.7644988"
413,ChIJjygnSvyJoDERcUIO7XTIGSM,Phòng khám Lê Bé Sáu,Phòng khám,0945 902 211,"Phòng khám Lê Bé Sáu, 17 Đường Số 9, Phường An Khánh, Ninh Kiều, Cần Thơ 900000","Phường An Khánh, Ninh Kiều",17 Đường Số 9,Cần Thơ,900000.0,"Ninh Kiều, Cần Thơ",VN,"10.0383081,105.7497178"
415,ChIJ_fb4DGiIoDERyjk38lG0Qok,Phòng Khám Bác Sĩ Hiệp - Gấm,Phòng khám nha khoa,7103559509,"Phòng Khám Bác Sĩ Hiệp - Gấm, 329C, QL91B, Phường An Khánh, Bình Thủy, Cần Thơ","Phường An Khánh, Bình Thủy","329C, QL91B",Cần Thơ,,"Bình Thủy, Cần Thơ",VN,"10.0354885,105.74737019999999"
417,ChIJyePWpI-JoDERn-smNw5vLPo,Phòng khám BS Nguyễn Thành Công,Phòng khám chỉnh hình,0932 994 988,"Phòng khám BS Nguyễn Thành Công, Đường Số 7, Phường An Khánh, Ninh Kiều, Cần Thơ","Phường An Khánh, Ninh Kiều",Đường Số 7,Cần Thơ,,"Ninh Kiều, Cần Thơ",VN,"10.0439031,105.75239619999999"
419,ChIJt5AZ9m-JoDERgl_Jrf0ZuRo,Phòng khám ThS.BS Phan Thùy Ngân - Chuyên khoa Răng Hàm Mặt,Phòng khám nha khoa,0942 775 567,"Phòng khám ThS.BS Phan Thùy Ngân - Chuyên khoa Răng Hàm Mặt, 298/4 Hẻm 4, Phường An Khánh, Ninh Kiều, Cần Thơ","Phường An Khánh, Ninh Kiều",298/4 Hẻm 4,Cần Thơ,,"Ninh Kiều, Cần Thơ",VN,"10.0355823,105.7482285"
421,ChIJjbvD0VWIoDERE44yvX6kmgg,Phòng Khám Tư Nhân Bs Chuyên Khoa I: Lê Văn Viên,Phòng khám,,"2P9Q+42F Phòng Khám Tư Nhân Bs Chuyên Khoa I: Lê Văn Viên, Đường Số 3, An Bình, Bình Thủy, Cần Thơ","An Bình, Bình Thủy","2P9Q+42F, Đường Số 3",Cần Thơ,,"Bình Thủy, Cần Thơ",VN,"10.0178231,105.73754749999999"
422,ChIJNRcnOWyJoDERUtAFbIC_7XE,Phòng khám Nhi - ThS.BS. Nguyễn Huỳnh Ái Uyên,Phòng khám,0904 450 515,"Phòng khám Nhi - ThS.BS. Nguyễn Huỳnh Ái Uyên, 351AA Nguyễn Văn Cừ Nối Dài, An Bình, Ninh Kiều, Cần Thơ 900000","An Bình, Ninh Kiều",351AA Nguyễn Văn Cừ Nối Dài,Cần Thơ,900000.0,"Ninh Kiều, Cần Thơ",VN,"10.021652699999999,105.7431974"
423,ChIJ5xON6jTWgkURZWTgB2bDsHU,Phòng khám cơ xương khớp Tâm An,Phòng khám,0292 3838 115,,,,,,,,"10.035323,105.7555905"
424,ChIJ0TzvQrOJoDER2CD2K2MUBCU,Phòng Khám Bệnh BS Phan Thị Thu Ngân,Phòng khám miễn phí,0918 542 879,"Phòng Khám Bệnh BS Phan Thị Thu Ngân, 115T/3, Quốc Lộ 1A, P. An Bình, Quận Ninh Kiều, An Bình, Ninh Kiều, Cần Thơ","An Bình, Ninh Kiều","115T/3, Quốc Lộ 1A, P. An Bình, Quận Ninh Kiều",Cần Thơ,,"Ninh Kiều, Cần Thơ",VN,"10.011164599999999,105.751869"
425,ChIJzad8G7KJoDER0LtMPyz2Hhs,Phòng Khám Tư Nhân BS Nguyễn Thị Thanh Vân,Tư vấn viên,0292 3915 065,"Phòng Khám Tư Nhân BS Nguyễn Thị Thanh Vân, 185/3, Đường Lộ Vòng Cung, Quận Ninh Kiều, An Bình, Ninh Kiều, Cần Thơ","An Bình, Ninh Kiều","185/3, Đường Lộ Vòng Cung, Quận Ninh Kiều",Cần Thơ,,"Ninh Kiều, Cần Thơ",VN,"10.007562199999999,105.7477242"
426,ChIJEdZ1jbmJoDERaI3sn9l3oQ8,Phòng khám BS. Nguyễn Hữu Thuyết,Phòng khám chỉnh hình,,"Phòng khám BS. Nguyễn Hữu Thuyết, 82 Đường số 3, Phường An Khánh, Ninh Kiều, Cần Thơ","Phường An Khánh, Ninh Kiều",82 Đường số 3,Cần Thơ,,"Ninh Kiều, Cần Thơ",VN,"10.0225919,105.7490694"
427,ChIJG0hylgiJoDERREsqmyY4oHk,Phòng Khám Thạc Sĩ Bác Sĩ Luân,Phòng khám chuyên khoa,,"2Q62+JH8 Phòng Khám Thạc Sĩ Bác Sĩ Luân, An Bình, Ninh Kiều, Cần Thơ","An Bình, Ninh Kiều",2Q62+JH8,Cần Thơ,,"Ninh Kiều, Cần Thơ",VN,"10.0115474,105.7514479"
428,ChIJrauYP_iJoDERSWAdNmbrCPI,Phòng khám BS Phúc - BS Nhân,Phòng khám chuyên khoa,0794 966 579,"Phòng khám BS Phúc - BS Nhân, 30 Đ. Trần Hoàng Na, Khu dân cư 91B, Ninh Kiều, Cần Thơ","Khu dân cư 91B, Ninh Kiều",30 Đ. Trần Hoàng Na,Cần Thơ,,"Ninh Kiều, Cần Thơ",VN,"10.0204462,105.7553307"
429,ChIJp1RWUDeIoDERv_mJw12ZOwA,Phòng khám Nam Khoa Adam Health Care,Phòng khám,0916 466 276,"Phòng khám Nam Khoa Adam Health Care, 306 Đ. Nguyễn Văn Linh, Phường An Khánh, Ninh Kiều, Cần Thơ","Phường An Khánh, Ninh Kiều",306 Đ. Nguyễn Văn Linh,Cần Thơ,,"Ninh Kiều, Cần Thơ",VN,"10.0294935,105.752889"
430,ChIJA8o06TqIoDER5KROIFnI8yI,Phòng Khám,,,"Phòng Khám, 164/1B Đ. Trần Ngọc Quế, Xuân Khánh, Ninh Kiều, Cần Thơ","Xuân Khánh, Ninh Kiều",164/1B Đ. Trần Ngọc Quế,Cần Thơ,,"Ninh Kiều, Cần Thơ",VN,"10.024227999999999,105.768496"
432,ChIJqWjgPBSJoDERO1DkUuvkcyo,Phòng Khám Nội Nhi: Bs Khoa - Bs Quyên,Phòng khám chuyên khoa,,"XPW8+R8X Phòng Khám Nội Nhi: Bs Khoa - Bs Quyên, Nguyễn Văn Cừ Nối Dài, Mỹ Khánh, Phong Điền, Cần Thơ","Mỹ Khánh, Phong Điền","XPW8+R8X, Nguyễn Văn Cừ Nối Dài",Cần Thơ,,"Phong Điền, Cần Thơ",VN,"9.9971111,105.7158534"
433,ChIJa8mlhISJoDER6GX6Baa225Q,Phòng khám bs Đức,Phòng khám,,"Phòng khám bs Đức, A3, Khu dân cư 923, An Bình, Ninh Kiều","An Bình, Ninh Kiều","A3, Khu dân cư 923",Cần Thơ,,"Ninh Kiều, Cần Thơ",VN,"10.002242599999999,105.7397281"
434,ChIJ_W9MFqGJoDERlC8g2-ujR6M,Phòng Khám Tư Nguyễn Thanh Hồng,Phòng khám,0918 294 934,"Phòng Khám Tư Nguyễn Thanh Hồng, 54 Lộ Vòng Cung, An Bình, Ninh Kiều, Cần Thơ","An Bình, Ninh Kiều",54 Lộ Vòng Cung,Cần Thơ,,"Ninh Kiều, Cần Thơ",VN,"9.995319799999999,105.73916799999999"
441,ChIJe3E_1EqIoDERBc-exoi6R64,Phòng Khám Tư Nhân - Bs Đỗ Gia,Phòng khám,0292 2482 015,"Phòng Khám Tư Nhân - Bs Đỗ Gia, 27 Đ. 30 Tháng 4, Hưng Lợi, Ninh Kiều, Cần Thơ","Hưng Lợi, Ninh Kiều",27 Đ. 30 Tháng 4,Cần Thơ,,"Ninh Kiều, Cần Thơ",VN,"10.0123955,105.75590849999999"
442,ChIJIbpXxUqIoDERw0rq6JkDnZw,Phòng Khám Tư Nhân - Bs Cao Thành Quý,Phòng khám,,"Phòng Khám Tư Nhân - Bs Cao Thành Quý, 29 Đ. 3 Tháng 2, Hưng Lợi, Ninh Kiều, Cần Thơ","Hưng Lợi, Ninh Kiều",29 Đ. 3 Tháng 2,Cần Thơ,,"Ninh Kiều, Cần Thơ",VN,"10.0128639,105.7564276"
444,ChIJuWugAbeJoDER4X7kCRF3BL0,Phòng Khám Bệnh BS Minh - BS Linh,Phòng khám miễn phí,0292 3813 139,"Phòng Khám Bệnh BS Minh - BS Linh, 103, Đường Hậu Thạnh Mỹ, Quận Cái Răng, Lê Bình, Cái Răng, Cần Thơ","Lê Bình, Cái Răng","103, Đường Hậu Thạnh Mỹ, Quận Cái Răng",Cần Thơ,,"Cái Răng, Cần Thơ",VN,"10.0042938,105.75491749999999"
445,ChIJV3pXi7eJoDERTuojMkMTeTo,Phòng Khám Bs Ngọc Danh,Phòng khám,0916 687 983,"Phòng Khám Bs Ngọc Danh, 40 Trần Chiên, Lê Bình, Cái Răng, Cần Thơ","Lê Bình, Cái Răng",40 Trần Chiên,Cần Thơ,,"Cái Răng, Cần Thơ",VN,"10.001665899999999,105.75711"
446,ChIJv5_NVDOIoDERib3MV2T7NMI,Phòng Khám Tư Nhân - Bs Nhân,Phòng khám,0292 3521 789,"Phòng Khám Tư Nhân - Bs Nhân, 40 Đ. Trần Hoàng Na, Hưng Lợi, Ninh Kiều, Cần Thơ 900000","Hưng Lợi, Ninh Kiều",40 Đ. Trần Hoàng Na,Cần Thơ,900000.0,"Ninh Kiều, Cần Thơ",VN,"10.012217099999999,105.7646719"
452,ChIJTePufkiIoDERp65aeVHhFUk,Phòng Khám Siêu Âm BS Huỳnh Đào,Bệnh viện,0292 3731 281,"2QF4+494 Phòng Khám Siêu Âm BS Huỳnh Đào, Đ. Nguyễn Hiền, Khu dân cư 91B, Ninh Kiều, Cần Thơ","Khu dân cư 91B, Ninh Kiều","2QF4+494, Đ. Nguyễn Hiền",Cần Thơ,,"Ninh Kiều, Cần Thơ",VN,"10.0227691,105.7559545"
454,ChIJnxgaw0eIoDERaNUsGk7uZj4,Phòng Khám Bệnh BS Võ Thị Hồng,Bệnh viện,0913 656 544,"Phòng Khám Bệnh BS Võ Thị Hồng, 67A1 Đ. Nguyễn Hiền, Khu dân cư 91B, Ninh Kiều, Cần Thơ","Khu dân cư 91B, Ninh Kiều",67A1 Đ. Nguyễn Hiền,Cần Thơ,,"Ninh Kiều, Cần Thơ",VN,"10.0237377,105.7569444"
455,ChIJFZgzf0iIoDERT1erMaVMoEw,Phòng Khám - Bs Cao Hoàng Anh,,0292 3731 281,"Phòng Khám - Bs Cao Hoàng Anh, 111 Đ. Nguyễn Hiền, Hưng Lợi, Ninh Kiều, Cần Thơ","Hưng Lợi, Ninh Kiều",111 Đ. Nguyễn Hiền,Cần Thơ,,"Ninh Kiều, Cần Thơ",VN,"10.0228916,105.756121"
456,ChIJwy1k4HKJoDERTZX8s-AmH1E,Phòng khám siêu âm BS Đằng,Trung tâm y tế cộng đồng,0944 093 977,"2QC7+VMJ Phòng khám siêu âm BS Đằng, Hưng Lợi, Ninh Kiều, Cần Thơ","Hưng Lợi, Ninh Kiều",2QC7+VMJ,Cần Thơ,,"Ninh Kiều, Cần Thơ",VN,"10.0222193,105.7641515"
457,ChIJ6USSuEeIoDER2jcBLQDZWCk,Phòng Khám BS Hiệp,Bệnh viện,0913 737 376,"Phòng Khám BS Hiệp, 40, Đường B15, Quận Cái Răng, Thành Phố Cần Thơ, Hưng Lợi, Ninh Kiều, Cần Thơ","Hưng Lợi, Ninh Kiều","40, Đường B15, Quận Cái Răng, Thành Phố Cần Thơ",Cần Thơ,,"Ninh Kiều, Cần Thơ",VN,"10.023729399999999,105.75693419999999"
458,ChIJI1gqmDeIoDERGUSJTt66FQs,Phòng Khám BS Bảy,Bệnh viện,0292 3838 922,"Phòng Khám BS Bảy, 23 Đường Chính, Hưng Lợi, Ninh Kiều, Cần Thơ","Hưng Lợi, Ninh Kiều",23 Đường Chính,Cần Thơ,,"Ninh Kiều, Cần Thơ",VN,"10.0216356,105.7607623"
460,ChIJddr-izqIoDERBKX2rt5q4KM,Phòng Khám Bệnh Tư Nhân Bác Sĩ Trợ,Phòng khám miễn phí,0292 3739 207,"Phòng Khám Bệnh Tư Nhân Bác Sĩ Trợ, 172/11B Đ. Lê Bình, Xuân Khánh, Ninh Kiều, Cần Thơ","Xuân Khánh, Ninh Kiều",172/11B Đ. Lê Bình,Cần Thơ,,"Ninh Kiều, Cần Thơ",VN,"10.0234665,105.767715"
463,ChIJa_qx1EaIoDER_2j8gRzq0Dk,Phòng Khám Bệnh Tư Nhân Trần Quốc Bảo,Phòng khám,0913 210 861,"Phòng Khám Bệnh Tư Nhân Trần Quốc Bảo, 329B Đ. Nguyễn Văn Linh, Phường An Khánh, Ninh Kiều, Cần Thơ","Phường An Khánh, Ninh Kiều",329B Đ. Nguyễn Văn Linh,Cần Thơ,,"Ninh Kiều, Cần Thơ",VN,"10.0284672,105.755338"
464,ChIJN5Z__jSIoDER9scxnRjfSsI,Phòng Khám Bệnh Tư Nhân,Tư vấn viên,0292 3828 359,"Phòng Khám Bệnh Tư Nhân, 108/35 Đường 30/04, Hưng Lợi, Ninh Kiều, Cần Thơ","Hưng Lợi, Ninh Kiều",108/35 Đường 30/04,Cần Thơ,,"Ninh Kiều, Cần Thơ",VN,"10.0143008,105.7617008"
465,ChIJlXKZyUOIoDERiZRCeDOVSPI,Phòng Khám - Bs Trần Thị Phương Thảo,Phòng khám,,"Phòng Khám - Bs Trần Thị Phương Thảo, 289 Đ. Nguyễn Văn Linh, Phường An Khánh, Ninh Kiều, Cần Thơ","Phường An Khánh, Ninh Kiều",289 Đ. Nguyễn Văn Linh,Cần Thơ,,"Ninh Kiều, Cần Thơ",VN,"10.0309063,105.7513657"
