,place_id,name,main_category,phone,address,address_ward,address_street,address_city,address_postal_code,address_state,address_country_code,coordinates
466,ChIJAUw3y0aIoDERx_DmmO9ZLK0,Phòng Khám - Bs Lại Văn Nông & Nguyễn Hữu Kỳ Phương,Phòng khám,0292 3895 212,"Phòng Khám - Bs Lại Văn Nông & Nguyễn Hữu Kỳ Phương, 313 QL91B, Phường An Khánh, Bình Thủy, Cần Thơ","Phường An Khánh, Bình Thủy",313 QL91B,Cần Thơ,,"Bình Thủy, Cần Thơ",VN,"10.0283944,105.75446029999999"
467,ChIJx6JojzaIoDEREBuwUUeY6HE,Phòng Khám Bác Sĩ Năng,Bệnh viện,,"Phòng Khám Bác Sĩ Năng, 133D Đ. 3 Tháng 2, Hưng Lợi, Ninh Kiều, Cần Thơ","Hưng Lợi, Ninh Kiều",133D Đ. 3 Tháng 2,Cần Thơ,,"Ninh Kiều, Cần Thơ",VN,"10.018020199999999,105.7620554"
469,ChIJJUK7DGCJoDERbKErPGzCBf8,Phòng khám bệnh Bs Nghiêm Bs Hiền,Phòng khám chuyên khoa,0918 846 654,"Phòng khám bệnh Bs Nghiêm Bs Hiền, 18A1 Đ. Nguyễn Hiền, Khu dân cư 91B, Ninh Kiều, Cần Thơ","Khu dân cư 91B, Ninh Kiều",18A1 Đ. Nguyễn Hiền,Cần Thơ,,"Ninh Kiều, Cần Thơ",VN,"10.0247963,105.7576352"
470,ChIJ6-cwiDqIoDERlKFL5b00DrA,Phòng Khám Tư Nhân - Bs Trần Văn Thường,Phòng khám,0292 3739 468,"Phòng Khám Tư Nhân - Bs Trần Văn Thường, 174 Đ. Lê Bình, Hưng Lợi, Ninh Kiều, Cần Thơ","Hưng Lợi, Ninh Kiều",174 Đ. Lê Bình,Cần Thơ,,"Ninh Kiều, Cần Thơ",VN,"10.023391499999999,105.7672973"
476,ChIJ-UK6qTSIoDER8aSEhmiGWBI,Phòng Khám Siêu Âm Màu 40,Bệnh viện,0918 939 705,"2Q67+RMQ Phòng Khám Siêu Âm Màu 40, 39A Đ. Trần Hoàng Na, Hưng Lợi, Ninh Kiều, Cần Thơ","Hưng Lợi, Ninh Kiều","2Q67+RMQ, 39A Đ. Trần Hoàng Na",Cần Thơ,,"Ninh Kiều, Cần Thơ",VN,"10.0120957,105.7642736"
477,ChIJ1xU1bzGIoDERR-445rhTdkg,Phòng Khám BS Huỳnh Hùng Dũng,Bệnh viện,0918 025 052,"Phòng Khám BS Huỳnh Hùng Dũng, 524 Hẻm 553, Hưng Lợi, Ninh Kiều, Cần Thơ","Hưng Lợi, Ninh Kiều",524 Hẻm 553,Cần Thơ,,"Ninh Kiều, Cần Thơ",VN,"10.017750699999999,105.7659712"
480,ChIJLSuGSs2JoDERphcrfVP4JBc,Phòng Khám BS Nguyễn Văn Hải,Phòng khám,0292 3838 716,"Phòng Khám BS Nguyễn Văn Hải, 228B, Đường Tầm Vu, Quận Ninh Kiều, Tp Cần Thơ, Hưng Lợi, Ninh Kiều, Cần Thơ","Hưng Lợi, Ninh Kiều","228B, Đường Tầm Vu, Quận Ninh Kiều, Tp Cần Thơ",Cần Thơ,,"Ninh Kiều, Cần Thơ",VN,"10.011608299999999,105.76894929999999"
481,ChIJwxlJZC2IoDERL1H0Gos_Q_c,Phòng Khám Tư Nhân - Bs Đặng Văn Hải,Phòng khám,,"Phòng Khám Tư Nhân - Bs Đặng Văn Hải, 228 Tầm Vu, Hưng Lợi, Ninh Kiều, Cần Thơ","Hưng Lợi, Ninh Kiều",228 Tầm Vu,Cần Thơ,,"Ninh Kiều, Cần Thơ",VN,"10.013297399999999,105.770789"
482,ChIJJZaIWzSIoDERwgdnyYwyop8,Phòng Khám Răng,Phòng khám,0292 3828 936,"Phòng Khám Răng, 232/16, Đường 30/4, Quận Ninh Kiều, TP Cần Thơ, Hưng Lợi, Ninh Kiều, Cần Thơ","Hưng Lợi, Ninh Kiều","232/16, Đường 30/4, Quận Ninh Kiều, TP Cần Thơ",Cần Thơ,,"Ninh Kiều, Cần Thơ",VN,"10.018835,105.7667213"
483,ChIJKcyPpMqJoDERV68BvFmk-co,Phòng Khám Bác Sĩ Đỗ Văn Chính,Bệnh viện,0939 193 033,"Phòng Khám Bác Sĩ Đỗ Văn Chính, 91/28B, Đường 30/4, Phường Hưng Lợi, Quận Ninh Kiều, Thành Phố Cần Thơ, Hưng Lợi, Ninh Kiều, Cần Thơ","Hưng Lợi, Ninh Kiều","91/28B, Đường 30/4, Phường Hưng Lợi, Quận Ninh Kiều, Thành Phố Cần Thơ",Cần Thơ,,"Ninh Kiều, Cần Thơ",VN,"10.0109326,105.758843"
485,ChIJ853AUCSIoDER0a5lt5dn_Fk,Phòng Khám Bệnh Phụ Sản Lê Minh Nguyệt,Phòng khám miễn phí,0859 146 868,"Phòng Khám Bệnh Phụ Sản Lê Minh Nguyệt, C90, Đường Đ. Trần Khánh Dư, Xuân Khánh, Ninh Kiều, Cần Thơ","Xuân Khánh, Ninh Kiều","C90, Đường Đ. Trần Khánh Dư",Cần Thơ,,"Ninh Kiều, Cần Thơ",VN,"10.025483999999999,105.7737064"
487,ChIJiVyCWSWIoDERtzs6Jhfoayc,Phòng Khám Tư Nhân Bác Sĩ Dạ Hương,Phòng khám chuyên khoa,0292 3646 666,"Phòng Khám Tư Nhân Bác Sĩ Dạ Hương, 17/15, Đường 30-4, Phường An Lạc, Quận Ninh Kiều, Thành Phố Cần Thơ, Xuân Khánh, Ninh Kiều, Cần Thơ","Xuân Khánh, Ninh Kiều","17/15, Đường 30-4, Phường An Lạc, Quận Ninh Kiều, Thành Phố Cần Thơ",Cần Thơ,,"Ninh Kiều, Cần Thơ",VN,"10.0233089,105.7712785"
489,ChIJoVXrUiGIoDERamga1Y1VzSs,Phòng Khám Nội - Bs Lê Thắng,Phòng khám,0292 3838 029,"Phòng Khám Nội - Bs Lê Thắng, 18 Đ. Mậu Thân, An Phú, Ninh Kiều, Cần Thơ","An Phú, Ninh Kiều",18 Đ. Mậu Thân,Cần Thơ,,"Ninh Kiều, Cần Thơ",VN,"10.0281491,105.77642809999999"
490,ChIJ0Wr7-zqIoDERTKQfxV_Gu_g,Phòng Khám - Bs Trần Trường Giang,Phòng khám,0292 3885 555,"Phòng Khám - Bs Trần Trường Giang, 166 Đ. 3 Tháng 2, Xuân Khánh, Ninh Kiều, Cần Thơ","Xuân Khánh, Ninh Kiều",166 Đ. 3 Tháng 2,Cần Thơ,,"Ninh Kiều, Cần Thơ",VN,"10.0247967,105.7679502"
493,ChIJcY9OShiIoDERUl7ApQG53eU,Phòng Khám Bệnh Tư Nhân Trần Thị Phương Đan,Phòng khám,,"Phòng Khám Bệnh Tư Nhân Trần Thị Phương Đan, 25K Đinh Công Tráng, An Nghiệp, Ninh Kiều, Cần Thơ","An Nghiệp, Ninh Kiều",25K Đinh Công Tráng,Cần Thơ,,"Ninh Kiều, Cần Thơ",VN,"10.035545899999999,105.7718737"
494,ChIJlV7tE5aJoDER-JRwT9TvyKA,Phòng khám Bắc Phương,Phòng khám,0906 828 161,"Phòng khám Bắc Phương, 25b Cao Thắng, Xuân Khánh, Ninh Kiều, Cần Thơ 902070","Xuân Khánh, Ninh Kiều",25b Cao Thắng,Cần Thơ,902070.0,"Ninh Kiều, Cần Thơ",VN,"10.035803099999999,105.7707825"
495,ChIJI-KR7RWIoDERLAj6W37qPxE,Phòng Khám Tư - Bs Đào Trọng Thắng,Phòng khám,,"2QM7+Q8R Phòng Khám Tư - Bs Đào Trọng Thắng, Nguyễn Văn Cừ Nối Dài, Xuân Khánh, Ninh Kiều, Cần Thơ","Xuân Khánh, Ninh Kiều","2QM7+Q8R, Nguyễn Văn Cừ Nối Dài",Cần Thơ,,"Ninh Kiều, Cần Thơ",VN,"10.0344915,105.7632656"
497,ChIJa8J4YhiIoDER16gTyXCeoWc,Phòng Khám Bệnh Tư Nhân,Phòng khám miễn phí,0292 3821 454,"Phòng Khám Bệnh Tư Nhân, 2 Đ. Mậu Thân, An Phú, Ninh Kiều, Cần Thơ","An Phú, Ninh Kiều",2 Đ. Mậu Thân,Cần Thơ,,"Ninh Kiều, Cần Thơ",VN,"10.0338117,105.7739752"
498,ChIJ8VsCENSJoDERtppaXKuenIk,Phòng Khám Bs Lam - BV 121,Phòng khám chuyên khoa,0988 988 399,"Phòng Khám Bs Lam - BV 121, C152 Đ. Trần Văn Hoài, Xuân Khánh, Ninh Kiều, Cần Thơ","Xuân Khánh, Ninh Kiều",C152 Đ. Trần Văn Hoài,Cần Thơ,,"Ninh Kiều, Cần Thơ",VN,"10.0266927,105.772769"
499,ChIJiQEkXRiIoDERteDd4K0QVPs,Phòng Khám Răng,Phòng khám,0292 3830 273,"Phòng Khám Răng, 19/2, Mậu Thân, Quận Ninh Kiều, TP Cần Thơ, An Phú, Ninh Kiều, Cần Thơ","An Phú, Ninh Kiều","19/2, Mậu Thân, Quận Ninh Kiều, TP Cần Thơ",Cần Thơ,,"Ninh Kiều, Cần Thơ",VN,"10.0337897,105.7734595"
500,ChIJa6q9KlSJoDERisI3ubMw7W8,Phòng khám bệnh,Phòng khám,0983 707 763,"Phòng khám bệnh, Đ. Trần Khánh Dư, Xuân Khánh, Ninh Kiều, Cần Thơ 900000","Xuân Khánh, Ninh Kiều",Đ. Trần Khánh Dư,Cần Thơ,900000.0,"Ninh Kiều, Cần Thơ",VN,"10.0268617,105.774002"
501,ChIJj55zLyKIoDER3XudIA9bCok,Phòng Khám Tư Nhân B.S Đàm Xuân Tùng,Phòng khám,,"Phòng Khám Tư Nhân B.S Đàm Xuân Tùng, 134 Đ. Mậu Thân, An Phú, Ninh Kiều, Cần Thơ","An Phú, Ninh Kiều",134 Đ. Mậu Thân,Cần Thơ,,"Ninh Kiều, Cần Thơ",VN,"10.030859999999999,105.7757118"
502,ChIJW9JrUSOIoDERvVclL_J_IQU,Phòng Khám Tư Nhân - Bs Trịnh Thị Bích Liên,Phòng khám,0292 3831 881,"Phòng Khám Tư Nhân - Bs Trịnh Thị Bích Liên, 128 Đ. 3 Tháng 2, Xuân Khánh, Ninh Kiều, Cần Thơ","Xuân Khánh, Ninh Kiều",128 Đ. 3 Tháng 2,Cần Thơ,,"Ninh Kiều, Cần Thơ",VN,"10.028317099999999,105.77099299999999"
503,ChIJ-XbRHCSIoDER2or5TwX8rDU,Phòng Khám Tư Nhân - Bs Lâm Thị Ngọc Danh,Phòng khám,0916 687 983,"Phòng Khám Tư Nhân - Bs Lâm Thị Ngọc Danh, 6 Đ. 30 Tháng 4, Xuân Khánh, Ninh Kiều, Cần Thơ","Xuân Khánh, Ninh Kiều",6 Đ. 30 Tháng 4,Cần Thơ,,"Ninh Kiều, Cần Thơ",VN,"10.0267241,105.7759097"
507,ChIJEXa01xiIoDER5pGwUdUg61s,Phòng Khám Nguyễn Văn Lâm,Phòng khám,0292 2240 878,"Phòng Khám Nguyễn Văn Lâm, 188 Đ. Trần Hưng Đạo, An Phú, Ninh Kiều, Cần Thơ","An Phú, Ninh Kiều",188 Đ. Trần Hưng Đạo,Cần Thơ,,"Ninh Kiều, Cần Thơ",VN,"10.035503,105.77540669999999"
508,ChIJpZr2gx-IoDERl9271jINfcI,Phòng Khám Bệnh BS Tạ Vũ Quỳnh,Phòng khám,0292 3830 446,"Phòng Khám Bệnh BS Tạ Vũ Quỳnh, 18 Đ. Lê Lai, An Lạc, Ninh Kiều, Cần Thơ 92000","An Lạc, Ninh Kiều",18 Đ. Lê Lai,Cần Thơ,92000.0,"Ninh Kiều, Cần Thơ",VN,"10.0332174,105.7792271"
510,ChIJRTRkLyKIoDERIVTciAOA0Ms,Phòng Khám Bác Sĩ Phạm Thanh Phong,Phòng khám miễn phí,,"Phòng Khám Bác Sĩ Phạm Thanh Phong, 134E Đ. Mậu Thân, An Phú, Ninh Kiều, Cần Thơ","An Phú, Ninh Kiều",134E Đ. Mậu Thân,Cần Thơ,,"Ninh Kiều, Cần Thơ",VN,"10.030859999999999,105.7757117"
511,ChIJI172AiSIoDERxGF4Sh56NPw,Phòng Khám Nội Khoa - Bs Bùi Quang Trung,Phòng khám,0292 3840 056,"Phòng Khám Nội Khoa - Bs Bùi Quang Trung, 13 Đ. 30 Tháng 4, Xuân Khánh, Ninh Kiều, Cần Thơ","Xuân Khánh, Ninh Kiều",13 Đ. 30 Tháng 4,Cần Thơ,,"Ninh Kiều, Cần Thơ",VN,"10.0269361,105.7761082"
515,ChIJq8i76h-IoDERiEiPP-oiAzQ,Phòng khám bệnh tư nhân và siêu âm Bs,Phòng khám,,"Phòng khám bệnh tư nhân và siêu âm Bs, 86 Đ. Lý Tự Trọng, Tân An, Ninh Kiều, Cần Thơ","Tân An, Ninh Kiều",86 Đ. Lý Tự Trọng,Cần Thơ,,"Ninh Kiều, Cần Thơ",VN,"10.033855899999999,105.7806871"
521,ChIJxUzS7R-IoDERGi-_BM0UtJs,Phòng Khám BS Nguyễn Thị Ngọc Trâm,Bệnh viện,0292 3831 315,"Phòng Khám BS Nguyễn Thị Ngọc Trâm, 174, Lý Tự Trọng, Phường An Cư, Quận Ninh Kiều, Thành Phố Cần Thơ, Tân An, Ninh Kiều, Cần Thơ","Tân An, Ninh Kiều","174, Lý Tự Trọng, Phường An Cư, Quận Ninh Kiều, Thành Phố Cần Thơ",Cần Thơ,,"Ninh Kiều, Cần Thơ",VN,"10.033502799999999,105.78093229999999"
522,ChIJ4Rn-8qBioDERjGnsjg5kxUk,Phòng Khám Bệnh Đông Y,Bệnh viện,0292 3827 169,"Phòng Khám Bệnh Đông Y, 87A, Ngô Quyền, Quận Ninh Kiều, Tp Cần Thơ","Tân An, Ninh Kiều","87A, Ngô Quyền, Quận Ninh Kiều, Tp Cần Thơ",Cần Thơ,,"Ninh Kiều, Cần Thơ",VN,"10.0357563,105.7836999"
527,ChIJl-9cAh-IoDERSRnZMLBStXw,Phòng Khám Bệnh Ngoài Giờ Thạc Sĩ Bác Sĩ Nguyễn Thị Bạch Huệ,Phòng khám,0292 3830 725,"Phòng Khám Bệnh Ngoài Giờ Thạc Sĩ Bác Sĩ Nguyễn Thị Bạch Huệ, 86/22, Lý Tự Trọng, Quận Ninh Kiều, Phường An Cư, TP Cần Thơ","An Cư, Ninh Kiều","86/22, Lý Tự Trọng, Quận Ninh Kiều, Phường An Cư, TP Cần Thơ",Cần Thơ,,"Ninh Kiều, Cần Thơ",VN,"10.0353938,105.77862019999999"
528,ChIJfcNNkh-IoDERJXcSfZxA1EY,Phòng khám Câu Lạc bộ Sức khoẻ Phụ nữ,Phòng khám,0292 3834 807,"2QMJ+C49 Phòng khám Câu Lạc bộ Sức khoẻ Phụ nữ, Nhà chữ C, Công viên Lưu Hữu Phước, Đ. Phan Văn Trị, An Lạc, Ninh Kiều, Cần Thơ","An Lạc, Ninh Kiều","2QMJ+C49, Nhà chữ C, Công viên Lưu Hữu Phước, Đ. Phan Văn Trị",Cần Thơ,,"Ninh Kiều, Cần Thơ",VN,"10.033526499999999,105.7803637"
534,ChIJTR6GAiSIoDERiBPNZWFEdS8,Phòng Khám Nội Khoa - Bs Lương Được Em,Phòng khám,0292 3828 483,"Phòng Khám Nội Khoa - Bs Lương Được Em, 14 Đ. 30 Tháng 4, Xuân Khánh, Ninh Kiều, Cần Thơ","Xuân Khánh, Ninh Kiều",14 Đ. 30 Tháng 4,Cần Thơ,,"Ninh Kiều, Cần Thơ",VN,"10.026969,105.7761666"
535,ChIJJYbJvZ9ioDERCaZdXpxE8mo,Phòng Khám 153,Bệnh viện,0292 3820 826,"Phòng Khám 153, 153 Đường Châu Văn Liêm, Tân An, Ninh Kiều, Cần Thơ","Tân An, Ninh Kiều",153 Đường Châu Văn Liêm,Cần Thơ,,"Ninh Kiều, Cần Thơ",VN,"10.031195799999999,105.78361749999999"
