,place_id,name,main_category,phone,address,address_ward,address_street,address_city,address_postal_code,address_state,address_country_code
0,ChIJF-6D7qFioDERsfNSFHaupFs,Tạp Hóa Cô 6 Cô 7,Cửa hàng tạp phẩm,,"Tạp Hóa Cô 6 Cô 7, 27 Phan Đình Phùng, Tân An, Ninh Kiều, Cần Thơ","Tân An, Ninh Kiều",27 Phan Đình Phùng,Cần Thơ,,"Ninh Kiều, Cần Thơ",VN
5,ChIJlQ-g0gKJoDERQub5KEYgOrY,Tạp Hoá Cô Út Cần Thơ,Cửa hàng tạp hóa,0989 816 562,"Tạp Hoá Cô Út Cần Thơ, 158/72 Hẻm 2, Đ. Nguyễn Việt Hồng, An Phú, Ninh Kiều, Cần Thơ","An Phú, Ninh Kiều","158/72 Hẻm 2, Đ. Nguyễn Việt Hồng",Cần Thơ,,"Ninh Kiều, Cần Thơ",VN
7,ChIJC8DxMUaIoDERgrwBS_NPg30,Tạp Hóa Thiên Tân,Cửa hàng tạp hóa,0907 577 287,"Tạp Hóa Thiên Tân, 88 Đường B22, Khu dân cư 91B, Ninh Kiều, Cần Thơ","Khu dân cư 91B, Ninh Kiều",88 Đường B22,Cần Thơ,,"Ninh Kiều, Cần Thơ",VN
9,ChIJeSEgM9c7vKsR-w1yR2fjXOo,Tiệm Tạp Hóa Vinh Tuyền,Cửa hàng tạp hóa,0902 703 300,"Tiệm Tạp Hóa Vinh Tuyền, 42/31 Đ. Trần Việt Châu, Thới Bình, Ninh Kiều, Cần Thơ","Thới Bình, Ninh Kiều",42/31 Đ. Trần Việt Châu,Cần Thơ,,"Ninh Kiều, Cần Thơ",VN
10,ChIJWyPuY72JoDERl0K-4_ePPGI,Tạp hóa tuổi thơ Covy,Tiệm bánh kẹo,0792 432 169,"Tạp hóa tuổi thơ Covy, 147/43A Đ. Nguyễn Văn Cừ, P, Ninh Kiều, Cần Thơ","P, Ninh Kiều",147/43A Đ. Nguyễn Văn Cừ,Cần Thơ,,"Ninh Kiều, Cần Thơ",VN
11,ChIJPY9lpUtjoDERD995gZ-Hbcc,Tạp Hóa Chú Lùn,Cửa hàng đồ gia dụng,0949 500 090,,,,,,,
22,ChIJyQrnFIKJoDERf8sSrHYgwfw,Tiệm tạp hoá 9March,Cửa hàng tổng hợp,0932 903 393,"Tiệm tạp hoá 9March, 174 Đ. 3 Tháng 2, Hưng Lợi, Ninh Kiều, Cần Thơ","Hưng Lợi, Ninh Kiều",174 Đ. 3 Tháng 2,Cần Thơ,,"Ninh Kiều, Cần Thơ",VN
23,ChIJjbapS7WJoDERjDDgS-Q6qrY,Cửa Hàng Tạp Hóa Xuân Hảo,Cửa hàng bách hóa,0917 919 595,"Cửa Hàng Tạp Hóa Xuân Hảo, 631 Đ. 30 Tháng 4, Hưng Lợi, Ninh Kiều, Cần Thơ","Hưng Lợi, Ninh Kiều",631 Đ. 30 Tháng 4,Cần Thơ,,"Ninh Kiều, Cần Thơ",VN
27,ChIJITv4KEyIoDERdhuho5UR_QA,Tạp Hóa Tuấn Duy,Cửa hàng tạp phẩm,0917 193 865,"Tạp Hóa Tuấn Duy, Đ. Trần Vĩnh Kiết, Hưng Lợi, Ninh Kiều, Cần Thơ","Hưng Lợi, Ninh Kiều",Đ. Trần Vĩnh Kiết,Cần Thơ,,"Ninh Kiều, Cần Thơ",VN
30,ChIJXeDn9zeIoDERtMzyjnZhZAA,Tạp hoá Gia dụng 60s,Cửa hàng đồ gia dụng,,"2QF5+4Q7 Tạp hoá Gia dụng 60s, Hưng Lợi, Ninh Kiều, Cần Thơ","Hưng Lợi, Ninh Kiều",2QF5+4Q7,Cần Thơ,,"Ninh Kiều, Cần Thơ",VN
32,ChIJQyOem59ioDERhTi5rudy2tg,Cửa Hàng Tạp Hoá Hồng Phước,Cửa hàng tạp hóa,0292 3825 809,"Cửa Hàng Tạp Hoá Hồng Phước, 16Bis Đ. Đồng Khởi, Tân An, Ninh Kiều, Cần Thơ","Tân An, Ninh Kiều",16Bis Đ. Đồng Khởi,Cần Thơ,,"Ninh Kiều, Cần Thơ",VN
35,ChIJrbdZSwqJoDERfZzhhVfMoxA,Cửa Hàng Tạp Hóa Diễm My,Cửa hàng bách hóa,0292 2483 646,"Cửa Hàng Tạp Hóa Diễm My, 251 Ấp Mỹ Phước, Huyện Phong Điền, An Bình, Ninh Kiều, Cần Thơ","An Bình, Ninh Kiều","251 Ấp Mỹ Phước, Huyện Phong Điền",Cần Thơ,,"Ninh Kiều, Cần Thơ",VN
38,ChIJU857ABCIoDERhAIaKASe1Lc,Tạp Hóa Chị Tuyết,Cửa hàng tạp hóa,0292 3897 355,"Tạp Hóa Chị Tuyết, 311/, 54 Đ. Nguyễn Văn Cừ, Thới Bình, Ninh Kiều, Cần Thơ","Thới Bình, Ninh Kiều","311/, 54 Đ. Nguyễn Văn Cừ",Cần Thơ,,"Ninh Kiều, Cần Thơ",VN
46,ChIJEUWf3GWJoDER01-1Tf2IJO8,Tạp hóa 144,Cửa hàng tạp phẩm,,"Tạp hóa 144, 281 Đ.Xuân Thủy, An Bình, Ninh Kiều, Cần Thơ","An Bình, Ninh Kiều",281 Đ.Xuân Thủy,Cần Thơ,,"Ninh Kiều, Cần Thơ",VN
49,ChIJTy-5VDOIoDERIxrdYmnrJQU,Cửa Hàng Tạp Hoá Bách Sơn,Cửa hàng bách hóa,,"Cửa Hàng Tạp Hoá Bách Sơn, 17 Đ. Trần Hoàng Na, Hưng Lợi, Ninh Kiều, Cần Thơ","Hưng Lợi, Ninh Kiều",17 Đ. Trần Hoàng Na,Cần Thơ,,"Ninh Kiều, Cần Thơ",VN
50,ChIJq6qqqq5ioDERfHVGD3JkQvU,Cửa Hàng Tạp Hóa Quang Linh,Cửa hàng bách hóa,0939 992 587,"Cửa Hàng Tạp Hóa Quang Linh, Kios 43, Nhà Lồng 3, Trung Tâm Thương Mại Cái Khế, Phường Cái Khế, Quận Ninh Kiều, Thành Phố Cần Thơ, Cái Khế, Ninh Kiều, Cần Thơ","Cái Khế, Ninh Kiều","Kios 43, Nhà Lồng 3, Trung Tâm Thương Mại Cái Khế, Phường Cái Khế, Quận Ninh Kiều, Thành Phố Cần Thơ",Cần Thơ,,"Ninh Kiều, Cần Thơ",VN
55,ChIJkavbq1qIoDERoMVNcNlGl2I,Cửa Hàng Tạp Hoá 130,Cửa hàng bách hóa,0901 020 389,"Cửa Hàng Tạp Hoá 130, 130 AB1, Xuân Thủy, Khu Dân Cư Cái Sơn - Hàng Bàng, Phường An Bình, Quận Ninh Kiều, Thành Phố Cần Thơ, An Bình, Ninh Kiều, Cần Thơ","An Bình, Ninh Kiều","130 AB1, Xuân Thủy, Khu Dân Cư Cái Sơn - Hàng Bàng, Phường An Bình, Quận Ninh Kiều, Thành Phố Cần Thơ",Cần Thơ,,"Ninh Kiều, Cần Thơ",VN
56,ChIJ5UjZqGmJoDERq9U-_Doj4no,Tạp hóa Ngọc Thúy,Cửa hàng tạp phẩm,,"Tạp hóa Ngọc Thúy, 55 Đ. 30 Tháng 4, Hưng Lợi, Ninh Kiều, Cần Thơ","Hưng Lợi, Ninh Kiều",55 Đ. 30 Tháng 4,Cần Thơ,,"Ninh Kiều, Cần Thơ",VN
60,ChIJpQjbMM2JoDERwyaXJxkWSGQ,Quán Café Tạp Hóa Huỳnh Hà,Quán cà phê,0292 3839 422,"Quán Café Tạp Hóa Huỳnh Hà, 202, Đường Tầm Vu, Quận Ninh Kiều, Tp Cần Thơ, Hưng Lợi, Ninh Kiều, Cần Thơ","Hưng Lợi, Ninh Kiều","202, Đường Tầm Vu, Quận Ninh Kiều, Tp Cần Thơ",Cần Thơ,,"Ninh Kiều, Cần Thơ",VN
61,ChIJY7fJQ6qJoDER_EcVLnId7Ls,Tạp hoá Phúc Thịnh,Cửa hàng tạp hóa,0775 862 662,"Tạp hoá Phúc Thịnh, 54 Đ. Trần Hoàng Na, Hưng Lợi, Ninh Kiều, Cần Thơ","Hưng Lợi, Ninh Kiều",54 Đ. Trần Hoàng Na,Cần Thơ,,"Ninh Kiều, Cần Thơ",VN
64,ChIJ37KacC2IoDERaUTJYbVeh5w,Cửa Hàng Tạp Hóa Vĩnh Thăng,Cửa hàng bách hóa,0292 3838 684,"Cửa Hàng Tạp Hóa Vĩnh Thăng, 248 Tầm Vu, Hưng Lợi, Ninh Kiều, Cần Thơ","Hưng Lợi, Ninh Kiều",248 Tầm Vu,Cần Thơ,,"Ninh Kiều, Cần Thơ",VN
65,ChIJBVYpQ62JoDERsamJ_Wb87zU,Cửa Hàng Tạp Hóa Tuyết,Cửa hàng bách hóa,0292 3844 138,"Cửa Hàng Tạp Hóa Tuyết, 249, Đường Cái Sơn Hàng Bàng, Quận Cái Răng, An Bình, Ninh Kiều, Cần Thơ","An Bình, Ninh Kiều","249, Đường Cái Sơn Hàng Bàng, Quận Cái Răng",Cần Thơ,,"Ninh Kiều, Cần Thơ",VN
68,ChIJn0SOd7mJoDER-yDNIUquP8g,Cửa Hàng Tạp Hóa Chị Sương,Cửa hàng tạp phẩm,0906 991 962,"Cửa Hàng Tạp Hóa Chị Sương, 382 Lê Bình, Cái Răng, Cần Thơ","Lê Bình, Cái Răng",382 Lê Bình,Cần Thơ,,"Cái Răng, Cần Thơ",VN
69,ChIJkXMrfDiIoDERATbm1hdzgOs,Cửa Hàng Tạp Hóa Cà Phê,Cửa hàng tạp hóa,0292 6507 779,"Cửa Hàng Tạp Hóa Cà Phê, 227/9, QL91B, Phường An Khánh, Ninh Kiều, Cần Thơ","Phường An Khánh, Ninh Kiều","227/9, QL91B",Cần Thơ,,"Ninh Kiều, Cần Thơ",VN
72,ChIJfxMKiwWJoDERiEnE1-MX-lg,Tạp Hóa Minh Vy,Cửa hàng tạp phẩm,0939 465 675,"2QGH+R59 Tạp Hóa Minh Vy, Xuân Khánh, Ninh Kiều, Cần Thơ","Xuân Khánh, Ninh Kiều",2QGH+R59,Cần Thơ,,"Ninh Kiều, Cần Thơ",VN
75,ChIJtVktjMmJoDERABdOQf0INbo,Tạp hóa Vũ,Cửa hàng tạp hóa,0939 884 412,"Tạp hóa Vũ, 472 Võ Văn Kiệt, An Thới, Bình Thủy, Cần Thơ","An Thới, Bình Thủy",472 Võ Văn Kiệt,Cần Thơ,,"Bình Thủy, Cần Thơ",VN
77,ChIJu6y47WuIoDERPPj4wEmjCKM,Tạp Hóa Quốc,Cửa hàng tạp hóa,0907 899 603,"Tạp Hóa Quốc, KDC Thời Nhứt 1, Số 16B Đường Số 6A, Phường An Khánh, Ninh Kiều, Cần Thơ","Phường An Khánh, Ninh Kiều","KDC Thời Nhứt 1, Số 16B Đường Số 6A",Cần Thơ,,"Ninh Kiều, Cần Thơ",VN
78,ChIJVTEYC1CIoDER8o-3fO6a8ps,Cửa Hàng Tạp Hoá Đỗ Quyên,Cửa hàng bách hóa,0966 777 738,"Cửa Hàng Tạp Hoá Đỗ Quyên, 245 Đ. Tú Xương, An Bình, Ninh Kiều, Cần Thơ","An Bình, Ninh Kiều",245 Đ. Tú Xương,Cần Thơ,,"Ninh Kiều, Cần Thơ",VN
79,ChIJa4n1PyeJoDERZYSQplKC3uM,Tạp Hóa Thắm,Cửa hàng bách hóa,,"Tạp Hóa Thắm, Long Tuyền, Phong Điền, Cần Thơ","Long Tuyền, Phong Điền",,Cần Thơ,,"Phong Điền, Cần Thơ",VN
80,ChIJvZVWErGJoDER77grrR75f0w,Cửa Hàng Tạp Hóa Tường Phát,Cửa hàng bách hóa,,"Cửa Hàng Tạp Hóa Tường Phát, 63 Trần Hưng Đạo, Lê Bình, Cái Răng, Cần Thơ","Lê Bình, Cái Răng",63 Trần Hưng Đạo,Cần Thơ,,"Cái Răng, Cần Thơ",VN
81,ChIJvztGLZ2JoDERJzbOUrYf4Dw,Tạp hóa Minh Nghi,Cửa hàng tạp phẩm,,"Tạp hóa Minh Nghi, 30 Hẻm 132 Đ. 3 Tháng 2, Hưng Lợi, Ninh Kiều, Cần Thơ","Hưng Lợi, Ninh Kiều",30 Hẻm 132 Đ. 3 Tháng 2,Cần Thơ,,"Ninh Kiều, Cần Thơ",VN
85,ChIJTz8q-jqIoDERQOMcrNVUrCo,Cửa Hàng Tạp Hóa Phúc Hậu,Cửa hàng tạp hóa,0292 3739 181,"Cửa Hàng Tạp Hóa Phúc Hậu, 168 Đ. 3 Tháng 2, Xuân Khánh, Ninh Kiều, Cần Thơ","Xuân Khánh, Ninh Kiều",168 Đ. 3 Tháng 2,Cần Thơ,,"Ninh Kiều, Cần Thơ",VN
87,ChIJHeAay7eJoDERH37Ffi0OlGk,Tạp hoá / Nhà trọ Minh Khang,Cửa hàng tạp phẩm,,"2QG8+929 Tạp hoá / Nhà trọ Minh Khang, Hẻm 51, Phường An Khánh, Ninh Kiều, Cần Thơ","Phường An Khánh, Ninh Kiều","2QG8+929, Hẻm 51",Cần Thơ,,"Ninh Kiều, Cần Thơ",VN
90,ChIJ4zcOTpZioDERJTuo35XyxTQ,Tạp hóa,Cửa hàng tạp hóa,,"2QHW+WRX Tạp hóa, Hẻm 3 Tổ 8 Khu Vực I, Hưng Phú, Cái Răng, Cần Thơ","Hưng Phú, Cái Răng","2QHW+WRX, Hẻm 3 Tổ 8 Khu Vực I",Cần Thơ,,"Cái Răng, Cần Thơ",VN
92,ChIJewzx2B-IoDERT7D8eTV6CiU,Cửa Hàng Tạp Hóa Quế Vân,Cửa hàng tạp hóa,,"Cửa Hàng Tạp Hóa Quế Vân, 65 Đ. Đề Thám, Tân An, Ninh Kiều, Cần Thơ","Tân An, Ninh Kiều",65 Đ. Đề Thám,Cần Thơ,,"Ninh Kiều, Cần Thơ",VN
93,ChIJ8TbxWp9ioDERZQ_917yzXCY,Cửa Hàng Tạp Hóa Lý Nhạn Yến,Cửa hàng bách hóa,0764 033 247,"Cửa Hàng Tạp Hóa Lý Nhạn Yến, 56 Phan Bội Châu, Tân An, Ninh Kiều, Cần Thơ","Tân An, Ninh Kiều",56 Phan Bội Châu,Cần Thơ,,"Ninh Kiều, Cần Thơ",VN
94,ChIJi_QK8qFioDERCsoRtFnpTcI,Co Sau-Co Bay Grocery Store,Cửa hàng bánh,0292 3825 485,"Co Sau-Co Bay Grocery Store, 27 Phan Đình Phùng, Tân An, Ninh Kiều, Cần Thơ","Tân An, Ninh Kiều",27 Phan Đình Phùng,Cần Thơ,,"Ninh Kiều, Cần Thơ",VN
96,ChIJh-54fbyJoDERi0pa9YE9Qm0,TẠP HÓA SỐ 04,Cửa hàng tạp hóa,0292 3832 690,"2QPF+H84 TẠP HÓA SỐ 04, Nguyễn Cư Trinh, An Phú, Ninh Kiều, Cần Thơ","An Phú, Ninh Kiều","2QPF+H84, Nguyễn Cư Trinh",Cần Thơ,,"Ninh Kiều, Cần Thơ",VN
99,ChIJFaYT71mJoDEROESeIbCfk4A,Tạp Hoá Hoài An,Cửa hàng tạp phẩm,0939 828 721,"Tạp Hoá Hoài An, 173 Đ. Phạm Ngũ Lão, Thới Bình, Ninh Kiều, Cần Thơ","Thới Bình, Ninh Kiều",173 Đ. Phạm Ngũ Lão,Cần Thơ,,"Ninh Kiều, Cần Thơ",VN
105,ChIJeV0rl59ioDER_K1QawqzjXQ,Thuan Food Grocery Store,Siêu thị,0292 3830 934,"Thuan Food Grocery Store, 114 Đường Châu Văn Liêm, Tân An, Ninh Kiều, Cần Thơ","Tân An, Ninh Kiều",114 Đường Châu Văn Liêm,Cần Thơ,,"Ninh Kiều, Cần Thơ",VN
109,ChIJi_jZXSKIoDERezTWXXZtStE,Cửa Hàng Tạp Hóa 44,Cửa hàng tạp hóa,0292 3830 379,"Cửa Hàng Tạp Hóa 44, 44 Đ. 3 Tháng 2, An Phú, Ninh Kiều, Cần Thơ","An Phú, Ninh Kiều",44 Đ. 3 Tháng 2,Cần Thơ,,"Ninh Kiều, Cần Thơ",VN
115,ChIJ7wCjkhKIoDERYniB5S2Fbk8,Cửa Hàng Tạp Hóa Kha,Cửa hàng bách hóa,0919 763 978,"2QV6+783 Cửa Hàng Tạp Hóa Kha, Nguyễn Văn Cừ Nối Dài, Phường An Khánh, Ninh Kiều, Cần Thơ","Phường An Khánh, Ninh Kiều","2QV6+783, Nguyễn Văn Cừ Nối Dài",Cần Thơ,,"Ninh Kiều, Cần Thơ",VN
116,ChIJFZc0i2uIoDER5igt-9NvOx0,Cửa Hàng Tạp Hóa Tư Hòa,Cửa hàng bách hóa,0292 3833 257,"Cửa Hàng Tạp Hóa Tư Hòa, 58 Đ. Tô Hiến Thành, Phường An Khánh, Ninh Kiều, Cần Thơ","Phường An Khánh, Ninh Kiều",58 Đ. Tô Hiến Thành,Cần Thơ,,"Ninh Kiều, Cần Thơ",VN
123,ChIJwajxXVGIoDERq8e1W3Euuk8,Tạp Hóa Ánh Tuyết,Cửa hàng tạp phẩm,,"2P9V+56C Tạp Hóa Ánh Tuyết, Đ. Hoàng Quốc Việt, An Bình, Ninh Kiều, Cần Thơ","An Bình, Ninh Kiều","2P9V+56C, Đ. Hoàng Quốc Việt",Cần Thơ,,"Ninh Kiều, Cần Thơ",VN
124,ChIJN85aciSJoDERm4wD3eicgs4,Tạp hóa Cô Năm,Cửa hàng đồ gia dụng,0389 739 089,"Tạp hóa Cô Năm, 255B/VM khu vực Bình Thường B, Bình Thủy, Cần Thơ 94211","An Bình, Bình Thủy",255B/VM khu vực Bình Thường B,Cần Thơ,94211.0,"Bình Thủy, Cần Thơ",VN
125,ChIJ7RWQObKJoDERDuEG5oBdOEg,Tạp Hóa Hiền,Cửa hàng tạp phẩm,,"2P5X+7HM Tạp Hóa Hiền, An Bình, Ninh Kiều, Cần Thơ","An Bình, Ninh Kiều",2P5X+7HM,Cần Thơ,,"Ninh Kiều, Cần Thơ",VN
126,ChIJBdwdlUuIoDERuL44uTFaKWs,Tạp Hóa Nhựt Trân,Cửa hàng bách hóa,,"2Q83+GHC Tạp Hóa Nhựt Trân, Hẻm 12 Đ. 3 Tháng 2, Hưng Lợi, Ninh Kiều, Cần Thơ","Hưng Lợi, Ninh Kiều","2Q83+GHC, Hẻm 12 Đ. 3 Tháng 2",Cần Thơ,,"Ninh Kiều, Cần Thơ",VN
127,ChIJPxDWdxaJoDERiISjT-txn00,Tạp hoá Hiền,Cửa hàng tạp hóa,,"Tạp hoá Hiền, 437 Nguyễn Văn Trường, An Bình, Bình Thủy, Cần Thơ","An Bình, Bình Thủy",437 Nguyễn Văn Trường,Cần Thơ,,"Bình Thủy, Cần Thơ",VN
128,ChIJo_UAFTqJoDERW5CaNFRsMCY,Tạp Hóa Anh Ngà,Cửa hàng tạp hóa,0903 029 583,"Tạp Hóa Anh Ngà, 171 Nguyễn Văn Trường, An Bình, Ninh Kiều, Cần Thơ","An Bình, Ninh Kiều",171 Nguyễn Văn Trường,Cần Thơ,,"Ninh Kiều, Cần Thơ",VN
129,ChIJvfscjKCJoDERc0au5yAGUQQ,Quầy Tạp Hóa Út sơn,Cửa hàng bách hóa,0292 2474 199,"Quầy Tạp Hóa Út sơn, 35/1, Đường Lộ Vòng Cung, Quận Ninh Kiều, An Bình, Ninh Kiều, Cần Thơ","An Bình, Ninh Kiều","35/1, Đường Lộ Vòng Cung, Quận Ninh Kiều",Cần Thơ,,"Ninh Kiều, Cần Thơ",VN
131,ChIJ4YT4yl2JoDERj5BTlpupOdA,Tạp hóa Cô Kiều,Cửa hàng tạp hóa,0914 484 101,"Tạp hóa Cô Kiều, 166/4A Đường Phạm Hùng, khu vực, Cái Răng, Cần Thơ","khu vực, Cái Răng",166/4A Đường Phạm Hùng,Cần Thơ,,"Cái Răng, Cần Thơ",VN
132,ChIJvRbkOLKJoDERrYcX1S16ZOc,Cửa Hàng Tạp Hóa Lê Thị Kiều Oanh,Cửa hàng bách hóa,0772 365 225,"Cửa Hàng Tạp Hóa Lê Thị Kiều Oanh, Lô 41, Đường Lộ Vòng Cung, Phường An Bình, Quận Ninh Kiều, An Bình, Ninh Kiều, Cần Thơ","An Bình, Ninh Kiều","Lô 41, Đường Lộ Vòng Cung, Phường An Bình, Quận Ninh Kiều",Cần Thơ,,"Ninh Kiều, Cần Thơ",VN
135,ChIJ_8U2wrCJoDERnF1n56WiaUY,Tiệm tạp hoá cô trinh,Cửa hàng tạp phẩm,0772 024 578,"2Q32+8HV Tiệm tạp hoá cô trinh, Nguyễn Trãi, Lê Bình, Cái Răng, Cần Thơ","Lê Bình, Cái Răng","2Q32+8HV, Nguyễn Trãi",Cần Thơ,,"Cái Răng, Cần Thơ",VN
136,ChIJB2DVYbeJoDERSt_hDhiL_Zs,Cửa Hàng Tạp Hóa Quỳnh Như,Cửa hàng bách hóa,0292 6546 855,"2Q23+HQJ Cửa Hàng Tạp Hóa Quỳnh Như, Lê Bình, Cái Răng, Cần Thơ","Lê Bình, Cái Răng",2Q23+HQJ,Cần Thơ,,"Cái Răng, Cần Thơ",VN
138,ChIJqyrnDrmJoDERGZ6_qEpMPPQ,Cửa Hàng Tạp Hóa 372C,Cửa hàng tạp phẩm,0937 627 071,"Cửa Hàng Tạp Hóa 372C, 372 Lê Bình, Cái Răng, Cần Thơ","Lê Bình, Cái Răng",372 Lê Bình,Cần Thơ,,"Cái Răng, Cần Thơ",VN
139,ChIJjRLzFEeIoDERYp3A7hyGEtY,Cửa Hàng Tạp Hóa Bảy Mai,Cửa hàng tạp hóa,0292 3890 097,"Cửa Hàng Tạp Hóa Bảy Mai, 327 Đ. Nguyễn Văn Linh, Hưng Lợi, Ninh Kiều, Cần Thơ","Hưng Lợi, Ninh Kiều",327 Đ. Nguyễn Văn Linh,Cần Thơ,,"Ninh Kiều, Cần Thơ",VN
140,ChIJuY70H4eJoDER0tS6ioG6ZH4,Tạp hoá Bích thùy,Cửa hàng tổng hợp,0788 882 862,"Tạp hoá Bích thùy, Hẻm 112 Đ. 3 Tháng 2, Hưng Lợi, Ninh Kiều, Cần Thơ","Hưng Lợi, Ninh Kiều",Hẻm 112 Đ. 3 Tháng 2,Cần Thơ,,"Ninh Kiều, Cần Thơ",VN
143,ChIJyavVV8uJoDERTx_p1pzClnc,Tạp Hóa Thùy Lâm,Cửa hàng bách hóa,0907 234 542,"Tạp Hóa Thùy Lâm, 151/49/2B, Trần Hoàng Na, Phường Hưng Lợi, Quận Ninh Kiều, Thành Phố Cần Thơ, Hưng Lợi, Ninh Kiều, Cần Thơ","Hưng Lợi, Ninh Kiều","151/49/2B, Trần Hoàng Na, Phường Hưng Lợi, Quận Ninh Kiều, Thành Phố Cần Thơ",Cần Thơ,,"Ninh Kiều, Cần Thơ",VN
144,ChIJx0F489SJoDERKYXH2M2FzTM,Tạp Hóa Quí Thư,Cửa hàng bách hóa,,"Tạp Hóa Quí Thư, Hưng Thạnh, Cái Răng, Cần Thơ","Hưng Thạnh, Cái Răng",,Cần Thơ,,"Cái Răng, Cần Thơ",VN
149,ChIJafEIUSOIoDERNyBMRSBOTrA,Cửa Hàng Tạp Hóa 128A,Cửa hàng tạp hóa,0292 3731 564,"Cửa Hàng Tạp Hóa 128A, 128 Đ. 3 Tháng 2, Xuân Khánh, Ninh Kiều, Cần Thơ","Xuân Khánh, Ninh Kiều",128 Đ. 3 Tháng 2,Cần Thơ,,"Ninh Kiều, Cần Thơ",VN
150,ChIJBUtRayOIoDERoivvLo1FONk,Tiệm Tạp Hoá Hoàng Văn Kim,Cửa hàng bách hóa,0903 822 442,"Tiệm Tạp Hoá Hoàng Văn Kim, Lô 75, Chợ Xuân Khánh, Phường Xuân Khánh, Quận Ninh Kiều, Xuân Khánh, Ninh Kiều, Cần Thơ","Xuân Khánh, Ninh Kiều","Lô 75, Chợ Xuân Khánh, Phường Xuân Khánh, Quận Ninh Kiều",Cần Thơ,,"Ninh Kiều, Cần Thơ",VN
155,ChIJFSh3IaJioDERbTF9nTSaVCw,Cửa Hàng Tạp Hoá Nám,Cửa hàng bách hóa,0292 3828 198,"Cửa Hàng Tạp Hoá Nám, 50 Đường Hai Bà Trưng, Tân An, Ninh Kiều, Cần Thơ","Tân An, Ninh Kiều",50 Đường Hai Bà Trưng,Cần Thơ,,"Ninh Kiều, Cần Thơ",VN
162,ChIJ7T0uPwGIoDERgUy8gQvL2cg,Cửa Hàng Tạp Hóa Thành Trung,Cửa hàng bách hóa,0909 908 251,"3Q2G+6XX Cửa Hàng Tạp Hóa Thành Trung, Đường Tôn Thất Tùng, Cái Khế, Ninh Kiều, Cần Thơ","Cái Khế, Ninh Kiều","3Q2G+6XX, Đường Tôn Thất Tùng",Cần Thơ,,"Ninh Kiều, Cần Thơ",VN
163,ChIJAV428oaHoDERpGMUXxz4wfc,Tạp hóa,Cửa hàng,,"3Q63+8VR Tạp hóa, Lê Văn Sô, An Thới, Bình Thủy, Cần Thơ","An Thới, Bình Thủy","3Q63+8VR, Lê Văn Sô",Cần Thơ,,"Bình Thủy, Cần Thơ",VN
164,ChIJoUUvpOaHoDERB2YhtJ6KGJg,Cửa Hàng Tạp Hóa Tuyết Sương,Cửa hàng bách hóa,0292 2462 033,"Cửa Hàng Tạp Hóa Tuyết Sương, 312 Đ. Cách Mạng Tháng 8, Bùi Hữu Nghĩa, Bình Thủy, Cần Thơ","Bùi Hữu Nghĩa, Bình Thủy",312 Đ. Cách Mạng Tháng 8,Cần Thơ,,"Bình Thủy, Cần Thơ",VN
165,ChIJq6qqqq5ioDERI13VK6A2YNE,Cửa Hàng Tạp Hóa Chúc,Cửa hàng bách hóa,0902 359 342,"Cửa Hàng Tạp Hóa Chúc, Kios 25, Nhà Lồng 3, Trung Tâm Thương Mại Cái Khế, Phường Cái Khế, Quận Ninh Kiều, Thành Phố Cần Thơ, Cái Khế, Ninh Kiều, Cần Thơ","Cái Khế, Ninh Kiều","Kios 25, Nhà Lồng 3, Trung Tâm Thương Mại Cái Khế, Phường Cái Khế, Quận Ninh Kiều, Thành Phố Cần Thơ",Cần Thơ,,"Ninh Kiều, Cần Thơ",VN
167,ChIJxeG9-KFioDERD7mZGRLZ6yY,Cửa Hàng Tạp Hóa Trần Thị Em,Cửa hàng bách hóa,0856 091 011,"Cửa Hàng Tạp Hóa Trần Thị Em, 1 Đ. Tân Trào, Tân An, Ninh Kiều, Cần Thơ","Tân An, Ninh Kiều",1 Đ. Tân Trào,Cần Thơ,,"Ninh Kiều, Cần Thơ",VN
168,ChIJm0cJdaBioDER-N45Za5DX9M,Cửa Hàng Tạp Hóa Hạnh Thu,Cửa hàng tạp hóa,0292 3768 571,"Cửa Hàng Tạp Hóa Hạnh Thu, 70 Đ. Đề Thám, Tân An, Ninh Kiều, Cần Thơ","Tân An, Ninh Kiều",70 Đ. Đề Thám,Cần Thơ,,"Ninh Kiều, Cần Thơ",VN
170,ChIJ-SwEBm9joDERoIkObsMbgLI,Tạp hóa Út Kiều,Cửa hàng tạp phẩm,,"2QHR+JCC Tạp hóa Út Kiều, Khu Vực 3, Hưng Phú, Cái Răng, Cần Thơ","Hưng Phú, Cái Răng","2QHR+JCC, Khu Vực 3",Cần Thơ,,"Cái Răng, Cần Thơ",VN
171,ChIJpzyy8CqJoDERgWOAj8-7fNs,TIỆM TẠP HÓA BÁNH BAO NHỎ YÊN,Cửa hàng tổng hợp,0763 823 807,"TIỆM TẠP HÓA BÁNH BAO NHỎ YÊN, 85 Đ. Đề Thám, Tân An, Ninh Kiều, Cần Thơ","Tân An, Ninh Kiều",85 Đ. Đề Thám,Cần Thơ,,"Ninh Kiều, Cần Thơ",VN
172,ChIJfcfWeRyIoDEReutGG5YJgYI,Cửa Hàng Tạp Hóa Xuân Chi,Cửa hàng bách hóa,,"Cửa Hàng Tạp Hóa Xuân Chi, 33 Đ. Huỳnh Thúc Kháng, An Cư, Ninh Kiều, Cần Thơ","An Cư, Ninh Kiều",33 Đ. Huỳnh Thúc Kháng,Cần Thơ,,"Ninh Kiều, Cần Thơ",VN
173,ChIJG1WaAqJioDERtMo2eFmx4QM,My Le Grocery Store,Cửa hàng bách hóa,,"My Le Grocery Store, 88 Đường Hai Bà Trưng, Street, Ninh Kiều, Cần Thơ","Street, Ninh Kiều",88 Đường Hai Bà Trưng,Cần Thơ,,"Ninh Kiều, Cần Thơ",VN
176,ChIJSSaxefyJoDER4wcuffKqsqI,Tạp hóa Thanh Tâm,Cửa hàng tạp phẩm,,"2QVF+56R Tạp hóa Thanh Tâm, Đ. Phạm Ngũ Lão, Thới Bình, Ninh Kiều, Cần Thơ","Thới Bình, Ninh Kiều","2QVF+56R, Đ. Phạm Ngũ Lão",Cần Thơ,,"Ninh Kiều, Cần Thơ",VN
183,ChIJiy21kRuIoDERzOyWRd_jIOc,Cửa Hàng Tạp Hóa Quang Lê,Cửa hàng bách hóa,0292 3832 639,"Cửa Hàng Tạp Hóa Quang Lê, 63 Đ. Huỳnh Thúc Kháng, An Cư, Ninh Kiều, Cần Thơ","An Cư, Ninh Kiều",63 Đ. Huỳnh Thúc Kháng,Cần Thơ,,"Ninh Kiều, Cần Thơ",VN
186,ChIJl9wgnBuIoDERsslJPb2Uc4Y,Tạp Hoá 54,Cửa hàng bách hóa,0292 3835 053,"Tạp Hoá 54, 42/80 Hùng Vương, An Cư, Ninh Kiều, Cần Thơ","An Cư, Ninh Kiều",42/80 Hùng Vương,Cần Thơ,,"Ninh Kiều, Cần Thơ",VN
190,ChIJd-R9qBuIoDERuNw-goTv1TI,Tạp Hoá Cô Mười,Cửa hàng bách hóa,0292 3835 451,"Tạp Hoá Cô Mười, 132/42/25A, Hùng Vương, Phường Thới Bình, Quận Ninh Kiều, Thành Phố Cần Thơ, An Phú, Ninh Kiều, Cần Thơ","An Phú, Ninh Kiều","132/42/25A, Hùng Vương, Phường Thới Bình, Quận Ninh Kiều, Thành Phố Cần Thơ",Cần Thơ,,"Ninh Kiều, Cần Thơ",VN
197,ChIJRZF_NU2JoDERRvXd3LfWOTo,TẠP HOÁ MAI TRINH,Cửa hàng tiện lợi,,"TẠP HOÁ MAI TRINH, 52 Đ. Võ Trường Toản, An Hoà, Ninh Kiều, Cần Thơ","An Hoà, Ninh Kiều",52 Đ. Võ Trường Toản,Cần Thơ,,"Ninh Kiều, Cần Thơ",VN
198,ChIJc0lbduWJoDERUR6GVDxTYrk,tạp hóa Năm Lợi,Cửa hàng tạp hóa,0292 3831 770,"tạp hóa Năm Lợi, 36 Đ. Nguyễn Tri Phương, Phường An Khánh, Ninh Kiều, Cần Thơ","Phường An Khánh, Ninh Kiều",36 Đ. Nguyễn Tri Phương,Cần Thơ,,"Ninh Kiều, Cần Thơ",VN
199,ChIJZ11eol6HoDERc48IAHn8pZw,Tạp Hóa Diệu,Cửa hàng tổng hợp,,"Tạp Hóa Diệu, 108 Trần Quang Diệu, An Thới, Bình Thủy, Cần Thơ","An Thới, Bình Thủy",108 Trần Quang Diệu,Cần Thơ,,"Bình Thủy, Cần Thơ",VN
201,ChIJQ5SQxzGJoDER-zEMP91pLQo,Tạp Hoá Thành Đạt,Cửa hàng tạp phẩm,,"Tạp Hoá Thành Đạt, 130B/5 Nguyễn Văn Cừ Nối Dài, Phường An Khánh, Ninh Kiều, Cần Thơ 900000","Phường An Khánh, Ninh Kiều",130B/5 Nguyễn Văn Cừ Nối Dài,Cần Thơ,900000.0,"Ninh Kiều, Cần Thơ",VN
206,ChIJq6qqBw-IoDERmBqpdMr__Nc,Cửa Hàng Tạp Hoá Minh Nhật,Cửa hàng bách hóa,0903 517 089,"Cửa Hàng Tạp Hoá Minh Nhật, 163G Đ. Nguyễn Văn Cừ, An Hoà, Ninh Kiều, Cần Thơ","An Hoà, Ninh Kiều",163G Đ. Nguyễn Văn Cừ,Cần Thơ,,"Ninh Kiều, Cần Thơ",VN
208,ChIJXdEW9L6JoDERKOggJD0apdM,Tạp Hoá Suka,Cửa hàng tổng hợp,0936 788 730,"Tạp Hoá Suka, 33 Đ.Số 4, Phường An Khánh, Ninh Kiều, Cần Thơ","Phường An Khánh, Ninh Kiều",33 Đ.Số 4,Cần Thơ,,"Ninh Kiều, Cần Thơ",VN
210,ChIJAchnkmuIoDERI0mMIJtHw3g,Cửa Hàng Tạp Hóa Thanh Hiền,Cửa hàng bách hóa,0935 116 201,"Cửa Hàng Tạp Hóa Thanh Hiền, Chợ phường An Khánh, Đường 18, Ninh Kiều, Cần Thơ","Đường 18, Ninh Kiều",Chợ phường An Khánh,Cần Thơ,,"Ninh Kiều, Cần Thơ",VN
212,ChIJO8pIAq-JoDERGi1FfM8LiHw,TIỆM TẠP HÓA CÔ HÍ,Cửa hàng quà tặng,0794 315 161,"TIỆM TẠP HÓA CÔ HÍ, 68 Hẻm Lò Mổ, Xuân Khánh, Ninh Kiều, Cần Thơ","Xuân Khánh, Ninh Kiều",68 Hẻm Lò Mổ,Cần Thơ,,"Ninh Kiều, Cần Thơ",VN
214,ChIJ86i1GviJoDER5bJf1lUk-9k,Tạp hoá Mít,Cửa hàng tạp phẩm,,"Tạp hoá Mít, 382/a2 Đ. Trần Nam Phú, Xuân Khánh, Ninh Kiều, Cần Thơ","Xuân Khánh, Ninh Kiều",382/a2 Đ. Trần Nam Phú,Cần Thơ,,"Ninh Kiều, Cần Thơ",VN
216,ChIJA62Je2uIoDERusfokfOq8CY,Cửa Hàng Tạp Hoá Thanh Nga,Cửa hàng bách hóa,0292 3812 577,"Cửa Hàng Tạp Hoá Thanh Nga, 14B, Đường 27, Khu Vực 4, Thới Nhựt, Phường An Khánh, Quận Ninh Kiều, Thành Phố Cần Thơ, Phường An Khánh, Ninh Kiều, Cần Thơ","Phường An Khánh, Ninh Kiều","14B, Đường 27, Khu Vực 4, Thới Nhựt, Phường An Khánh, Quận Ninh Kiều, Thành Phố Cần Thơ",Cần Thơ,,"Ninh Kiều, Cần Thơ",VN
217,ChIJb1MD30OIoDERGdX9Fmyb6pU,Cửa Hàng Tạp Hóa Vĩnh Hưng,Cửa hàng tạp hóa,0292 2475 474,"Cửa Hàng Tạp Hóa Vĩnh Hưng, 307c Đ. Nguyễn Văn Linh, Phường An Khánh, Ninh Kiều, Cần Thơ","Phường An Khánh, Ninh Kiều",307c Đ. Nguyễn Văn Linh,Cần Thơ,,"Ninh Kiều, Cần Thơ",VN
218,ChIJ-_gDURWIoDERRjpI7U82R7A,Tạp Hóa Hồng Diệu,Cửa hàng bách hóa,0292 3890 262,"2QM5+MM6 Tạp Hóa Hồng Diệu, Đ. Trần Nam Phú, Xuân Khánh, Ninh Kiều, Cần Thơ","Xuân Khánh, Ninh Kiều","2QM5+MM6, Đ. Trần Nam Phú",Cần Thơ,,"Ninh Kiều, Cần Thơ",VN
219,ChIJWe5cWkKIoDERl1dl0Qq49mQ,Cửa Hàng Tạp Hóa Thúy Vy,Cửa hàng bách hóa,0933 475 870,"Cửa Hàng Tạp Hóa Thúy Vy, 1 Đ. Nguyễn Văn Linh, Phường An Khánh, Ninh Kiều, Cần Thơ","Phường An Khánh, Ninh Kiều",1 Đ. Nguyễn Văn Linh,Cần Thơ,,"Ninh Kiều, Cần Thơ",VN
