,place_id,name,main_category,phone,address,address_ward,address_street,address_city,address_postal_code,address_state,address_country_code
220,ChIJSXjuNSaJoDERZOujdkHIJug,Tạp hóa Hồng Hạnh,Cửa hàng tạp phẩm,,"2PCR+CPC Tạp hóa Hồng Hạnh, Đ. Hoàng Quốc Việt, An Bình, Ninh Kiều, Cần Thơ","An Bình, Ninh Kiều","2PCR+CPC, Đ. Hoàng Quốc Việt",Cần Thơ,,"Ninh Kiều, Cần Thơ",VN
221,ChIJCToHvVqIoDERq81PCDFL_yo,Tạp Hóa 737,Cửa hàng bách hóa,0937 471 676,"Tạp Hóa 737, 237 Nguyễn Văn Cừ Nối Dài, Phường An Khánh, Ninh Kiều, Cần Thơ","Phường An Khánh, Ninh Kiều",237 Nguyễn Văn Cừ Nối Dài,Cần Thơ,,"Ninh Kiều, Cần Thơ",VN
222,ChIJfTfoNEWIoDERkhrzHFqP6G0,Tạp hóa Anh Thư,Cửa hàng tạp hóa,,"2PGW+2QQ Tạp hóa Anh Thư, Đường số 3, An Bình, Ninh Kiều, Cần Thơ","An Bình, Ninh Kiều","2PGW+2QQ, Đường số 3",Cần Thơ,,"Ninh Kiều, Cần Thơ",VN
223,ChIJ37vC31KIoDERWWtttGbxmIw,Tạp Hoá Minh Quang,Cửa hàng bách hóa,0706 962 686,"Tạp Hoá Minh Quang, 247K, Khu Vực 4, Hoàng Quốc Việt, Phường An Bình, Quận Ninh Kiều, Thành Phố Cần Thơ, An Bình, Ninh Kiều, Cần Thơ","An Bình, Ninh Kiều","247K, Khu Vực 4, Hoàng Quốc Việt, Phường An Bình, Quận Ninh Kiều, Thành Phố Cần Thơ",Cần Thơ,,"Ninh Kiều, Cần Thơ",VN
224,ChIJdRGa8YCJoDERssvjmU7T-oY,Tạp hóa Trinh,Cửa hàng tạp phẩm,,"Tạp hóa Trinh, 4 Đ. Trần Vĩnh Kiết, An Bình, Ninh Kiều, Cần Thơ","An Bình, Ninh Kiều",4 Đ. Trần Vĩnh Kiết,Cần Thơ,,"Ninh Kiều, Cần Thơ",VN
225,ChIJ8bchkkOIoDERkS7OSDCw_ZE,Cửa Hàng Tạp Hóa Hương Sơn,Cửa hàng tạp hóa,0702 943 661,"Cửa Hàng Tạp Hóa Hương Sơn, 306 Nguyễn Văn Cừ Nối Dài, Phường An Khánh, Ninh Kiều, Cần Thơ","Phường An Khánh, Ninh Kiều",306 Nguyễn Văn Cừ Nối Dài,Cần Thơ,,"Ninh Kiều, Cần Thơ",VN
226,ChIJHRM-ssKJoDERydDOZM7YJAk,tạp hóa cô 6,Cửa hàng tạp phẩm,,"tạp hóa cô 6, 239 Đường Tạ Thị Phi, An Bình, Bình Thủy, Cần Thơ","An Bình, Bình Thủy",239 Đường Tạ Thị Phi,Cần Thơ,,"Bình Thủy, Cần Thơ",VN
227,ChIJu5AzJ1OIoDERyGAvXgsvzQw,Tạp Hoá Bảo Trân,Cửa hàng bách hóa,0945 148 260,"Tạp Hoá Bảo Trân, 315D/9, Khu Vực 4, Hoàng Quốc Việt, Phường An Bình, Quận Ninh Kiều, Thành Phố Cần Thơ, An Bình, Ninh Kiều, Cần Thơ","An Bình, Ninh Kiều","315D/9, Khu Vực 4, Hoàng Quốc Việt, Phường An Bình, Quận Ninh Kiều, Thành Phố Cần Thơ",Cần Thơ,,"Ninh Kiều, Cần Thơ",VN
228,ChIJjzAwIX6JoDER70wObP-uJ54,Tạp hóa Khánh Đăng,Cửa hàng tạp phẩm,,"Tạp hóa Khánh Đăng, 273 Đ. Trần Vĩnh Kiết, Phường An Khánh, Ninh Kiều, Cần Thơ","Phường An Khánh, Ninh Kiều",273 Đ. Trần Vĩnh Kiết,Cần Thơ,,"Ninh Kiều, Cần Thơ",VN
229,ChIJ1eaD4KuJoDER7lVV1inVIWQ,Tạp hóa Ngân Linh,Cửa hàng tạp phẩm,,"Tạp hóa Ngân Linh, 311 Đ. Nguyễn Văn Linh, Phường An Khánh, Ninh Kiều, Cần Thơ","Phường An Khánh, Ninh Kiều",311 Đ. Nguyễn Văn Linh,Cần Thơ,,"Ninh Kiều, Cần Thơ",VN
232,ChIJkfBUCaGJoDERbB_PEau9mBU,Tạp Hóa Khiêm,Cửa hàng tạp hóa,,"Tạp Hóa Khiêm, 396B/11 Nguyễn Văn Trường, An Bình, Ninh Kiều, Cần Thơ","An Bình, Ninh Kiều",396B/11 Nguyễn Văn Trường,Cần Thơ,,"Ninh Kiều, Cần Thơ",VN
233,ChIJz3rn2ROJoDERoZgNVGqDLN0,Cửa Hàng Tạp Hóa Cẩm Hường,Cửa hàng bách hóa,0292 3911 664,"Cửa Hàng Tạp Hóa Cẩm Hường, 171 Ấp Mỹ Ái, Huyện Phong Điền, Mỹ Khánh, Phong Điền, Cần Thơ","Mỹ Khánh, Phong Điền","171 Ấp Mỹ Ái, Huyện Phong Điền",Cần Thơ,,"Phong Điền, Cần Thơ",VN
234,ChIJNe1IopKJoDERuXrzTzzKfAo,Tạp Hóa Ba Sự,Cửa hàng tạp hóa,0292 3845 665,"Tạp Hóa Ba Sự, 20 - 21 Đ. Bùi Hữu Nghĩa, Long Tuyền, Bình Thủy, Cần Thơ","Long Tuyền, Bình Thủy",20 - 21 Đ. Bùi Hữu Nghĩa,Cần Thơ,,"Bình Thủy, Cần Thơ",VN
235,ChIJ1xYRh7SJoDERZF8sjBEM9c0,Tạp Hóa Thanh Bình,Cửa hàng tạp hóa,0867 898 959,"2PC6+347 Tạp Hóa Thanh Bình, Long Tuyền, Bình Thủy, Cần Thơ","Long Tuyền, Bình Thủy",2PC6+347,Cần Thơ,,"Bình Thủy, Cần Thơ",VN
236,ChIJ8aF3GCOJoDER6xJBVDB_o6I,Tạp Hóa - Cà Phê Hồng Tươi,Cửa hàng,,"Tạp Hóa - Cà Phê Hồng Tươi, Mỹ Khánh, Phong Điền, Cần Thơ","Mỹ Khánh, Phong Điền",,Cần Thơ,,"Phong Điền, Cần Thơ",VN
238,ChIJqw8z-qSJoDERG6eGUDNX5pA,Cửa Hàng Tạp Hoá Cô Chí,Cửa hàng bách hóa,0919 202 213,"Cửa Hàng Tạp Hoá Cô Chí, 65/1, Võ Tánh, Phường Lê Bình, Quận Cái Răng, Thành Phố Cần Thơ, Lê Bình, Cái Răng, Cần Thơ","Lê Bình, Cái Răng","65/1, Võ Tánh, Phường Lê Bình, Quận Cái Răng, Thành Phố Cần Thơ",Cần Thơ,,"Cái Răng, Cần Thơ",VN
239,ChIJRZ1v4K-JoDEROaswrPw7-dM,Cửa Hàng Tạp Hóa Ngân,Cửa hàng bách hóa,0932 887 537,"Cửa Hàng Tạp Hóa Ngân, 44/1, Đường Võ Tánh, Quận Cái Răng, Lê Bình, Cái Răng, Cần Thơ","Lê Bình, Cái Răng","44/1, Đường Võ Tánh, Quận Cái Răng",Cần Thơ,,"Cái Răng, Cần Thơ",VN
241,ChIJKSZLM6eJoDERf4VyJ0HR27M,Tạp hóa NHƯ Ý,Cửa hàng tạp hóa,0939 114 562,"Tạp hóa NHƯ Ý, 63A Kv Thạnh Huề, Thường Thạnh, Cái Răng, Cần Thơ","Thường Thạnh, Cái Răng",63A Kv Thạnh Huề,Cần Thơ,,"Cái Răng, Cần Thơ",VN
242,ChIJayFMprGJoDERljWbpY_E_Lg,Cửa Hàng Tạp Hóa Minh Yên,Cửa hàng bách hóa,0292 2243 264,"Cửa Hàng Tạp Hóa Minh Yên, 126 Võ Tánh, Lê Bình, Cái Răng, Cần Thơ","Lê Bình, Cái Răng",126 Võ Tánh,Cần Thơ,,"Cái Răng, Cần Thơ",VN
243,ChIJaTaFT7uJoDERqQeXsH5UVpo,Tiệm Tạp Hóa Lan Anh,Cửa hàng bách hóa,0939 021 473,"XPWX+R2V Tiệm Tạp Hóa Lan Anh, Nguyễn Việt Dũng, Lê Bình, Cái Răng, Cần Thơ","Lê Bình, Cái Răng","XPWX+R2V, Nguyễn Việt Dũng",Cần Thơ,,"Cái Răng, Cần Thơ",VN
244,ChIJn0tni7CJoDER5kElqDWQCjk,Cửa Hàng Tạp Hóa Hiếu Nhân,Cửa hàng bách hóa,0292 2460 462,"Cửa Hàng Tạp Hóa Hiếu Nhân, 467 Nguyễn Trãi, Lê Bình, Cái Răng, Cần Thơ","Lê Bình, Cái Răng",467 Nguyễn Trãi,Cần Thơ,,"Cái Răng, Cần Thơ",VN
248,ChIJ--HP6kqIoDERVasJpgdKVbE,Cửa Hàng Tạp Hóa Khương Thị Hạnh,Cửa hàng bách hóa,0777 270 818,"Cửa Hàng Tạp Hóa Khương Thị Hạnh, 38/18, Đường 3 Tháng 2, Phường Hưng Lợi, Quận Ninh Kiều, Hưng Lợi, Ninh Kiều, Cần Thơ","Hưng Lợi, Ninh Kiều","38/18, Đường 3 Tháng 2, Phường Hưng Lợi, Quận Ninh Kiều",Cần Thơ,,"Ninh Kiều, Cần Thơ",VN
249,ChIJP1IsakuIoDERhT04YNmrIpQ,Tạp Hóa Thanh Tân,Cửa hàng bách hóa,0292 3838 714,"Tạp Hóa Thanh Tân, 2/36, Đường 3/2, Quận Ninh Kiều, TP Cần Thơ, Hưng Lợi, Ninh Kiều, Cần Thơ","Hưng Lợi, Ninh Kiều","2/36, Đường 3/2, Quận Ninh Kiều, TP Cần Thơ",Cần Thơ,,"Ninh Kiều, Cần Thơ",VN
255,ChIJb0ROw7CJoDERKqzm9DNN2AM,Tiệm tạp hoá Phương Phương,Cửa hàng tạp phẩm,,"Tiệm tạp hoá Phương Phương, 74/1 Lê Bình, Cái Răng, Cần Thơ","Lê Bình, Cái Răng",74/1 Lê Bình,Cần Thơ,,"Cái Răng, Cần Thơ",VN
256,ChIJI5n2wkqIoDERc858x6-YWZ0,Tiệm Tạp Hóa Thới Hưng,Cửa hàng bách hóa,0292 3781 923,"Tiệm Tạp Hóa Thới Hưng, 36E, Đường 3/2, Quận Ninh Kiều, TP Cần Thơ, Hưng Lợi, Ninh Kiều, Cần Thơ","Hưng Lợi, Ninh Kiều","36E, Đường 3/2, Quận Ninh Kiều, TP Cần Thơ",Cần Thơ,,"Ninh Kiều, Cần Thơ",VN
258,ChIJZd2L3jmIoDERZZRXWfTyfNk,Tạp Hóa Huyền,Cửa hàng bách hóa,,"Tạp Hóa Huyền, Hưng Lợi, Ninh Kiều, Cần Thơ","Hưng Lợi, Ninh Kiều",,Cần Thơ,,"Ninh Kiều, Cần Thơ",VN
259,ChIJxSF3uDCIoDERFnhro6NeIyc,Cửa Hàng Tạp Hóa Ngọc Tiên,Cửa hàng bách hóa,,"Cửa Hàng Tạp Hóa Ngọc Tiên, 200 QL91B, Hưng Lợi, Ninh Kiều, Cần Thơ","Hưng Lợi, Ninh Kiều",200 QL91B,Cần Thơ,,"Ninh Kiều, Cần Thơ",VN
261,ChIJCSpeOQCJoDERB4q6uYiPp0g,Tạp hóa 68,Cửa hàng tạp phẩm,,"Tạp hóa 68, 44 Đ. Số 2, Khu dân cư Metro, Ninh Kiều, Cần Thơ","Khu dân cư Metro, Ninh Kiều",44 Đ. Số 2,Cần Thơ,,"Ninh Kiều, Cần Thơ",VN
262,ChIJhWMxfSGJoDERi_YnyF5-G_Q,Tạp hoá Yến Nhi,Cửa hàng tạp hóa,,"Tạp hoá Yến Nhi, 26 Đ. A3, Phường An Khánh, Ninh Kiều, Cần Thơ","Phường An Khánh, Ninh Kiều",26 Đ. A3,Cần Thơ,,"Ninh Kiều, Cần Thơ",VN
263,ChIJWUmr1PaJoDERWvynSKBwGck,Tạp Hóa A Luân,Cửa hàng tạp phẩm,,"2Q95+42G Tạp Hóa A Luân, Hưng Lợi, Ninh Kiều, Cần Thơ","Hưng Lợi, Ninh Kiều",2Q95+42G,Cần Thơ,,"Ninh Kiều, Cần Thơ",VN
264,ChIJN7V1K4yJoDER2MxA_HixXwA,Tiệm Tạp Hoá Liễu,Cửa hàng tạp phẩm,,"Tiệm Tạp Hoá Liễu, 11K2/3 Hẻm 3, Đường vào Sân Cầu Lông, Phường An Khánh, Ninh Kiều, Cần Thơ","Phường An Khánh, Ninh Kiều","11K2/3 Hẻm 3, Đường vào Sân Cầu Lông",Cần Thơ,,"Ninh Kiều, Cần Thơ",VN
266,ChIJeTdG5zmIoDERlqjkkG2MJ3w,Cửa Hàng Tạp Hóa Tuyến,Cửa hàng tạp hóa,0292 6292 918,"Cửa Hàng Tạp Hóa Tuyến, 13, Đường Quốc Lộ 91B, Quận Ninh Kiều, Tp Cần Thơ, Hưng Lợi, Ninh Kiều, Cần Thơ","Hưng Lợi, Ninh Kiều","13, Đường Quốc Lộ 91B, Quận Ninh Kiều, Tp Cần Thơ",Cần Thơ,,"Ninh Kiều, Cần Thơ",VN
267,ChIJURGySTeIoDERC_vZjcJuSuc,Tiệm Tạp Hóa Ngọc Thành,Cửa hàng bách hóa,0292 3782 578,"Tiệm Tạp Hóa Ngọc Thành, 2 Đ. Nguyễn Văn Linh, Hưng Lợi, Ninh Kiều, Cần Thơ","Hưng Lợi, Ninh Kiều",2 Đ. Nguyễn Văn Linh,Cần Thơ,,"Ninh Kiều, Cần Thơ",VN
269,ChIJc_W_fkeIoDERFWh7ECX1VSY,Cửa Hàng Tạp Hóa Thúy Hường,Cửa hàng tạp hóa,0292 3780 131,"Cửa Hàng Tạp Hóa Thúy Hường, 340 QL91B, Hưng Lợi, Bình Thủy, Cần Thơ","Hưng Lợi, Bình Thủy",340 QL91B,Cần Thơ,,"Bình Thủy, Cần Thơ",VN
272,ChIJAQzMhjaIoDERGCv9Qjb-bgc,Tạp Hóa Trâm,Cửa hàng bách hóa,,"Tạp Hóa Trâm, 127 Đ. 3 Tháng 2, Hưng Lợi, Ninh Kiều, Cần Thơ","Hưng Lợi, Ninh Kiều",127 Đ. 3 Tháng 2,Cần Thơ,,"Ninh Kiều, Cần Thơ",VN
276,ChIJFeaXaziIoDER5FkzI33SBHc,Cửa Hàng Tạp Hóa Huỳnh Thị Mỹ Duyên,Cửa hàng bách hóa,0763 792 313,"Cửa Hàng Tạp Hóa Huỳnh Thị Mỹ Duyên, 21C, Tỉnh Lộ 91B, Phường Hưng Lợi, Quận Ninh Kiều, Hưng Lợi, Ninh Kiều, Cần Thơ","Hưng Lợi, Ninh Kiều","21C, Tỉnh Lộ 91B, Phường Hưng Lợi, Quận Ninh Kiều",Cần Thơ,,"Ninh Kiều, Cần Thơ",VN
279,ChIJwWG9_DOIoDERHfDb5M787lI,Cửa Hàng Tạp Hóa 186,Cửa hàng tạp hóa,0292 3740 170,"Cửa Hàng Tạp Hóa 186, 186 Đ. 30 Tháng 4, Hưng Lợi, Ninh Kiều, Cần Thơ","Hưng Lợi, Ninh Kiều",186 Đ. 30 Tháng 4,Cần Thơ,,"Ninh Kiều, Cần Thơ",VN
280,ChIJUTXlozCIoDERxZUMh6bBjlQ,Cửa Hàng Tạp Hóa Ngọc Mai,Cửa hàng tạp hóa,,"Cửa Hàng Tạp Hóa Ngọc Mai, 223 Đ. 3 Tháng 2, Hưng Lợi, Ninh Kiều, Cần Thơ 900000","Hưng Lợi, Ninh Kiều",223 Đ. 3 Tháng 2,Cần Thơ,900000.0,"Ninh Kiều, Cần Thơ",VN
283,ChIJfbfaKz-IoDERHIbm0yYmYCg,Tạp Hóa Phượng 2,Cửa hàng bách hóa,0794 243 351,"Tạp Hóa Phượng 2, 20T2 Đ. Số 7, KDC Thới Nhật, Ninh Kiều, Cần Thơ","KDC Thới Nhật, Ninh Kiều",20T2 Đ. Số 7,Cần Thơ,,"Ninh Kiều, Cần Thơ",VN
284,ChIJrbHL5TWIoDERFGBo8T9n4Q0,Tạp Hóa Bạch Nguyệt,Cửa hàng bách hóa,0292 3838 787,"Tạp Hóa Bạch Nguyệt, 102/4 Đ. 3 Tháng 2, Hưng Lợi, Ninh Kiều, Cần Thơ","Hưng Lợi, Ninh Kiều",102/4 Đ. 3 Tháng 2,Cần Thơ,,"Ninh Kiều, Cần Thơ",VN
285,ChIJs0Sk_TSIoDERRabsauW1i2U,Cửa Hàng Tạp Hóa Đặng Thị Ngọc Yến,Cửa hàng bách hóa,0937 892 446,"Cửa Hàng Tạp Hóa Đặng Thị Ngọc Yến, 147, Đường 30 Tháng 4, Phường Hưng Lợi, Quận Ninh Kiều, Hưng Lợi, Ninh Kiều, Cần Thơ","Hưng Lợi, Ninh Kiều","147, Đường 30 Tháng 4, Phường Hưng Lợi, Quận Ninh Kiều",Cần Thơ,,"Ninh Kiều, Cần Thơ",VN
286,ChIJWyheTU-IoDERa5GvExmVjcM,Tạp hoá-Giải khát Anh Thy,Cửa hàng tạp hóa,,"Tạp hoá-Giải khát Anh Thy, An Khánh, Ninh Kiều, Cần Thơ","An Khánh, Ninh Kiều",,Cần Thơ,,"Ninh Kiều, Cần Thơ",VN
287,ChIJDQxtfTCIoDER0-nUDMlb-3E,Cửa Hàng Tạp Hóa Bích Ngọc,Cửa hàng bách hóa,0917 114 539,"Cửa Hàng Tạp Hóa Bích Ngọc, 12/27C, Ba Tháng Hai, Phường Hưng Lợi, Quận Ninh Kiều, Thành Phố Cần Thơ, Hưng Lợi, Ninh Kiều, Cần Thơ","Hưng Lợi, Ninh Kiều","12/27C, Ba Tháng Hai, Phường Hưng Lợi, Quận Ninh Kiều, Thành Phố Cần Thơ",Cần Thơ,,"Ninh Kiều, Cần Thơ",VN
288,ChIJ7yyuo12JoDERvmAkaAe6cgQ,Tạp Hoá Cô Uyên,Cửa hàng quần áo,0907 591 553,"Tạp Hoá Cô Uyên, 117 Hẻm 132 Đ. 3 Tháng 2, Hưng Lợi, Ninh Kiều, Cần Thơ","Hưng Lợi, Ninh Kiều",117 Hẻm 132 Đ. 3 Tháng 2,Cần Thơ,,"Ninh Kiều, Cần Thơ",VN
289,ChIJH3MUrzKIoDERqlLNUmN4M_I,Nhà Trọ - Tạp Hóa Huỳnh Hà,Cửa hàng,0292 3839 422,"Nhà Trọ - Tạp Hóa Huỳnh Hà, 202 Tầm Vu, Hưng Lợi, Ninh Kiều, Cần Thơ","Hưng Lợi, Ninh Kiều",202 Tầm Vu,Cần Thơ,,"Ninh Kiều, Cần Thơ",VN
300,ChIJF2uBd8uJoDER-gH8c1THyis,Tạp Hóa Miến,Cửa hàng bách hóa,,"2Q57+PF5 Tạp Hóa Miến, Hẻm 102, Hưng Lợi, Ninh Kiều, Cần Thơ","Hưng Lợi, Ninh Kiều","2Q57+PF5, Hẻm 102",Cần Thơ,,"Ninh Kiều, Cần Thơ",VN
301,ChIJEe7kT7WJoDERKvDLI3jdJEI,Cửa Hàng Tạp Hoá Toàn Tâm,Cửa hàng bách hóa,0292 3838 192,"Cửa Hàng Tạp Hoá Toàn Tâm, 59A, Đường 30/4, Quận Ninh Kiều, Tp Cần Thơ, Hưng Lợi, Ninh Kiều, Cần Thơ","Hưng Lợi, Ninh Kiều","59A, Đường 30/4, Quận Ninh Kiều, Tp Cần Thơ",Cần Thơ,,"Ninh Kiều, Cần Thơ",VN
308,ChIJg8z-k4CJoDERwxwMTT_jDpY,Tạp Hóa Dạ Hưng Thạnh,Cửa hàng bách hóa,0826 288 129,"2Q5C+F6V Tạp Hóa Dạ Hưng Thạnh, Hưng Thành, Cái Răng, Cần Thơ","Hưng Thành, Cái Răng",2Q5C+F6V,Cần Thơ,,"Cái Răng, Cần Thơ",VN
311,ChIJLyiXKoKJoDERF2fIj0u_gZY,Nhà Trọ Tạp Hoá Trạng Nguyên,Cửa hàng tạp hóa,0947 434 542,"Nhà Trọ Tạp Hoá Trạng Nguyên, 29 Đ. 3 Tháng 2, Hưng Lợi, Ninh Kiều, Cần Thơ","Hưng Lợi, Ninh Kiều",29 Đ. 3 Tháng 2,Cần Thơ,,"Ninh Kiều, Cần Thơ",VN
322,ChIJRzXjYTuIoDERr5AMgFXK7ac,Tạp Hóa Hoàng Nhanh,Cửa hàng bách hóa,,"Tạp Hóa Hoàng Nhanh, Xuân Khánh, Ninh Kiều, Cần Thơ","Xuân Khánh, Ninh Kiều",,Cần Thơ,,"Ninh Kiều, Cần Thơ",VN
324,ChIJp4FkzyaIoDERjP1pw5bHvz4,Tạp Hóa Tài Trí,Cửa hàng tạp phẩm,,"2QGH+P6G Tạp Hóa Tài Trí, Đ. Mạc Thiên Tích, Xuân Khánh, Ninh Kiều, Cần Thơ","Xuân Khánh, Ninh Kiều","2QGH+P6G, Đ. Mạc Thiên Tích",Cần Thơ,,"Ninh Kiều, Cần Thơ",VN
326,ChIJ6R4YgSGIoDERTD-Q8GjSTjE,Cửa Hàng Tạp Hóa Cô Vân,Cửa hàng tạp hóa,0292 3835 301,"Cửa Hàng Tạp Hóa Cô Vân, 174 Đ. Nguyễn Việt Hồng, Xuân Khánh, Ninh Kiều, Cần Thơ","Xuân Khánh, Ninh Kiều",174 Đ. Nguyễn Việt Hồng,Cần Thơ,,"Ninh Kiều, Cần Thơ",VN
336,ChIJzR_RVTqIoDER20wVmj7hrPE,Bui Thi Bich Ngoc Grocery Store,Cửa hàng bách hóa,0903 822 447,"Bui Thi Bich Ngoc Grocery Store, 33, Ba Thang Hai Street, Ninh Kieu District, Hưng Lợi, Ninh Kiều, Cần Thơ","Hưng Lợi, Ninh Kiều","33, Ba Thang Hai Street, Ninh Kieu District",Cần Thơ,,"Ninh Kiều, Cần Thơ",VN
339,ChIJcXNZm59ioDERZoVmyv2R858,Cửa Hàng Tạp Hoá Như Ý,Cửa hàng bách hóa,0292 3832 548,"Cửa Hàng Tạp Hoá Như Ý, 8 Đ. Đồng Khởi, Tân An, Ninh Kiều, Cần Thơ","Tân An, Ninh Kiều",8 Đ. Đồng Khởi,Cần Thơ,,"Ninh Kiều, Cần Thơ",VN
340,ChIJYeO4UBxjoDER8iuW08T1wLs,Tạp hóa Tuyết Hương,Cửa hàng tạp phẩm,,"Tạp hóa Tuyết Hương, 1 Đ. Cao Bá Quát, Tân An, Ninh Kiều, Cần Thơ","Tân An, Ninh Kiều",1 Đ. Cao Bá Quát,Cần Thơ,,"Ninh Kiều, Cần Thơ",VN
341,ChIJIdZ-6p1ioDERuLEohIkmylg,Cửa Hàng Tạp Hóa 95,Cửa hàng bách hóa,0292 3821 648,"Cửa Hàng Tạp Hóa 95, 95 Nguyễn Thị Minh Khai, An Lạc, Ninh Kiều, Cần Thơ","An Lạc, Ninh Kiều",95 Nguyễn Thị Minh Khai,Cần Thơ,,"Ninh Kiều, Cần Thơ",VN
342,ChIJP5zwvJ5ioDERT40hopKiUCM,Cửa Hàng Tạp Hóa Cúc,Cửa hàng bách hóa,0939 737 814,"2QHP+4M5 Cửa Hàng Tạp Hóa Cúc, Chợ Tân An, Đường Hai Bà Trưng, Tân An, Ninh Kiều, Cần Thơ","Tân An, Ninh Kiều","2QHP+4M5, Chợ Tân An, Đường Hai Bà Trưng",Cần Thơ,,"Ninh Kiều, Cần Thơ",VN
351,ChIJBfi9DyqHoDERR3ewLHc8a6c,Tạp hóa bảo tâm,Cửa hàng tạp phẩm,,"3Q3G+XWJ Tạp hóa bảo tâm, Cái Khế, Ninh Kiều, Cần Thơ","Cái Khế, Ninh Kiều",3Q3G+XWJ,Cần Thơ,,"Ninh Kiều, Cần Thơ",VN
352,ChIJdVxjHv6HoDERTffwsx7BXEA,Tạp Hóa Dũng,Cửa hàng bách hóa,,"Tạp Hóa Dũng, Cái Khế, Ninh Kiều, Cần Thơ","Cái Khế, Ninh Kiều",,Cần Thơ,,"Ninh Kiều, Cần Thơ",VN
353,ChIJc98sseWHoDERcLzyjBOJy8c,Tiệm Tạp Hóa Số 99,Cửa hàng bách hóa,,"Tiệm Tạp Hóa Số 99, Bùi Hữu Nghĩa, Bình Thủy, Cần Thơ","Bùi Hữu Nghĩa, Bình Thủy",,Cần Thơ,,"Bình Thủy, Cần Thơ",VN
354,ChIJlStDsgWIoDERgcBcF575oXQ,Tiệm Tạp Hóa Vinh Tuyền,Cửa hàng bách hóa,0972 653 654,"Tiệm Tạp Hóa Vinh Tuyền, 42/32d Đ. Trần Việt Châu, Thới Bình, Ninh Kiều, Cần Thơ","Thới Bình, Ninh Kiều",42/32d Đ. Trần Việt Châu,Cần Thơ,,"Ninh Kiều, Cần Thơ",VN
355,ChIJq6qqqq5ioDERK8JHHC36rIU,Cửa Hàng Tạp Hóa Nhẫn Thoa,Cửa hàng bách hóa,0292 3763 411,"Cửa Hàng Tạp Hóa Nhẫn Thoa, Kios 123, Nhà Lồng 3, Trung Tâm Thương Mại Cái Khế, Phường Cái Khế, Quận Ninh Kiều, Thành Phố Cần Thơ, Cái Khế, Ninh Kiều, Cần Thơ","Cái Khế, Ninh Kiều","Kios 123, Nhà Lồng 3, Trung Tâm Thương Mại Cái Khế, Phường Cái Khế, Quận Ninh Kiều, Thành Phố Cần Thơ",Cần Thơ,,"Ninh Kiều, Cần Thơ",VN
356,ChIJJ35diAaIoDERmTKQI4xG8qQ,Cửa Hàng Tạp Hóa Huỳnh Nga,Cửa hàng bách hóa,0292 3893 292,"Cửa Hàng Tạp Hóa Huỳnh Nga, 36 Đ. Trần Việt Châu, An Hoà, Ninh Kiều, Cần Thơ","An Hoà, Ninh Kiều",36 Đ. Trần Việt Châu,Cần Thơ,,"Ninh Kiều, Cần Thơ",VN
357,ChIJbUAJeEV9oDERkDEeCXzpRKo,"Hồng Châu Mua Bán Tạp Hóa, Mỹ Phầm Các Loại",Cửa hàng bách hóa,,"Hồng Châu Mua Bán Tạp Hóa, Mỹ Phầm Các Loại, Cái Vồn, Tx. Bình Minh, Vĩnh Long","Cái Vồn, Thị xã Bình Minh",,Vĩnh Long,,Vĩnh Long,VN
358,ChIJw5YZcwSIoDERkE9wp5XavXI,Cửa Hàng Tạp Hóa Hớn Hưng,Cửa hàng bách hóa,0292 2470 312,"Cửa Hàng Tạp Hóa Hớn Hưng, 24 Đ. Trần Việt Châu, Thới Bình, Ninh Kiều, Cần Thơ","Thới Bình, Ninh Kiều",24 Đ. Trần Việt Châu,Cần Thơ,,"Ninh Kiều, Cần Thơ",VN
359,ChIJMzKPcmuIoDER2_A_Q5VUFQg,Tạp Hóa - Rau Củ Cà Phê Kiều Linh,,,"Tạp Hóa - Rau Củ Cà Phê Kiều Linh, 74 Đường số 23, Phường An Khánh, Ninh Kiều, Cần Thơ","Phường An Khánh, Ninh Kiều",74 Đường số 23,Cần Thơ,,"Ninh Kiều, Cần Thơ",VN
360,ChIJI_SHLWhjoDERItdRYn-ILlw,Tạp Hoá Hồng Thu,Cửa hàng tạp phẩm,,"Tạp Hoá Hồng Thu, 34 Sông Hậu, Cái Khế, Ninh Kiều, Cần Thơ","Cái Khế, Ninh Kiều",34 Sông Hậu,Cần Thơ,,"Ninh Kiều, Cần Thơ",VN
361,ChIJVYcwnOeJoDERWL81zNGPjg4,Tạp Hóa Tùng Chi,Cửa hàng tạp phẩm,,"Tạp Hóa Tùng Chi, 23/110 Hẻm 22 Đ. Mạc Đĩnh Chi, An Cư, Ninh Kiều, Cần Thơ","An Cư, Ninh Kiều",23/110 Hẻm 22 Đ. Mạc Đĩnh Chi,Cần Thơ,,"Ninh Kiều, Cần Thơ",VN
362,ChIJf70bYwKIoDERp_30y-0CNkg,Cửa Hàng Tạp Hóa 59,Cửa hàng bách hóa,0292 3823 153,"Cửa Hàng Tạp Hóa 59, 59 Trần Phú, Thới Bình, Ninh Kiều, Cần Thơ","Thới Bình, Ninh Kiều",59 Trần Phú,Cần Thơ,,"Ninh Kiều, Cần Thơ",VN
363,ChIJUX4QmKBioDERqy7EGl9Xvds,Cửa Hàng Tạp Hóa Nguyễn Xuân Thủy,Cửa hàng bách hóa,0907 814 770,"Cửa Hàng Tạp Hóa Nguyễn Xuân Thủy, 22/23/47B, Đường Mạc Đĩnh Chi, Phường An Cư, Quận Ninh Kiều, Tân An, Ninh Kiều, Cần Thơ","Tân An, Ninh Kiều","22/23/47B, Đường Mạc Đĩnh Chi, Phường An Cư, Quận Ninh Kiều",Cần Thơ,,"Ninh Kiều, Cần Thơ",VN
364,ChIJTbhumaBioDERSOHWFazmxeY,Cửa Hàng Tạp Hóa Thanh,Cửa hàng tạp hóa,,"Cửa Hàng Tạp Hóa Thanh, 21 Hẻm 22 Đ. Mạc Đĩnh Chi, Tân An, Ninh Kiều, Cần Thơ","Tân An, Ninh Kiều",21 Hẻm 22 Đ. Mạc Đĩnh Chi,Cần Thơ,,"Ninh Kiều, Cần Thơ",VN
365,ChIJ8WDSvJ5ioDER_8NbUvSzpk0,Cửa Hàng Tạp Hóa Vĩnh Hưng,Cửa hàng bách hóa,0292 3812 021,"Cửa Hàng Tạp Hóa Vĩnh Hưng, 98 Đường Hai Bà Trưng, Tân An, Ninh Kiều, Cần Thơ","Tân An, Ninh Kiều",98 Đường Hai Bà Trưng,Cần Thơ,,"Ninh Kiều, Cần Thơ",VN
366,ChIJby-_BByIoDERy_DLcZd9xFw,Tạp Hóa Vinh,Cửa hàng bách hóa,,"Tạp Hóa Vinh, 68 Đ. Trần Hưng Đạo, An Cư, Ninh Kiều, Cần Thơ","An Cư, Ninh Kiều",68 Đ. Trần Hưng Đạo,Cần Thơ,,"Ninh Kiều, Cần Thơ",VN
367,ChIJAQlV1aFioDERlSiflt7VA2k,Cửa Hàng Tạp Hóa Ngọc Tiên,Cửa hàng bách hóa,,"Cửa Hàng Tạp Hóa Ngọc Tiên, 69 Võ Văn Tần, Tân An, Ninh Kiều, Cần Thơ","Tân An, Ninh Kiều",69 Võ Văn Tần,Cần Thơ,,"Ninh Kiều, Cần Thơ",VN
368,ChIJu2ZX9a9joDERLDNBSr3h5M4,Tạp Hóa Hiền Tùng,Cửa hàng bách hóa,0327 192 979,"Tạp Hóa Hiền Tùng, 21B/4 Khu Vực 3, Hưng Phú, Cái Răng, Cần Thơ 940009","Hưng Phú, Cái Răng",21B/4 Khu Vực 3,Cần Thơ,940009.0,"Cái Răng, Cần Thơ",VN
369,ChIJAyP7AqJioDERH43REz9ELHE,Cửa Hàng Tạp Hóa Mỹ Lệ,Cửa hàng bách hóa,0292 3810 750,"Cửa Hàng Tạp Hóa Mỹ Lệ, 88 Đường Hai Bà Trưng, Tân An, Ninh Kiều, Cần Thơ","Tân An, Ninh Kiều",88 Đường Hai Bà Trưng,Cần Thơ,,"Ninh Kiều, Cần Thơ",VN
370,ChIJK6PlHaJioDERbPPgGJQUhQc,Cửa Hàng Tạp Hóa Cô Út,Cửa hàng bách hóa,0292 3821 125,"Cửa Hàng Tạp Hóa Cô Út, 1 Đ. Tân Trào, Tân An, Ninh Kiều, Cần Thơ","Tân An, Ninh Kiều",1 Đ. Tân Trào,Cần Thơ,,"Ninh Kiều, Cần Thơ",VN
372,ChIJn_SVMpOJoDER_TsSyLwCoV8,Tạp hóa Đan Thy,Cửa hàng tạp phẩm,0921 206 959,"Tạp hóa Đan Thy, 17Đ Đ. Huỳnh Thúc Kháng, An Nghiệp, Ninh Kiều, Cần Thơ","An Nghiệp, Ninh Kiều",17Đ Đ. Huỳnh Thúc Kháng,Cần Thơ,,"Ninh Kiều, Cần Thơ",VN
373,ChIJVyOemZ5ioDERfRVedXZR2rc,Cửa Hàng Tạp Hóa 203,Cửa hàng bách hóa,,"Cửa Hàng Tạp Hóa 203, 203 Phan Đình Phùng, Tân An, Ninh Kiều, Cần Thơ","Tân An, Ninh Kiều",203 Phan Đình Phùng,Cần Thơ,,"Ninh Kiều, Cần Thơ",VN
374,ChIJr0gVEriJoDERKQNb6kqhEDE,Tạp hóa Hoàng,Cửa hàng tạp phẩm,,"Tạp hóa Hoàng, 69 Đ. Huỳnh Thúc Kháng, An Cư, Ninh Kiều, Cần Thơ","An Cư, Ninh Kiều",69 Đ. Huỳnh Thúc Kháng,Cần Thơ,,"Ninh Kiều, Cần Thơ",VN
375,ChIJSe-pNZ9ioDERA90qjMC1S_k,Cửa Hàng Tạp Hóa Đường Cát,Cửa hàng bách hóa,0292 3828 878,"Cửa Hàng Tạp Hóa Đường Cát, 1 Đường Nguyễn An Ninh, Tân An, Ninh Kiều, Cần Thơ","Tân An, Ninh Kiều",1 Đường Nguyễn An Ninh,Cần Thơ,,"Ninh Kiều, Cần Thơ",VN
376,ChIJ75opIuNjoDERI_oR3-TyfXQ,Tạp hóa Dì Ngân,Cửa hàng tạp phẩm,0909 811 630,"2QHW+WRX Tạp hóa Dì Ngân, Hẻm 3 Tổ 8 Khu Vực I, Hưng Phú, Cái Răng, Cần Thơ","Hưng Phú, Cái Răng","2QHW+WRX, Hẻm 3 Tổ 8 Khu Vực I",Cần Thơ,,"Cái Răng, Cần Thơ",VN
377,ChIJ851gChyIoDERaArPOn2OBE0,Tạp Hóa 45/18,Cửa hàng bách hóa,,"Tạp Hóa 45/18, An Nghiệp, Ninh Kiều, Cần Thơ","An Nghiệp, Ninh Kiều",,Cần Thơ,,"Ninh Kiều, Cần Thơ",VN
378,ChIJAyuRRp9ioDER33Fm0bpEpXA,Cửa Hàng Tạp Hóa Thanh,Cửa hàng bách hóa,0292 3753 832,"Cửa Hàng Tạp Hóa Thanh, 127, Đường Phan Đình Phùng, Quận Ninh Kiều, Tân An, Ninh Kiều, Cần Thơ","Tân An, Ninh Kiều","127, Đường Phan Đình Phùng, Quận Ninh Kiều",Cần Thơ,,"Ninh Kiều, Cần Thơ",VN
379,ChIJxepTn55ioDERZgiX_b-A8Lg,Cửa Hàng Tạp Hóa Lan,Cửa hàng bách hóa,0292 3821 816,"Cửa Hàng Tạp Hóa Lan, 160 Đường Hai Bà Trưng, Tân An, Ninh Kiều, Cần Thơ","Tân An, Ninh Kiều",160 Đường Hai Bà Trưng,Cần Thơ,,"Ninh Kiều, Cần Thơ",VN
380,ChIJuUreoUWJoDERvOnhkiXdHds,Tạp hóa Quí Thư 2,Cửa hàng tiện lợi,0983 113 226,"Tạp hóa Quí Thư 2, 260 Đ. 30 Tháng 4, Xuân Khánh, Ninh Kiều, Cần Thơ","Xuân Khánh, Ninh Kiều",260 Đ. 30 Tháng 4,Cần Thơ,,"Ninh Kiều, Cần Thơ",VN
381,ChIJ11zUq3hjoDERjTcKxoGetf8,Tạp Hóa Cô Hằng,Tiệm bánh,,"Tạp Hóa Cô Hằng, 12 Khu Vực 7, Hưng Phú, Cái Răng, Cần Thơ","Hưng Phú, Cái Răng",12 Khu Vực 7,Cần Thơ,,"Cái Răng, Cần Thơ",VN
382,ChIJ84q-LyCIoDERd2FTMenQSaM,Cửa Hàng Tạp Hóa Quốc Thanh,Cửa hàng bách hóa,0989 804 223,"Cửa Hàng Tạp Hóa Quốc Thanh, 21/17, Đường Đ. Nguyễn Việt Hồng, An Lạc, Ninh Kiều, Cần Thơ","An Lạc, Ninh Kiều","21/17, Đường Đ. Nguyễn Việt Hồng",Cần Thơ,,"Ninh Kiều, Cần Thơ",VN
383,ChIJRRMnlZlioDER2Kkbe5WN24U,Cửa Hàng Tạp Hóa Thanh Xuân,Cửa hàng bách hóa,0913 031 331,"Cửa Hàng Tạp Hóa Thanh Xuân, 149 Khu Vực 2, Hưng Phú, Cái Răng, Cần Thơ","Hưng Phú, Cái Răng",149 Khu Vực 2,Cần Thơ,,"Cái Răng, Cần Thơ",VN
