,place_id,name,main_category,phone,address,address_ward,address_street,address_city,address_postal_code,address_state,address_country_code
0,ChIJr3nUIPerNTERA0alPegek_0,Nabemono Wagyu Hotpot Buffet,Nhà hàng,0971 975 086,"Nabemono Wagyu Hotpot Buffet, 8th Floor, 12-14 P. Nguyễn Quang Bích, Cửa Đông, Hanoi City, Hà Nội 10000","Cửa Đông, Hanoi City","8th Floor, 12-14 P. Nguyễn Quang Bích",Hà Nội,10000.0,"Hanoi City, Hà Nội",VN
2,ChIJU1XFSxMmdTERevjdHHGczJc,D'Maris,Nhà hàng tiệc đứng,1900 0029,"D'Maris, Tầng 6 - Tòa nhà Cantavil Premier, 1 Đ. Song Hành Xa Lộ Hà Nội, P, Thủ Đức, Thành phố Hồ Chí Minh","P, Thủ Đức","Tầng 6 - Tòa nhà Cantavil Premier, 1 Đ. Song Hành Xa Lộ Hà Nội",Thành phố Hồ Chí Minh,,"Thủ Đức, Thành phố Hồ Chí Minh",VN
5,ChIJP1h1FKKsNTERdZ8jAEQ3DGE,Buffet hải sản Poseidon,Nhà hàng tiệc đứng,0906 553 368,"Buffet hải sản Poseidon, Tầng 4, tòa nhà Hà Nội Center Point, số 27 Đ. Lê Văn Lương, Thanh Xuân, Hà Nội","Nhân Chính, Thanh Xuân","Tầng 4, tòa nhà Hà Nội Center Point, số 27 Đ. Lê Văn Lương",Hà Nội,,"Thanh Xuân, Hà Nội",VN
21,ChIJ1V39sGirNTERTICf1-6CYVM,Buffet Chef Dzung,Nhà hàng tiệc đứng,024 6285 9859,"Buffet Chef Dzung, 71 Đ. Nguyễn Chí Thanh, Thành Công, Ba Đình, Hà Nội 100000","Thành Công, Ba Đình",71 Đ. Nguyễn Chí Thanh,Hà Nội,100000.0,"Ba Đình, Hà Nội",VN
37,ChIJB_ItCcEpdTERheR8oH4IizU,Bay Seafood Buffet Hồ Gươm - 14 Tông Đản,Nhà hàng,1900 996620,"Bay Seafood Buffet Hồ Gươm - 14 Tông Đản, 14 P. Tông Đản, Tràng Tiền, Hoàn Kiếm, Hà Nội","Tràng Tiền, Hoàn Kiếm",14 P. Tông Đản,Hà Nội,,"Hoàn Kiếm, Hà Nội",VN
42,ChIJyUzWbXisNTERM1-fdYnzXH0,Lẩu Phan Buffet,Nhà hàng món lẩu,1900 2808,"Lẩu Phan Buffet, 7 P. Đào Duy Anh, Phương Mai, Đống Đa, Hà Nội 100000","Phương Mai, Đống Đa",7 P. Đào Duy Anh,Hà Nội,100000.0,"Đống Đa, Hà Nội",VN
58,ChIJ_8O8qlyrNTERfGObf4CXnFI,Buffet Hải Sản Cửu Vân Long,Nhà hàng hải sản,0779 345 889,"Buffet Hải Sản Cửu Vân Long, Tầng 6, toà Discovery Complex, 302, Cầu Giấy, Hà Nội","Dịch Vọng, Cầu Giấy","Tầng 6, toà Discovery Complex, 302",Hà Nội,,"Cầu Giấy, Hà Nội",VN
63,ChIJUS0pM3irNTERZJjAulhNZjg,Mr Mlem Cơ sở 2 - Buffet Bò Nầm Nướng,Nhà hàng món nướng,0949 922 909,"Mr Mlem Cơ sở 2 - Buffet Bò Nầm Nướng, 65 P. Ô Chợ Dừa, Chợ Dừa, Đống Đa, Hà Nội 100000","Chợ Dừa, Đống Đa",65 P. Ô Chợ Dừa,Hà Nội,100000.0,"Đống Đa, Hà Nội",VN
79,ChIJ12C1GGSrNTERtEO1B_ZGqUI,Nhà Hàng Buffet Chay Tịnh Thực Quán,Nhà hàng cho người ăn chay,0986 612 893,"Nhà Hàng Buffet Chay Tịnh Thực Quán, 10 P. Huỳnh Thúc Kháng, Đống Đa, Ba Đình, Hà Nội 10000","Đống Đa, Ba Đình",10 P. Huỳnh Thúc Kháng,Hà Nội,10000.0,"Ba Đình, Hà Nội",VN
88,ChIJt8ZhemStNTERLvXU6cr268M,Lẩu Wang Vua Buffet Lẩu,Nhà hàng tiệc đứng,1900 0081,"Lẩu Wang Vua Buffet Lẩu, 134 P. Trần Đại Nghĩa, Đồng Tâm, Hai Bà Trưng, Hà Nội 100000","Đồng Tâm, Hai Bà Trưng",134 P. Trần Đại Nghĩa,Hà Nội,100000.0,"Hai Bà Trưng, Hà Nội",VN
104,ChIJdQKplO-rNTERBFiJTs6vKU4,WuLong - Taiwanese Hotpot Buffet,Nhà hàng Đài Loan,0858 247 666,"WuLong - Taiwanese Hotpot Buffet, 126 Đ. Nguyễn Khánh Toàn, Quan Hoa, Cầu Giấy, Hà Nội 100000","Quan Hoa, Cầu Giấy",126 Đ. Nguyễn Khánh Toàn,Hà Nội,100000.0,"Cầu Giấy, Hà Nội",VN
113,ChIJE05BcHirNTERwhIWD5rni7w,Yukssam BBQ Buffet,Nhà hàng món nướng Hàn Quốc,024 3232 3222,"Yukssam BBQ Buffet, 43 P. Ô Chợ Dừa, Chợ Dừa, Đống Đa, Hà Nội","Chợ Dừa, Đống Đa",43 P. Ô Chợ Dừa,Hà Nội,,"Đống Đa, Hà Nội",VN
129,ChIJ-zt3A7qrNTEROigfUU34d0U,Lẩu Hơi - Lẩu Nướng Safodi,Nhà hàng,0886 001 002,"Lẩu Hơi - Lẩu Nướng Safodi, 273 P. Tô Hiệu, Dịch Vọng, Cầu Giấy, Hà Nội","Dịch Vọng, Cầu Giấy",273 P. Tô Hiệu,Hà Nội,,"Cầu Giấy, Hà Nội",VN
141,ChIJlcL-0M-tNTERMzpyRBItxSc,Chef Dzung Buffet Nguyễn Tuân,Nhà hàng tiệc đứng,024 3664 6222,"Chef Dzung Buffet Nguyễn Tuân, 47 Đ. Nguyễn Tuân, Thanh Xuân Trung, Thanh Xuân, Hà Nội 100000","Thanh Xuân Trung, Thanh Xuân",47 Đ. Nguyễn Tuân,Hà Nội,100000.0,"Thanh Xuân, Hà Nội",VN
157,ChIJY0NQRUcvdTERSjHLrQ4UE3E,Hoang Yen Buffet Premier,Nhà hàng tiệc đứng,028 6681 1006,"Hoang Yen Buffet Premier, Saigon Centre, 65 Đ. Lê Lợi, Bến Nghé, Quận 1, Thành phố Hồ Chí Minh 720000","Bến Nghé, Quận 1","Saigon Centre, 65 Đ. Lê Lợi",Thành phố Hồ Chí Minh,720000.0,"Quận 1, Thành phố Hồ Chí Minh",VN
170,ChIJ8XawnRqtNTERA9e5SFDvY1w,Buffet Hải Sản Cửu Vân Long Thái Hà,Nhà hàng hải sản,0779 345 889,"Buffet Hải Sản Cửu Vân Long Thái Hà, Tầng L, Toà Viet Tower, Số 1 P. Thái Hà, Đống Đa, Hà Nội","Trung Liệt, Đống Đa","Tầng L, Toà Viet Tower, Số 1 P. Thái Hà",Hà Nội,,"Đống Đa, Hà Nội",VN
175,ChIJfQpivD0vdTERgcpb5Rhbzwg,Kichi Lotte Mart Mậu Thân,Nhà hàng,0292 7300 337,"Kichi Lotte Mart Mậu Thân, TTTM Lotte Mart, LÔ 1F31, 84 Đ. Mậu Thân, An Hoà, Ninh Kiều, Cần Thơ 90000","An Hoà, Ninh Kiều","TTTM Lotte Mart, LÔ 1F31, 84 Đ. Mậu Thân",Cần Thơ,90000.0,"Ninh Kiều, Cần Thơ",VN
183,ChIJjem7Z4itNTERG4B_t0vfZnA,Buffet Poseidon Royal,Nhà hàng tiệc đứng,0967 088 288,"Buffet Poseidon Royal, Lô B2 - R4 - 18 tầng B2 TTTM, 72A Nguyễn Trãi, Khu đô thị Royal City, Thanh Xuân, Hà Nội","Khu đô thị Royal City, Thanh Xuân","Lô B2 - R4 - 18 tầng B2 TTTM, 72A Nguyễn Trãi",Hà Nội,,"Thanh Xuân, Hà Nội",VN
199,ChIJoRlwyiWIoDER5fQqcLWmETQ,Nhà Hàng Grill & Cheer Cần Thơ,Nhà hàng,0292 3732 233,"Nhà Hàng Grill & Cheer Cần Thơ, Vincom Plaza, 209 Đ. 30 Tháng 4, Xuân Khánh, Ninh Kiều, Cần Thơ","Xuân Khánh, Ninh Kiều","Vincom Plaza, 209 Đ. 30 Tháng 4",Cần Thơ,,"Ninh Kiều, Cần Thơ",VN
215,ChIJhY4Kre0pdTERK3qATef7xcc,GALBI HOUSE,Nhà hàng món nướng Hàn Quốc,028 3842 6779,"GALBI HOUSE, 4 Hoàng Hoa Thám, Phường 12, Tân Bình, Thành phố Hồ Chí Minh","Phường 12, Tân Bình",4 Hoàng Hoa Thám,Thành phố Hồ Chí Minh,,"Tân Bình, Thành phố Hồ Chí Minh",VN
216,ChIJedr_6aOsNTERSJd_eOtXaDU,Buffet Hải Sản Cửu Vân Long,Nhà hàng hải sản,1900 996610,"Buffet Hải Sản Cửu Vân Long, ĐT 43, Khu đô thị Times City, Hai Bà Trưng, Hà Nội 10000","Khu đô thị Times City, Hai Bà Trưng",ĐT 43,Hà Nội,10000.0,"Hai Bà Trưng, Hà Nội",VN
225,ChIJpyvTX6-tNTERcwyMF-4zP_8,Buffet Poseidon TTTM Times City,Nhà hàng,0867 108 066,"Buffet Poseidon TTTM Times City, Tầng hầm B1, TTTM, 458 P. Minh Khai, Khu đô thị Times City, Hai Bà Trưng, Hà Nội","Khu đô thị Times City, Hai Bà Trưng","Tầng hầm B1, TTTM, 458 P. Minh Khai",Hà Nội,,"Hai Bà Trưng, Hà Nội",VN
241,ChIJHeVcLhurNTERnN9jw5kDbXA,Set Buffet,Nhà hàng Việt Nam,0963 766 858,"Set Buffet, 34 P. Đông Quan, Nghĩa Đô, Cầu Giấy, Hà Nội","Nghĩa Đô, Cầu Giấy",34 P. Đông Quan,Hà Nội,,"Cầu Giấy, Hà Nội",VN
251,ChIJN0SHqsurNTERx_hwDzGavik,Koifood Buffet Lẩu Nướng 57 Láng Hạ,Nhà hàng,0583 889 333,"Koifood Buffet Lẩu Nướng 57 Láng Hạ, 25 Ngõ 57 Láng Hạ, Chợ Dừa, Ba Đình, Hà Nội","Chợ Dừa, Ba Đình",25 Ngõ 57 Láng Hạ,Hà Nội,,"Ba Đình, Hà Nội",VN
260,ChIJ3dvH9kBTNDERpXFCbhwHx2U,D'Maris Buffet Tây Mỗ,Nhà hàng tiệc đứng,1900 3488,"D'Maris Buffet Tây Mỗ, Tầng 3 Vincom Megamall Smart City, Tây Mỗ, Từ Liêm, Hà Nội","Tây Mỗ, Từ Liêm",Tầng 3 Vincom Megamall Smart City,Hà Nội,,"Từ Liêm, Hà Nội",VN
276,ChIJd9riu6FioDERpgGYPmuGDng,King BBQ Buffet Sense City Cần Thơ,Nhà hàng món nướng Hàn Quốc,0292 7305 939,"King BBQ Buffet Sense City Cần Thơ, Tầng 2, TTTM Sense City, 1A Đại lộ Hoà Bình, Tân An, Ninh Kiều, Cần Thơ","Tân An, Ninh Kiều","Tầng 2, TTTM Sense City, 1A Đại lộ Hoà Bình",Cần Thơ,,"Ninh Kiều, Cần Thơ",VN
292,ChIJadHESywpdTERUKOzroWy6AE,Vườn Nướng Hàn Quốc Buffet,Nhà hàng,0862 616 279,"Vườn Nướng Hàn Quốc Buffet, 1212 Đ. Lê Đức Thọ, Phường 13, Gò Vấp, Thành phố Hồ Chí Minh 700000","Phường 13, Gò Vấp",1212 Đ. Lê Đức Thọ,Thành phố Hồ Chí Minh,700000.0,"Gò Vấp, Thành phố Hồ Chí Minh",VN
299,ChIJPWlvOtWtNTERggoW8mz9dAA,LẨU ĐỨC TRỌC 728 TRƯƠNG ĐỊNH,Nhà hàng món lẩu,0941 409 999,"LẨU ĐỨC TRỌC 728 TRƯƠNG ĐỊNH, 728 Trương Định, Giáp Bát, Hai Bà Trưng, Hà Nội","Giáp Bát, Hai Bà Trưng",728 Trương Định,Hà Nội,,"Hai Bà Trưng, Hà Nội",VN
322,ChIJLURFMbitNTERCVK4YOeyLwA,Nhà hàng Buffet Lẩu nướng Toọng Quán Lĩnh Nam,Nhà hàng,0986 486 446,"Nhà hàng Buffet Lẩu nướng Toọng Quán Lĩnh Nam, Đối diện 183, Đ. Lĩnh Nam, Vĩnh Hưng, Hai Bà Trưng, Hà Nội","Vĩnh Hưng, Hai Bà Trưng","Đối diện 183, Đ. Lĩnh Nam",Hà Nội,,"Hai Bà Trưng, Hà Nội",VN
338,ChIJVVX2mgSsNTERg-e0QH_voqk,King BBQ Buffet Time City,Nhà hàng món nướng Hàn Quốc,024 3824 6565,"King BBQ Buffet Time City, 458 P. Minh Khai, Khu đô thị Times City, Hai Bà Trưng, Hà Nội 100000","Khu đô thị Times City, Hai Bà Trưng",458 P. Minh Khai,Hà Nội,100000.0,"Hai Bà Trưng, Hà Nội",VN
354,ChIJ9dM7SQGsNTERtjlQfOFjBHY,Nhà hàng Buffet Sen Việt,Nhà hàng tiệc đứng,0977 863 276,"Nhà hàng Buffet Sen Việt, A25 Luxury Hotel, 684 P. Minh Khai, Vĩnh Phú, Hai Bà Trưng, Hà Nội","Vĩnh Phú, Hai Bà Trưng","A25 Luxury Hotel, 684 P. Minh Khai",Hà Nội,,"Hai Bà Trưng, Hà Nội",VN
355,ChIJtfP296CtNTERc7o_KZvUJIE,Khang Buffet,Món nướng,0986 101 730,"Khang Buffet, 70 P. Nguyên Khiết, Phúc Tân, Hoàn Kiếm, Hà Nội","Phúc Tân, Hoàn Kiếm",70 P. Nguyên Khiết,Hà Nội,,"Hoàn Kiếm, Hà Nội",VN
371,ChIJKz1aKZCrNTERBQscQIBFtgE,Nhà hàng Sen Nam Thanh,Nhà hàng tiệc đứng,024 3822 3750,"Nhà hàng Sen Nam Thanh, 84B P. Nguyễn Du, Trần Hưng Đạo, Hoàn Kiếm, Hà Nội","Trần Hưng Đạo, Hoàn Kiếm",84B P. Nguyễn Du,Hà Nội,,"Hoàn Kiếm, Hà Nội",VN
378,ChIJ28TDn0OrNTERM3WIMtQYIzU,Seon - đồ ăn hàn quốc và buffet lẩu số 1,Nhà hàng tiệc đứng,0846 016 666,"Seon - đồ ăn hàn quốc và buffet lẩu số 1, 812 Ngõ 57 Láng Hạ, Chợ Dừa, Hoàn Kiếm, Hà Nội","Chợ Dừa, Hoàn Kiếm",812 Ngõ 57 Láng Hạ,Hà Nội,,"Hoàn Kiếm, Hà Nội",VN
394,ChIJK31BsXOtNTERPIfIO5qmJLM,Sala Buffet - 135 Lương Định Của,Nhà hàng,0888 113 355,"Sala Buffet - 135 Lương Định Của, 135 P. Lương Định Của, Kim Liên, Đống Đa, Hà Nội 100000","Kim Liên, Đống Đa",135 P. Lương Định Của,Hà Nội,100000.0,"Đống Đa, Hà Nội",VN
410,ChIJT1WFb6VjoDERDaofgHMnEsw,Aka House Sense City Cần Thơ,Nhà hàng,0292 7300 779,"Aka House Sense City Cần Thơ, 1 Đại lộ Hoà Bình Lầu 2, TTTM Sense City, Ninh Kiều","Tân An, Ninh Kiều","1 Đại lộ Hoà Bình Lầu 2, TTTM Sense City",Cần Thơ,,"Ninh Kiều, Cần Thơ",VN
414,ChIJ34N-8D2tNTERd9lLc5z_hhg,Buffet chay Tâm Bình,Nhà hàng ăn chay,0984 832 086,"Buffet chay Tâm Bình, B33 Ng. 70 P. Nguyễn Thị Định, Trung Hoà, Cầu Giấy, Hà Nội 11415","Trung Hoà, Cầu Giấy",B33 Ng. 70 P. Nguyễn Thị Định,Hà Nội,11415.0,"Cầu Giấy, Hà Nội",VN
423,ChIJORbk-IaJoDERH4t5k56gJ9g,BUFFET LẨU & NƯỚNG SOOWON CẦN THƠ,Nhà hàng món nướng,0776 891 889,"BUFFET LẨU & NƯỚNG SOOWON CẦN THƠ, 127/4b Võ Văn Kiệt, An Hoà, Ninh Kiều, Cần Thơ","An Hoà, Ninh Kiều",127/4b Võ Văn Kiệt,Cần Thơ,,"Ninh Kiều, Cần Thơ",VN
439,ChIJq_qFWTqbzDYRi5ZKmjhbBtk,Nhà Hàng Kỳ Ẩm Buffet Lẩu,Nhà hàng tiệc đứng,0823 882 268,"Nhà Hàng Kỳ Ẩm Buffet Lẩu, 915 Đ. Hồng Hà, Chương Dương, Hoàn Kiếm, Hà Nội 100000","Chương Dương, Hoàn Kiếm",915 Đ. Hồng Hà,Hà Nội,100000.0,"Hoàn Kiếm, Hà Nội",VN
455,ChIJTZErPzWrNTERC_iPDYgWIcs,Bay Seafood Buffet Cát Linh,Nhà hàng Việt Nam,024 6252 5577,"Bay Seafood Buffet Cát Linh, tòa nhà NHS Center, 214 P. Hào Nam, Chợ Dừa, Đống Đa, Hà Nội","Chợ Dừa, Đống Đa","tòa nhà NHS Center, 214 P. Hào Nam",Hà Nội,,"Đống Đa, Hà Nội",VN
460,ChIJjz-I1xirNTERLL-_OWRAXq0,Nhà Hàng Buffet - An Chay,Nhà hàng cho người ăn chay,0969 952 489,"Nhà Hàng Buffet - An Chay, 122 Ng. 20A Núi Trúc, Khu tập thể Giảng Võ, Ba Đình, Hà Nội","Khu tập thể Giảng Võ, Ba Đình",122 Ng. 20A Núi Trúc,Hà Nội,,"Ba Đình, Hà Nội",VN
466,ChIJSaxnlaatNTERh_uO5QSa7gU,Kingkong Buffet 108e3,Nhà hàng món lẩu,0972 527 176,"Kingkong Buffet 108e3, 108e3 P. Lê Thanh Nghị, Khu tập thể Bách Khoa, Hai Bà Trưng, Hà Nội","Khu tập thể Bách Khoa, Hai Bà Trưng",108e3 P. Lê Thanh Nghị,Hà Nội,,"Hai Bà Trưng, Hà Nội",VN
467,ChIJifgQvm-rNTERJysfwSETqVE,Lẩu Wang - Vua Buffet Lẩu - Số 32 Võ Thị Sáu,Nhà hàng,1900 0081,"Lẩu Wang - Vua Buffet Lẩu - Số 32 Võ Thị Sáu, 32 P. Võ Thị Sáu, Thanh Nhàn, Hai Bà Trưng, Hà Nội 100000","Thanh Nhàn, Hai Bà Trưng",32 P. Võ Thị Sáu,Hà Nội,100000.0,"Hai Bà Trưng, Hà Nội",VN
498,ChIJCbRsgpStNTERDilAqZvlfgM,Buffet Lẩu Nướng SAFODI 315 Vũ Tông Phan,Nhà hàng,0889 354 488,"Buffet Lẩu Nướng SAFODI 315 Vũ Tông Phan, 315 P. Vũ Tông Phan, Khương Đình, Thanh Xuân, Hà Nội 10000","Khương Đình, Thanh Xuân",315 P. Vũ Tông Phan,Hà Nội,10000.0,"Thanh Xuân, Hà Nội",VN
514,ChIJsaVnQaetNTERNkQpcgwwLMo,Ăndeee Buffet - 176 Định Công,Nhà hàng,0346 968 188,"Ăndeee Buffet - 176 Định Công, 176 P. Định Công, Phương Liệt, Hoàng Mai, Hà Nội 100000","Phương Liệt, Hoàng Mai",176 P. Định Công,Hà Nội,100000.0,"Hoàng Mai, Hà Nội",VN
530,ChIJO8IfDW-tNTERdjZ6QUQvwxQ,Buffet Chay Bạch Liên Hoa,Nhà hàng cho người ăn chay,0782 371 499,"Buffet Chay Bạch Liên Hoa, 412 P. Tây Sơn, P, Đống Đa, Hà Nội 10000","P, Đống Đa",412 P. Tây Sơn,Hà Nội,10000.0,"Đống Đa, Hà Nội",VN
539,ChIJFfQ7OBatNTER2jyxG-Dl2vQ,Tâm Quán Buffet Lẩu,Nhà hàng tiệc đứng,0941 111 808,"Tâm Quán Buffet Lẩu, 36 P. Láng Hạ, Láng Hạ, Đống Đa, Hà Nội","Láng Hạ, Đống Đa",36 P. Láng Hạ,Hà Nội,,"Đống Đa, Hà Nội",VN
555,ChIJTZ8PlB2JoDERxwTW_wyKjp0,iSushi Vincom Xuân Khánh Cần Thơ,Nhà hàng,0292 7300 029,"iSushi Vincom Xuân Khánh Cần Thơ, TTTM Vincom Plaza, 209 Đ. 30/4, Xuân Khánh, Ninh Kiều, Cần Thơ 94000","Xuân Khánh, Ninh Kiều","TTTM Vincom Plaza, 209 Đ. 30/4",Cần Thơ,94000.0,"Ninh Kiều, Cần Thơ",VN
566,ChIJk08_Y96tNTERyBLLDM9bSDU,TÍT MÍT BBQ - BUFFET LẨU NƯỚNG,Nhà hàng món nướng,0982 412 551,"TÍT MÍT BBQ - BUFFET LẨU NƯỚNG, 78 Trương Định, Hai Bà Trưng, Hà Nội","Trương Định, Hai Bà Trưng",78 Trương Định,Hà Nội,,"Hai Bà Trưng, Hà Nội",VN
582,ChIJ61RAjnmtNTERKxthwRpkHHw,DK Buffet Lẩu Nướng,Nhà hàng,0399 150 123,"DK Buffet Lẩu Nướng, 36 Đ. Láng, Thịnh Quang, Đống Đa, Hà Nội","Thịnh Quang, Đống Đa",36 Đ. Láng,Hà Nội,,"Đống Đa, Hà Nội",VN
598,ChIJmd8z6SqrNTER5MWZvgL-r3Y,Kowloon Corner - Buffet Lẩu & Dimsum,Nhà hàng,0865 658 068,"Kowloon Corner - Buffet Lẩu & Dimsum, 41 P. Đoàn Thị Điểm, Quốc Tử Giám, Đống Đa, Hà Nội","Quốc Tử Giám, Đống Đa",41 P. Đoàn Thị Điểm,Hà Nội,,"Đống Đa, Hà Nội",VN
599,ChIJyU_u8KmrNTERI0dm9E6kvJI,Bồng Bềnh Buffet Chay,Nhà hàng cho người ăn chay,0981 629 496,"Bồng Bềnh Buffet Chay, 210 P. Xã Đàn, Phương Liên, Đống Đa, Hà Nội","Phương Liên, Đống Đa",210 P. Xã Đàn,Hà Nội,,"Đống Đa, Hà Nội",VN
623,ChIJmyej47-rNTERrpmzEW8X_DI,Moon Buffet Nem nướng Nha Trang 54 Chùa Láng,Nhà hàng,0899 590 555,"Moon Buffet Nem nướng Nha Trang 54 Chùa Láng, 54 P. Chùa Láng, Láng Thượng, Đống Đa, Hà Nội 100000","Láng Thượng, Đống Đa",54 P. Chùa Láng,Hà Nội,100000.0,"Đống Đa, Hà Nội",VN
624,ChIJXc1zpRSpNTERq4vKA3c2w2Y,Nhật Hạnh buffet nướng chảo gang - 139k,Nhà hàng món nướng,0969 352 969,"Nhật Hạnh buffet nướng chảo gang - 139k, 23 Thạch Cầu, Long Biên, Hà Nội",Long Biên,23 Thạch Cầu,Hà Nội,,"Long Biên, Hà Nội",VN
640,ChIJkxeITkGrNTERXfwB6QA5IvM,KANGCHANG BUFFET NƯỚNG LẨU,Nhà hàng,0972 296 198,"KANGCHANG BUFFET NƯỚNG LẨU, 100 P. Ô Chợ Dừa, Chợ Dừa, Đống Đa, Hà Nội 100000","Chợ Dừa, Đống Đa",100 P. Ô Chợ Dừa,Hà Nội,100000.0,"Đống Đa, Hà Nội",VN
656,ChIJXVo9ajarNTERGd03AQ_Q7sI,Buffet Nướng 1983,Nhà hàng châu Á,0943 967 806,"Buffet Nướng 1983, 17 P. Quán Thánh, Quán Thánh, Ba Đình, Hà Nội","Quán Thánh, Ba Đình",17 P. Quán Thánh,Hà Nội,,"Ba Đình, Hà Nội",VN
672,ChIJibbpdSyrNTERZieeB9vsNhk,Buffet Thành Đạt,Nhà hàng,0949 961 982,"Buffet Thành Đạt, 16 Ng. 366 Đ. Ngọc Lâm, Ngọc Lâm, Long Biên, Hà Nội","Ngọc Lâm, Long Biên",16 Ng. 366 Đ. Ngọc Lâm,Hà Nội,,"Long Biên, Hà Nội",VN
688,ChIJyTkeWT2JoDER5nIh9YpJG9o,SAWADI BUFFET THÁI - HẢI SẢN ĂN THẢ GA KHÔNG LO VỀ GIÁ VÀ CHẤT LƯỢNG,Nhà hàng Thái Lan,0824 124 430,"Cần Thơ, Ninh Kiều, Hưng Lợi, Hẻm 107 Đ. 3 Tháng 2, SAWADI BUFFET THÁI - HẢI SẢN ĂN THẢ GA KHÔNG LO VỀ GIÁ VÀ CHẤT LƯỢNG","Hưng Lợi, Ninh Kiều","2Q86+MJG, Hẻm 107 Đ. 3 Tháng 2",Cần Thơ,,"Ninh Kiều, Cần Thơ",VN
689,ChIJFYtwkJ-sNTERvYpf_0e7z58,Nhà hàng Bay Buffet,Nhà hàng tiệc đứng,0868 846 868,"Nhà hàng Bay Buffet, 48 P. Tố Hữu, Trung Văn, Nam Từ Liêm, Hà Nội 10000","Trung Văn, Nam Từ Liêm",48 P. Tố Hữu,Hà Nội,10000.0,"Nam Từ Liêm, Hà Nội",VN
694,ChIJSQjKPZ8vdTERARJ5HBYQI7w,D'Maris Buffet - CN Lotte Mart Quận 7,Nhà hàng tiệc đứng,1900 0036,"D'Maris Buffet - CN Lotte Mart Quận 7, Lotte Mart, Tầng 3 - Tòa, 469 Đ. Nguyễn Hữu Thọ, Tân Hưng, Quận 7, Thành phố Hồ Chí Minh","Tân Hưng, Quận 7","Lotte Mart, Tầng 3 - Tòa, 469 Đ. Nguyễn Hữu Thọ",Thành phố Hồ Chí Minh,,"Quận 7, Thành phố Hồ Chí Minh",VN
695,ChIJD4Fg0KyHoDERB_a2HMCH1L4,Chuỗi Buffet Lẩu và Nướng Cô 3 Còi_ Cần Thơ,Nhà hàng,0903 922 311,"Chuỗi Buffet Lẩu và Nướng Cô 3 Còi_ Cần Thơ, 44-46 Đ. Nguyễn Văn Cừ, Cái Khế, Ninh Kiều, Cần Thơ","Cái Khế, Ninh Kiều",44-46 Đ. Nguyễn Văn Cừ,Cần Thơ,,"Ninh Kiều, Cần Thơ",VN
711,ChIJ1x8GQ4KrNTERxgLkyOyFQNg,Buffet Chay Hương Thiền,Nhà hàng,0961 577 799,"Buffet Chay Hương Thiền, cách mặt đường, 261 P. Xã Đàn, Nam Đồng, Đống Đa, Hà Nội 10000","Nam Đồng, Đống Đa","cách mặt đường, 261 P. Xã Đàn",Hà Nội,10000.0,"Đống Đa, Hà Nội",VN
716,ChIJgSZ3wAaIoDER06tEms_WdGw,Buffet Hải Sản Biển Đông,Nhà hàng,0911 120 088,"Buffet Hải Sản Biển Đông, 100 Đ. Cách Mạng Tháng 8, Cái Khế, Ninh Kiều, Cần Thơ","Cái Khế, Ninh Kiều",100 Đ. Cách Mạng Tháng 8,Cần Thơ,,"Ninh Kiều, Cần Thơ",VN
730,ChIJf87yUAeIoDERuqMrLAnDs3k,Bamboo Buffet,Nhà hàng,0902 255 116,"Bamboo Buffet, Cầu Cồn Khương, Cái Khế, Ninh Kiều, Cần Thơ","Cái Khế, Ninh Kiều",Cầu Cồn Khương,Cần Thơ,,"Ninh Kiều, Cần Thơ",VN
746,ChIJZSTVe9hVNDERmZHcwEUKl54,Adobi Buffet,Nhà hàng tiệc đứng,1900 9025,"Adobi Buffet, nhà Golden Field, Tầng 3, Tòa, số, 24 P. Nguyễn Cơ Thạch, Mỹ Đình, Nam Từ Liêm, Hà Nội 10000","Mỹ Đình, Nam Từ Liêm","nhà Golden Field, Tầng 3, Tòa, số, 24 P. Nguyễn Cơ Thạch",Hà Nội,10000.0,"Nam Từ Liêm, Hà Nội",VN
762,ChIJ-R0Iqe4vdTERVmDsU1M90bs,TAKA BBQ,Nhà hàng món nướng Hàn Quốc,028 6680 1769,"TAKA BBQ, 327 Đ. Nguyễn Tri Phương, Phường 5, Quận 10, Thành phố Hồ Chí Minh","Phường 5, Quận 10",327 Đ. Nguyễn Tri Phương,Thành phố Hồ Chí Minh,,"Quận 10, Thành phố Hồ Chí Minh",VN
775,ChIJh8szE7yrNTERq9bkqfAjj4Y,Fullboat - Buffet hải sản cao cấp,Nhà hàng,0889 496 633,"Fullboat - Buffet hải sản cao cấp, 75 Nguyễn Đình Chiểu, 31 Vân Hồ 2, Hanoi City, Hà Nội 100000","Lê Đại Hành, Hanoi City","75 Nguyễn Đình Chiểu, 31 Vân Hồ 2",Hà Nội,100000.0,"Hanoi City, Hà Nội",VN
784,ChIJI39YS62tNTER7nTpjufLbCE,Sinry BBQ - Buffet Nướng Lẩu ̃̃̃̃̃& Buffet Gà,Nhà hàng món nướng Hàn Quốc,0986 337 168,"Sinry BBQ - Buffet Nướng Lẩu ̃̃̃̃̃& Buffet Gà, số 53, B11 Pandora, P. Triều Khúc, Thanh Xuân Nam, Hà nội, Hà Nội","Thanh Xuân Nam, Hà nội","số 53, B11 Pandora, P. Triều Khúc",Hà Nội,,"Hà nội, Hà Nội",VN
800,ChIJwTEB5TsndTERvkwLl4OH24M,BUFFET PHỐ BIỂN 179K,Nhà hàng,0899 913 789,"BUFFET PHỐ BIỂN 179K, 1134 Phạm Văn Đồng, Linh Đông, Thành Phố Thủ Đức, Thành phố Hồ Chí Minh 700000","Linh Đông, Thành Phố Thủ Đức",1134 Phạm Văn Đồng,Thành phố Hồ Chí Minh,700000.0,"Thành Phố Thủ Đức, Thành phố Hồ Chí Minh",VN
813,ChIJV9rXshOrNTERIODUH53jJ08,Mr Mlem- Buffet Bò Nầm Nướng 1,Nhà hàng món nướng,0949 922 909,"Mr Mlem- Buffet Bò Nầm Nướng 1, 34 P. Trần Hữu Tước, Nam Đồng, Đống Đa, Hà Nội","Nam Đồng, Đống Đa",34 P. Trần Hữu Tước,Hà Nội,,"Đống Đa, Hà Nội",VN
829,ChIJq6r29H2rNTERjQrSsTggtTA,Buffet Lẩu Nướng,Nhà hàng món lẩu,0918 665 657,"Buffet Lẩu Nướng, số 75 ngõ 173, Ngõ 11 P. Thái Hà, Trung Liệt, Đống Đa, Hà Nội","Trung Liệt, Đống Đa","số 75 ngõ 173, Ngõ 11 P. Thái Hà",Hà Nội,,"Đống Đa, Hà Nội",VN
845,ChIJXxsG5FCIoDERufnK8ejoyFI,Buffet Hải Sản 109,Nhà hàng,0939 050 409,"Buffet Hải Sản 109, 389AA, Ninh Kiều, Cần Thơ","An Bình, Ninh Kiều",389AA,Cần Thơ,,"Ninh Kiều, Cần Thơ",VN
846,ChIJtc2e_vGrNTER99cYgAh0fN0,Nhà Hàng Buffet Việt,Nhà hàng tiệc đứng,,"Nhà Hàng Buffet Việt, 1 P. Tăng Bạt Hổ, Phạm Đình Hổ, Hai Bà Trưng, Hà Nội","Phạm Đình Hổ, Hai Bà Trưng",1 P. Tăng Bạt Hổ,Hà Nội,,"Hai Bà Trưng, Hà Nội",VN
862,ChIJjUHxcK9ioDERcBGIm_83uws,Buffet lẩu nướng 119,Nhà hàng,,"Buffet lẩu nướng 119, 70 Lê Lợi, Cái Khế, Ninh Kiều, Cần Thơ","Cái Khế, Ninh Kiều",70 Lê Lợi,Cần Thơ,,"Ninh Kiều, Cần Thơ",VN
863,ChIJ4dAP-bdzCjER-cSG8Rlmu1Q,Buffet Tí Đen lẩu và nướng,Nhà hàng gia đình,,"9CJP+PGX Buffet Tí Đen lẩu và nướng, Lê Văn Nhung, P. Mỹ Bình, Thành phố Long Xuyên, An Giang","P. Mỹ Bình, Thành phố Long Xuyên","9CJP+PGX, Lê Văn Nhung",An Giang,,"Thành phố Long Xuyên, An Giang",VN
869,ChIJ9ZQ1mkurNTEReI-AQWixCqY,PHƯỚC HẠNH VEGAN - Buffet lẩu chay,Nhà hàng món chay,0972 564 768,"PHƯỚC HẠNH VEGAN - Buffet lẩu chay, 1 Ng. 10 Đ. Nguyễn Văn Huyên, Dịch Vọng, Cầu Giấy, Hà Nội","Dịch Vọng, Cầu Giấy",1 Ng. 10 Đ. Nguyễn Văn Huyên,Hà Nội,,"Cầu Giấy, Hà Nội",VN
875,ChIJqfg51nqrNTERNX2d0z_vTDI,Lẩu Buffet Yang,Nhà hàng món lẩu,0355 467 102,"Lẩu Buffet Yang, 2 P. Láng Hạ, Thành Công, Ba Đình, Hà Nội","Thành Công, Ba Đình",2 P. Láng Hạ,Hà Nội,,"Ba Đình, Hà Nội",VN
880,ChIJYd8XMUGrNTER6R0-tgM_LH0,Xèo Xèo Buffet Nướng BBQ,Nhà hàng món nướng,0386 375 357,"Xèo Xèo Buffet Nướng BBQ, 84 P. Trần Hữu Tước, Nam Đồng, Đống Đa, Hà Nội","Nam Đồng, Đống Đa",84 P. Trần Hữu Tước,Hà Nội,,"Đống Đa, Hà Nội",VN
882,ChIJY6Q8vU4pdTERp5dKLBUBKjc,Buffet Phố Biển 199k,Nhà hàng,0899 913 789,"Buffet Phố Biển 199k, 435 Đ. Thống Nhất, Phường 11, Gò Vấp, Thành phố Hồ Chí Minh 727010","Phường 11, Gò Vấp",435 Đ. Thống Nhất,Thành phố Hồ Chí Minh,727010.0,"Gò Vấp, Thành phố Hồ Chí Minh",VN
906,ChIJAQD00HCsNTERTsqziu3Cu-I,Nhà Hàng Long Quân - Buffet Lẩu,Nhà hàng,0387 969 209,"Nhà Hàng Long Quân - Buffet Lẩu, ngõ, 121 P. Lê Thanh Nghị, Đồng Tâm, Hai Bà Trưng, Hà Nội","Đồng Tâm, Hai Bà Trưng","ngõ, 121 P. Lê Thanh Nghị",Hà Nội,,"Hai Bà Trưng, Hà Nội",VN
917,ChIJCbqdooOrNTERKZJqwzsLBjk,Chọn Quán-Buffet Nướng&Lẩu,Nhà hàng,0369 413 924,"Chọn Quán-Buffet Nướng&Lẩu, 168 P. Hào Nam, Chợ Dừa, Đống Đa, Hà Nội","Chợ Dừa, Đống Đa",168 P. Hào Nam,Hà Nội,,"Đống Đa, Hà Nội",VN
927,ChIJTacI86atNTERN3EomVPl1co,Buffet Lẩu Mẹt,Nhà hàng,0967 958 448,"Buffet Lẩu Mẹt, số 2 Đ. Lĩnh Nam, Mai Động, Hoàng Mai, Hà Nội","Mai Động, Hoàng Mai",số 2 Đ. Lĩnh Nam,Hà Nội,,"Hoàng Mai, Hà Nội",VN
943,ChIJ_wunOOerNTERLpq3R-zv2OQ,Ẩm thực Hoàng - Buffet Lẩu Riêu Cua Và Hải Sản,Nhà hàng hải sản,0915 033 556,"Ẩm thực Hoàng - Buffet Lẩu Riêu Cua Và Hải Sản, 20 P. Bát Đàn, Hàng Bồ, Hoàn Kiếm, Hà Nội 100000","Hàng Bồ, Hoàn Kiếm",20 P. Bát Đàn,Hà Nội,100000.0,"Hoàn Kiếm, Hà Nội",VN
959,ChIJz9Ltvi1joDERDwkU8uyncmY,Nhà Hàng Sen Vàng,Nhà hàng hải sản,,"Nhà Hàng Sen Vàng, 143 Trần Văn Khéo, Cái Khế, Ninh Kiều, Cần Thơ","Cái Khế, Ninh Kiều",143 Trần Văn Khéo,Cần Thơ,,"Ninh Kiều, Cần Thơ",VN
